No.,Time,Source,Destination,Protocol,Length,Info,Time_Between,Website,Ttruncated
1,0,192.168.0.178,54.208.191.177,TLSv1.2,3578,Application Data,0,Blackboard,0
2,0.020962,54.208.191.177,192.168.0.178,TCP,60,443  >  55960 [ACK] Seq=1 Ack=3525 Win=763 Len=0,0.020962,Blackboard,0.020962
3,0.052999,54.208.191.177,192.168.0.178,TCP,1514,443  >  55960 [ACK] Seq=1 Ack=3525 Win=771 Len=1460 [TCP segment of a reassembled PDU],0.032037,Blackboard,0.032037
4,0.053521,54.208.191.177,192.168.0.178,TCP,2974,443  >  55960 [ACK] Seq=1461 Ack=3525 Win=771 Len=2920 [TCP segment of a reassembled PDU],0.000522,Blackboard,0.000522
5,0.053583,192.168.0.178,54.208.191.177,TCP,54,55960  >  443 [ACK] Seq=3525 Ack=4381 Win=4117 Len=0,6.2E-05,Blackboard,0.000061
6,0.054646,54.208.191.177,192.168.0.178,TCP,5894,443  >  55960 [ACK] Seq=4381 Ack=3525 Win=771 Len=5840 [TCP segment of a reassembled PDU],0.001063,Blackboard,0.001063
7,0.0547,192.168.0.178,54.208.191.177,TCP,54,55960  >  443 [ACK] Seq=3525 Ack=10221 Win=4117 Len=0,5.4E-05,Blackboard,0.000053
8,0.054887,54.208.191.177,192.168.0.178,TCP,1514,443  >  55960 [ACK] Seq=10221 Ack=3525 Win=771 Len=1460 [TCP segment of a reassembled PDU],0.000187,Blackboard,0.000187
9,0.054887,54.208.191.177,192.168.0.178,TCP,1514,443  >  55960 [ACK] Seq=11681 Ack=3525 Win=771 Len=1460 [TCP segment of a reassembled PDU],0,Blackboard,0
10,0.054887,54.208.191.177,192.168.0.178,TLSv1.2,4434,Application Data,0,Blackboard,0
11,0.054887,54.208.191.177,192.168.0.178,TLSv1.2,107,Application Data,0,Blackboard,0
12,0.054998,192.168.0.178,54.208.191.177,TCP,54,55960  >  443 [ACK] Seq=3525 Ack=17574 Win=4117 Len=0,0.000111,Blackboard,0.000111
13,0.559998,192.168.0.178,54.208.191.177,TLSv1.2,3476,Application Data,0.505,Blackboard,0.505
14,0.567657,192.168.0.178,54.208.191.177,TLSv1.2,3501,Application Data,0.007659,Blackboard,0.007658
15,0.578845,54.208.191.177,192.168.0.178,TCP,60,443  >  55960 [ACK] Seq=17574 Ack=6947 Win=771 Len=0,0.011188,Blackboard,0.011188
16,0.585717,54.208.191.177,192.168.0.178,TCP,60,443  >  55963 [ACK] Seq=1 Ack=3448 Win=727 Len=0,0.006872,Blackboard,0.006871
17,0.588986,54.208.191.177,192.168.0.178,TCP,1514,443  >  55960 [ACK] Seq=17574 Ack=6947 Win=771 Len=1460 [TCP segment of a reassembled PDU],0.003269,Blackboard,0.003268
18,0.589884,54.208.191.177,192.168.0.178,TLSv1.2,673,Application Data,0.000898,Blackboard,0.000897
19,0.589997,192.168.0.178,54.208.191.177,TCP,54,55960  >  443 [ACK] Seq=6947 Ack=19653 Win=4117 Len=0,0.000113,Blackboard,0.000113
20,0.59602,54.208.191.177,192.168.0.178,TCP,1514,443  >  55963 [ACK] Seq=1 Ack=3448 Win=727 Len=1460 [TCP segment of a reassembled PDU],0.006023,Blackboard,0.006023
21,0.59602,54.208.191.177,192.168.0.178,TLSv1.2,378,Application Data,0,Blackboard,0
22,0.596155,192.168.0.178,54.208.191.177,TCP,54,55963  >  443 [ACK] Seq=3448 Ack=1785 Win=513 Len=0,0.000135,Blackboard,0.000134
23,0.632685,192.168.0.178,54.208.191.177,TLSv1.2,3427,Application Data,0.03653,Blackboard,0.03653
24,0.653263,54.208.191.177,192.168.0.178,TCP,60,443  >  55963 [ACK] Seq=1785 Ack=6821 Win=763 Len=0,0.020578,Blackboard,0.020578
25,0.657705,54.208.191.177,192.168.0.178,TCP,1514,443  >  55963 [ACK] Seq=1785 Ack=6821 Win=763 Len=1460 [TCP segment of a reassembled PDU],0.004442,Blackboard,0.004441
26,0.65831,54.208.191.177,192.168.0.178,TCP,1514,443  >  55963 [ACK] Seq=3245 Ack=6821 Win=763 Len=1460 [TCP segment of a reassembled PDU],0.000605,Blackboard,0.000604
27,0.65831,54.208.191.177,192.168.0.178,TLSv1.2,902,Application Data,0,Blackboard,0
28,0.658435,192.168.0.178,54.208.191.177,TCP,54,55963  >  443 [ACK] Seq=6821 Ack=5553 Win=513 Len=0,0.000125,Blackboard,0.000125
29,0.67701,192.168.0.178,54.208.191.177,TLSv1.2,3520,Application Data,0.018575,Blackboard,0.018575
30,0.681923,192.168.0.178,54.208.191.177,TLSv1.2,3511,Application Data,0.004913,Blackboard,0.004912
31,0.682305,192.168.0.178,54.208.191.177,TLSv1.2,3542,Application Data,0.000382,Blackboard,0.000382
32,0.686871,192.168.0.178,54.208.191.177,TLSv1.2,3536,Application Data,0.004566,Blackboard,0.004565
33,0.690067,192.168.0.178,54.208.191.177,TLSv1.2,3649,Application Data,0.003196,Blackboard,0.003195
34,0.69035,192.168.0.178,54.208.191.177,TLSv1.2,3489,Application Data,0.000283,Blackboard,0.000283
35,0.693605,54.208.191.177,192.168.0.178,TCP,60,443  >  55963 [ACK] Seq=5553 Ack=10287 Win=763 Len=0,0.003255,Blackboard,0.003255
36,0.702397,54.208.191.177,192.168.0.178,TCP,60,443  >  55960 [ACK] Seq=19653 Ack=10404 Win=771 Len=0,0.008792,Blackboard,0.008792
37,0.702397,54.208.191.177,192.168.0.178,TCP,60,443  >  55961 [ACK] Seq=1 Ack=3489 Win=425 Len=0,0,Blackboard,0
38,0.70315,54.208.191.177,192.168.0.178,TCP,60,443  >  55959 [ACK] Seq=1 Ack=3483 Win=763 Len=0,0.000753,Blackboard,0.000753
39,0.705674,54.208.191.177,192.168.0.178,TLSv1.2,1439,Application Data,0.002524,Blackboard,0.002523
40,0.708537,192.168.0.178,54.208.191.177,TLSv1.2,3649,Application Data,0.002863,Blackboard,0.002862
41,0.712469,54.208.191.177,192.168.0.178,TCP,1514,443  >  55961 [ACK] Seq=1 Ack=3489 Win=425 Len=1460 [TCP segment of a reassembled PDU],0.003932,Blackboard,0.003932
42,0.713521,54.208.191.177,192.168.0.178,TLSv1.2,234,Application Data,0.001052,Blackboard,0.001051
43,0.713521,54.208.191.177,192.168.0.178,TLSv1.2,1014,Application Data,0,Blackboard,0
44,0.713521,54.208.191.177,192.168.0.178,TCP,60,443  >  55958 [ACK] Seq=1 Ack=3436 Win=565 Len=0,0,Blackboard,0
45,0.713521,54.208.191.177,192.168.0.178,TCP,60,443  >  55962 [ACK] Seq=1 Ack=3596 Win=425 Len=0,0,Blackboard,0
46,0.713678,192.168.0.178,54.208.191.177,TCP,54,55961  >  443 [ACK] Seq=3489 Ack=1641 Win=513 Len=0,0.000157,Blackboard,0.000157
47,0.715169,192.168.0.178,54.208.191.177,TLSv1.2,3649,Application Data,0.001491,Blackboard,0.001491
48,0.715321,192.168.0.178,54.208.191.177,TLSv1.2,3508,Application Data,0.000152,Blackboard,0.000151
49,0.718261,54.208.191.177,192.168.0.178,TLSv1.2,1398,Application Data,0.00294,Blackboard,0.00294
50,0.719362,192.168.0.178,54.208.191.177,TLSv1.2,3544,Application Data,0.001101,Blackboard,0.0011
51,0.72389,54.208.191.177,192.168.0.178,TCP,1514,443  >  55960 [ACK] Seq=19653 Ack=10404 Win=771 Len=1460 [TCP segment of a reassembled PDU],0.004528,Blackboard,0.004528
52,0.724159,54.208.191.177,192.168.0.178,TLSv1.2,509,Application Data,0.000269,Blackboard,0.000268
53,0.724228,192.168.0.178,54.208.191.177,TCP,54,55960  >  443 [ACK] Seq=10404 Ack=21568 Win=4117 Len=0,6.9E-05,Blackboard,0.000068
54,0.72552,192.168.0.178,54.208.191.177,TLSv1.2,3517,Application Data,0.001292,Blackboard,0.001292
55,0.725739,54.208.191.177,192.168.0.178,TCP,60,443  >  55963 [ACK] Seq=6938 Ack=13207 Win=765 Len=0,0.000219,Blackboard,0.000218
56,0.733484,54.208.191.177,192.168.0.178,TCP,60,443  >  55961 [ACK] Seq=1641 Ack=7084 Win=495 Len=0,0.007745,Blackboard,0.007745
57,0.738437,54.208.191.177,192.168.0.178,TCP,60,443  >  55959 [ACK] Seq=961 Ack=6937 Win=763 Len=0,0.004953,Blackboard,0.004952
58,0.741038,54.208.191.177,192.168.0.178,TCP,60,443  >  55958 [ACK] Seq=1345 Ack=6926 Win=635 Len=0,0.002601,Blackboard,0.0026
59,0.741552,54.208.191.177,192.168.0.178,TCP,1514,443  >  55961 [ACK] Seq=1641 Ack=7084 Win=495 Len=1460 [TCP segment of a reassembled PDU],0.000514,Blackboard,0.000514
60,0.741552,54.208.191.177,192.168.0.178,TLSv1.2,1067,Application Data,0,Blackboard,0
61,0.74167,192.168.0.178,54.208.191.177,TCP,54,55961  >  443 [ACK] Seq=7084 Ack=4114 Win=513 Len=0,0.000118,Blackboard,0.000118
62,0.744382,54.208.191.177,192.168.0.178,TCP,60,443  >  55960 [ACK] Seq=21568 Ack=13867 Win=771 Len=0,0.002712,Blackboard,0.002711
63,0.74647,192.168.0.178,54.208.191.177,TLSv1.2,3519,Application Data,0.002088,Blackboard,0.002087
64,0.747523,54.208.191.177,192.168.0.178,TLSv1.2,1466,Application Data,0.001053,Blackboard,0.001053
65,0.747979,54.208.191.177,192.168.0.178,TLSv1.2,1451,Application Data,0.000456,Blackboard,0.000455
66,0.749208,192.168.0.178,54.208.191.177,TLSv1.2,3619,Application Data,0.001229,Blackboard,0.001229
67,0.74941,192.168.0.178,54.208.191.177,TLSv1.2,3502,Application Data,0.000202,Blackboard,0.000202
68,0.753816,54.208.191.177,192.168.0.178,TLSv1.2,878,Application Data,0.004406,Blackboard,0.004406
69,0.754791,192.168.0.178,54.208.191.177,TLSv1.2,3548,Application Data,0.000975,Blackboard,0.000974
70,0.764583,54.208.191.177,192.168.0.178,TCP,7354,443  >  55962 [ACK] Seq=1 Ack=3596 Win=425 Len=7300 [TCP segment of a reassembled PDU],0.009792,Blackboard,0.009792
71,0.764958,192.168.0.178,54.208.191.177,TCP,54,55962  >  443 [ACK] Seq=3596 Ack=7301 Win=513 Len=0,0.000375,Blackboard,0.000375
72,0.765717,54.208.191.177,192.168.0.178,TLSv1.2,21954,"Application Data, Application Data",0.000759,Blackboard,0.000758
73,0.765717,54.208.191.177,192.168.0.178,TLSv1.2,405,Application Data,0,Blackboard,0
74,0.765907,192.168.0.178,54.208.191.177,TCP,54,55962  >  443 [ACK] Seq=3596 Ack=29552 Win=513 Len=0,0.00019,Blackboard,0.00019
75,0.768005,192.168.0.178,54.208.191.177,TLSv1.2,3534,Application Data,0.002098,Blackboard,0.002098
76,0.769127,54.208.191.177,192.168.0.178,TCP,60,443  >  55958 [ACK] Seq=2757 Ack=10491 Win=705 Len=0,0.001122,Blackboard,0.001121
77,0.769816,54.208.191.177,192.168.0.178,TCP,60,443  >  55960 [ACK] Seq=22965 Ack=17315 Win=771 Len=0,0.000689,Blackboard,0.000688
78,0.769816,54.208.191.177,192.168.0.178,TCP,60,443  >  55961 [ACK] Seq=4114 Ack=10549 Win=565 Len=0,0,Blackboard,0
79,0.788578,54.208.191.177,192.168.0.178,TCP,60,443  >  55963 [ACK] Seq=6938 Ack=13882 Win=771 Len=0,0.018762,Blackboard,0.018762
80,0.788578,54.208.191.177,192.168.0.178,TCP,60,443  >  55959 [ACK] Seq=1785 Ack=10431 Win=763 Len=0,0,Blackboard,0
81,0.788578,54.208.191.177,192.168.0.178,TCP,1514,443  >  55960 [ACK] Seq=22965 Ack=17315 Win=771 Len=1460 [TCP segment of a reassembled PDU],0,Blackboard,0
82,0.788578,54.208.191.177,192.168.0.178,TCP,1514,443  >  55961 [ACK] Seq=4114 Ack=10549 Win=565 Len=1460 [TCP segment of a reassembled PDU],0,Blackboard,0
83,0.788578,54.208.191.177,192.168.0.178,TLSv1.2,480,Application Data,0,Blackboard,0
84,0.788578,54.208.191.177,192.168.0.178,TLSv1.2,266,Application Data,0,Blackboard,0
85,0.788578,54.208.191.177,192.168.0.178,TCP,60,443  >  55962 [ACK] Seq=29552 Ack=7076 Win=495 Len=0,0,Blackboard,0
86,0.788578,54.208.191.177,192.168.0.178,TLSv1.2,1472,Application Data,0,Blackboard,0
87,0.788578,54.208.191.177,192.168.0.178,TCP,1514,443  >  55963 [ACK] Seq=6938 Ack=13882 Win=771 Len=1460 [TCP segment of a reassembled PDU],0,Blackboard,0
88,0.788915,192.168.0.178,54.208.191.177,TCP,54,55960  >  443 [ACK] Seq=17315 Ack=24851 Win=4117 Len=0,0.000337,Blackboard,0.000337
89,0.788996,192.168.0.178,54.208.191.177,TCP,54,55961  >  443 [ACK] Seq=10549 Ack=5786 Win=513 Len=0,8.1E-05,Blackboard,0.00008
90,0.801302,192.168.0.178,54.208.191.177,TLSv1.2,3619,Application Data,0.012306,Blackboard,0.012305
91,0.801948,192.168.0.178,54.208.191.177,TLSv1.2,336,Application Data,0.000646,Blackboard,0.000646
92,0.803244,192.168.0.178,54.208.191.177,TLSv1.2,3522,Application Data,0.001296,Blackboard,0.001295
93,0.803491,192.168.0.178,54.208.191.177,TLSv1.2,3490,Application Data,0.000247,Blackboard,0.000246
94,0.804101,54.208.191.177,192.168.0.178,TCP,1514,443  >  55963 [ACK] Seq=8398 Ack=13882 Win=771 Len=1460 [TCP segment of a reassembled PDU],0.00061,Blackboard,0.000609
95,0.804101,54.208.191.177,192.168.0.178,TCP,1514,443  >  55963 [ACK] Seq=9858 Ack=13882 Win=771 Len=1460 [TCP segment of a reassembled PDU],0,Blackboard,0
96,0.804101,54.208.191.177,192.168.0.178,TCP,10274,443  >  55963 [ACK] Seq=11318 Ack=13882 Win=771 Len=10220 [TCP segment of a reassembled PDU],0,Blackboard,0
97,0.804101,54.208.191.177,192.168.0.178,TLSv1.2,1464,Application Data,0,Blackboard,0
98,0.804366,192.168.0.178,54.208.191.177,TCP,54,55963  >  443 [ACK] Seq=13882 Ack=21538 Win=513 Len=0,0.000265,Blackboard,0.000265
99,0.806488,192.168.0.178,54.208.191.177,TLSv1.2,3602,Application Data,0.002122,Blackboard,0.002121
100,0.819658,54.208.191.177,192.168.0.178,TCP,60,443  >  55960 [ACK] Seq=24851 Ack=21162 Win=771 Len=0,0.01317,Blackboard,0.01317
101,0.819658,54.208.191.177,192.168.0.178,TCP,1514,443  >  55963 [ACK] Seq=21538 Ack=13882 Win=771 Len=1460 [TCP segment of a reassembled PDU],0,Blackboard,0
102,0.822714,54.208.191.177,192.168.0.178,TLSv1.2,13194,"Application Data, Application Data",0.003056,Blackboard,0.003055
103,0.822714,54.208.191.177,192.168.0.178,TLSv1.2,375,Application Data,0,Blackboard,0
104,0.822939,192.168.0.178,54.208.191.177,TCP,54,55963  >  443 [ACK] Seq=13882 Ack=36459 Win=513 Len=0,0.000225,Blackboard,0.000225
105,0.825841,54.208.191.177,192.168.0.178,TCP,1514,443  >  55958 [ACK] Seq=2757 Ack=10491 Win=705 Len=1460 [TCP segment of a reassembled PDU],0.002902,Blackboard,0.002902
106,0.829599,54.208.191.177,192.168.0.178,TCP,8814,443  >  55958 [ACK] Seq=4217 Ack=10491 Win=705 Len=8760 [TCP segment of a reassembled PDU],0.003758,Blackboard,0.003757
107,0.829599,54.208.191.177,192.168.0.178,TLSv1.2,1046,Application Data,0,Blackboard,0
108,0.829599,54.208.191.177,192.168.0.178,TCP,60,443  >  55959 [ACK] Seq=3203 Ack=13867 Win=763 Len=0,0,Blackboard,0
109,0.829599,54.208.191.177,192.168.0.178,TCP,60,443  >  55962 [ACK] Seq=30962 Ack=10624 Win=565 Len=0,0,Blackboard,0
110,0.829599,54.208.191.177,192.168.0.178,TCP,60,443  >  55961 [ACK] Seq=5786 Ack=14017 Win=635 Len=0,0,Blackboard,0
111,0.829844,192.168.0.178,54.208.191.177,TCP,54,55958  >  443 [ACK] Seq=10491 Ack=13969 Win=513 Len=0,0.000245,Blackboard,0.000245
112,0.831486,54.208.191.177,192.168.0.178,TCP,1514,443  >  55960 [ACK] Seq=24851 Ack=21162 Win=771 Len=1460 [TCP segment of a reassembled PDU],0.001642,Blackboard,0.001641
113,0.831486,54.208.191.177,192.168.0.178,TLSv1.2,124,Application Data,0,Blackboard,0
114,0.831618,192.168.0.178,54.208.191.177,TCP,54,55960  >  443 [ACK] Seq=21162 Ack=26381 Win=4117 Len=0,0.000132,Blackboard,0.000132
115,0.834051,54.208.191.177,192.168.0.178,TLSv1.2,1454,Application Data,0.002433,Blackboard,0.002433
116,0.834051,54.208.191.177,192.168.0.178,TLSv1.2,1439,Application Data,0,Blackboard,0
117,0.834886,54.208.191.177,192.168.0.178,TLSv1.2,1378,Application Data,0.000835,Blackboard,0.000835
118,0.839807,192.168.0.178,54.208.191.177,TLSv1.2,4809,Application Data,0.004921,Blackboard,0.00492
119,0.840687,192.168.0.178,54.208.191.177,TLSv1.2,3601,Application Data,0.00088,Blackboard,0.000879
120,0.85908,54.208.191.177,192.168.0.178,TCP,60,443  >  55963 [ACK] Seq=36459 Ack=18637 Win=771 Len=0,0.018393,Blackboard,0.018393
121,0.866136,54.208.191.177,192.168.0.178,TCP,60,443  >  55960 [ACK] Seq=26381 Ack=24709 Win=771 Len=0,0.007056,Blackboard,0.007056
122,0.880416,192.168.0.178,54.208.191.177,TCP,54,55959  >  443 [ACK] Seq=13867 Ack=4603 Win=513 Len=0,0.01428,Blackboard,0.01428
123,0.880416,192.168.0.178,54.208.191.177,TCP,54,55962  >  443 [ACK] Seq=10624 Ack=32286 Win=513 Len=0,0,Blackboard,0
124,0.880442,192.168.0.178,54.208.191.177,TCP,54,55961  >  443 [ACK] Seq=14017 Ack=7171 Win=507 Len=0,2.6E-05,Blackboard,0.000025
125,0.880492,54.208.191.177,192.168.0.178,TLSv1.2,1400,Application Data,5E-05,Blackboard,0.00005
126,0.925346,192.168.0.178,54.208.191.177,TCP,54,55960  >  443 [ACK] Seq=24709 Ack=27727 Win=4112 Len=0,0.044854,Blackboard,0.044853
127,0.93653,54.208.191.177,192.168.0.178,TCP,1514,443  >  55963 [ACK] Seq=36459 Ack=18637 Win=771 Len=1460 [TCP segment of a reassembled PDU],0.011184,Blackboard,0.011184
128,0.938104,54.208.191.177,192.168.0.178,TCP,1514,443  >  55963 [ACK] Seq=37919 Ack=18637 Win=771 Len=1460 [TCP segment of a reassembled PDU],0.001574,Blackboard,0.001574
129,0.938104,54.208.191.177,192.168.0.178,TCP,1514,443  >  55963 [ACK] Seq=39379 Ack=18637 Win=771 Len=1460 [TCP segment of a reassembled PDU],0,Blackboard,0
130,0.938246,192.168.0.178,54.208.191.177,TCP,54,55963  >  443 [ACK] Seq=18637 Ack=40839 Win=513 Len=0,0.000142,Blackboard,0.000141
131,0.939196,54.208.191.177,192.168.0.178,TLSv1.2,23414,"Application Data, Application Data",0.00095,Blackboard,0.00095
132,0.940031,192.168.0.178,54.208.191.177,TCP,54,55963  >  443 [ACK] Seq=18637 Ack=64199 Win=513 Len=0,0.000835,Blackboard,0.000834
133,0.940328,54.208.191.177,192.168.0.178,TCP,1514,443  >  55963 [ACK] Seq=64199 Ack=18637 Win=771 Len=1460 [TCP segment of a reassembled PDU],0.000297,Blackboard,0.000297
134,0.940328,54.208.191.177,192.168.0.178,TLSv1.2,1439,Application Data,0,Blackboard,0
135,0.940551,192.168.0.178,54.208.191.177,TCP,54,55963  >  443 [ACK] Seq=18637 Ack=67044 Win=513 Len=0,0.000223,Blackboard,0.000222
136,0.965907,192.168.0.178,54.208.191.177,TLSv1.2,3544,Application Data,0.025356,Blackboard,0.025355
137,0.969213,192.168.0.178,54.208.191.177,TLSv1.2,3517,Application Data,0.003306,Blackboard,0.003306
138,0.983843,54.208.191.177,192.168.0.178,TCP,60,443  >  55963 [ACK] Seq=67044 Ack=21557 Win=771 Len=0,0.01463,Blackboard,0.01463
139,0.985478,54.208.191.177,192.168.0.178,TCP,60,443  >  55960 [ACK] Seq=27727 Ack=28172 Win=771 Len=0,0.001635,Blackboard,0.001634
140,0.989314,54.208.191.177,192.168.0.178,TCP,60,443  >  55963 [ACK] Seq=67044 Ack=22127 Win=771 Len=0,0.003836,Blackboard,0.003836
141,0.991307,54.208.191.177,192.168.0.178,TLSv1.2,1376,Application Data,0.001993,Blackboard,0.001993
142,0.992644,54.208.191.177,192.168.0.178,TLSv1.2,1471,Application Data,0.001337,Blackboard,0.001336
143,0.993588,192.168.0.178,54.208.191.177,TLSv1.2,3516,Application Data,0.000944,Blackboard,0.000944
144,1.010961,54.208.191.177,192.168.0.178,TCP,60,443  >  55960 [ACK] Seq=29049 Ack=31634 Win=771 Len=0,0.017373,Blackboard,0.017373
145,1.017805,54.208.191.177,192.168.0.178,TLSv1.2,1432,Application Data,0.006844,Blackboard,0.006844
146,1.045976,192.168.0.178,54.208.191.177,TCP,54,55963  >  443 [ACK] Seq=22127 Ack=68461 Win=507 Len=0,0.028171,Blackboard,0.02817
147,1.061686,192.168.0.178,54.208.191.177,TCP,54,55960  >  443 [ACK] Seq=31634 Ack=30427 Win=4112 Len=0,0.01571,Blackboard,0.015709
148,1.128862,192.168.0.178,54.208.191.177,TLSv1.2,3541,Application Data,0.067176,Blackboard,0.067176
149,1.146479,54.208.191.177,192.168.0.178,TCP,60,443  >  55960 [ACK] Seq=30427 Ack=35121 Win=771 Len=0,0.017617,Blackboard,0.017617
150,1.154166,54.208.191.177,192.168.0.178,TLSv1.2,1468,Application Data,0.007687,Blackboard,0.007687
151,1.200538,192.168.0.178,54.208.191.177,TCP,54,55960  >  443 [ACK] Seq=35121 Ack=31841 Win=4117 Len=0,0.046372,Blackboard,0.046372
152,1.348745,192.168.0.178,54.208.191.177,TLSv1.2,3568,Application Data,0.148207,Blackboard,0.148207
153,1.368249,54.208.191.177,192.168.0.178,TCP,60,443  >  55960 [ACK] Seq=31841 Ack=38635 Win=771 Len=0,0.019504,Blackboard,0.019504
154,1.431926,54.208.191.177,192.168.0.178,TLSv1.2,879,Application Data,0.063677,Blackboard,0.063677
155,1.479589,192.168.0.178,54.208.191.177,TCP,54,55960  >  443 [ACK] Seq=38635 Ack=32666 Win=4114 Len=0,0.047663,Blackboard,0.047663
156,1.56777,192.168.0.178,54.208.191.177,TLSv1.2,3653,Application Data,0.088181,Blackboard,0.088181
157,1.567866,192.168.0.178,54.208.191.177,TLSv1.2,159,Application Data,9.6E-05,Blackboard,0.000095
158,1.590894,54.208.191.177,192.168.0.178,TCP,60,443  >  55960 [ACK] Seq=32666 Ack=42339 Win=771 Len=0,0.023028,Blackboard,0.023028
159,1.593993,192.168.0.178,54.208.191.177,TLSv1.2,3547,Application Data,0.003099,Blackboard,0.003098
160,1.598595,192.168.0.178,54.208.191.177,TLSv1.2,4467,Application Data,0.004602,Blackboard,0.004601
161,1.599972,54.208.191.177,192.168.0.178,TCP,1514,443  >  55960 [ACK] Seq=32666 Ack=42339 Win=771 Len=1460 [TCP segment of a reassembled PDU],0.001377,Blackboard,0.001376
162,1.600331,54.208.191.177,192.168.0.178,TLSv1.2,495,Application Data,0.000359,Blackboard,0.000358
163,1.600367,192.168.0.178,54.208.191.177,TCP,54,55960  >  443 [ACK] Seq=42339 Ack=34567 Win=4117 Len=0,3.6E-05,Blackboard,0.000036
164,1.618759,54.208.191.177,192.168.0.178,TCP,60,443  >  55958 [ACK] Seq=13969 Ack=14904 Win=757 Len=0,0.018392,Blackboard,0.018392
165,1.619869,54.208.191.177,192.168.0.178,TCP,60,443  >  55963 [ACK] Seq=68461 Ack=25620 Win=771 Len=0,0.00111,Blackboard,0.001109
166,1.625684,54.208.191.177,192.168.0.178,TCP,1514,443  >  55958 [ACK] Seq=13969 Ack=14904 Win=757 Len=1460 [TCP segment of a reassembled PDU],0.005815,Blackboard,0.005814
167,1.626141,54.208.191.177,192.168.0.178,TLSv1.2,642,Application Data,0.000457,Blackboard,0.000457
168,1.626201,192.168.0.178,54.208.191.177,TCP,54,55958  >  443 [ACK] Seq=14904 Ack=16017 Win=513 Len=0,6E-05,Blackboard,0.000059
169,1.628137,192.168.0.178,54.208.191.177,TLSv1.2,4469,Application Data,0.001936,Blackboard,0.001935
170,1.638387,192.168.0.178,54.208.191.177,TLSv1.2,3883,Application Data,0.01025,Blackboard,0.01025
171,1.644751,54.208.191.177,192.168.0.178,TCP,60,443  >  55958 [ACK] Seq=16017 Ack=17824 Win=762 Len=0,0.006364,Blackboard,0.006364
172,1.650965,54.208.191.177,192.168.0.178,TCP,60,443  >  55958 [ACK] Seq=16017 Ack=19319 Win=768 Len=0,0.006214,Blackboard,0.006213
173,1.657747,54.208.191.177,192.168.0.178,TCP,60,443  >  55960 [ACK] Seq=34567 Ack=46168 Win=771 Len=0,0.006782,Blackboard,0.006782
174,1.662651,54.208.191.177,192.168.0.178,TCP,1514,443  >  55960 [ACK] Seq=34567 Ack=46168 Win=771 Len=1460 [TCP segment of a reassembled PDU],0.004904,Blackboard,0.004904
175,1.664902,54.208.191.177,192.168.0.178,TLSv1.2,60,Application Data,0.002251,Blackboard,0.002251
176,1.664999,192.168.0.178,54.208.191.177,TCP,54,55960  >  443 [ACK] Seq=46168 Ack=36029 Win=4117 Len=0,9.7E-05,Blackboard,0.000096
177,1.669139,192.168.0.178,54.208.191.177,TLSv1.2,3883,Application Data,0.00414,Blackboard,0.00414
178,1.684355,192.168.0.178,54.208.191.177,TLSv1.2,3627,Application Data,0.015216,Blackboard,0.015216
179,1.684598,192.168.0.178,54.208.191.177,TLSv1.2,305,Application Data,0.000243,Blackboard,0.000242
180,1.687198,54.208.191.177,192.168.0.178,TCP,60,443  >  55960 [ACK] Seq=36029 Ack=49997 Win=771 Len=0,0.0026,Blackboard,0.002599
181,1.692677,54.208.191.177,192.168.0.178,TCP,1514,443  >  55958 [ACK] Seq=16017 Ack=19319 Win=768 Len=1460 [TCP segment of a reassembled PDU],0.005479,Blackboard,0.005479
182,1.693659,54.208.191.177,192.168.0.178,TCP,1514,443  >  55958 [ACK] Seq=17477 Ack=19319 Win=768 Len=1460 [TCP segment of a reassembled PDU],0.000982,Blackboard,0.000982
183,1.693659,54.208.191.177,192.168.0.178,TLSv1.2,275,Application Data,0,Blackboard,0
184,1.693806,192.168.0.178,54.208.191.177,TCP,54,55958  >  443 [ACK] Seq=19319 Ack=19158 Win=513 Len=0,0.000147,Blackboard,0.000146
185,1.705262,54.208.191.177,192.168.0.178,TCP,60,443  >  55962 [ACK] Seq=32286 Ack=14197 Win=635 Len=0,0.011456,Blackboard,0.011456
186,1.705645,54.208.191.177,192.168.0.178,TLSv1.2,561,Application Data,0.000383,Blackboard,0.000383
187,1.710408,54.208.191.177,192.168.0.178,TLSv1.2,878,Application Data,0.004763,Blackboard,0.004762
188,1.734275,54.208.191.177,192.168.0.178,TCP,1514,443  >  55960 [ACK] Seq=36029 Ack=49997 Win=771 Len=1460 [TCP segment of a reassembled PDU],0.023867,Blackboard,0.023867
189,1.73468,54.208.191.177,192.168.0.178,TLSv1.2,1307,Application Data,0.000405,Blackboard,0.000404
190,1.734791,192.168.0.178,54.208.191.177,TCP,54,55960  >  443 [ACK] Seq=49997 Ack=38742 Win=4117 Len=0,0.000111,Blackboard,0.00011
191,1.754934,192.168.0.178,54.208.191.177,TCP,54,55962  >  443 [ACK] Seq=14448 Ack=32793 Win=511 Len=0,0.020143,Blackboard,0.020143
192,1.754937,192.168.0.178,54.208.191.177,TCP,54,55963  >  443 [ACK] Seq=25620 Ack=69285 Win=513 Len=0,3E-06,Blackboard,0.000002
193,1.775395,192.168.0.178,54.208.191.177,TLSv1.2,3536,Application Data,0.020458,Blackboard,0.020458
194,1.791697,54.208.191.177,192.168.0.178,TCP,60,443  >  55960 [ACK] Seq=38742 Ack=52917 Win=771 Len=0,0.016302,Blackboard,0.016302
195,1.811284,54.208.191.177,192.168.0.178,TLSv1.2,1408,Application Data,0.019587,Blackboard,0.019586
196,1.843728,192.168.0.178,54.208.191.177,TLSv1.2,3492,Application Data,0.032444,Blackboard,0.032444
197,1.863157,54.208.191.177,192.168.0.178,TCP,60,443  >  55960 [ACK] Seq=40096 Ack=56917 Win=771 Len=0,0.019429,Blackboard,0.019428
198,1.873005,54.208.191.177,192.168.0.178,TCP,1514,443  >  55960 [ACK] Seq=40096 Ack=56917 Win=771 Len=1460 [TCP segment of a reassembled PDU],0.009848,Blackboard,0.009848
199,1.873005,54.208.191.177,192.168.0.178,TLSv1.2,324,Application Data,0,Blackboard,0
200,1.873088,192.168.0.178,54.208.191.177,TCP,54,55960  >  443 [ACK] Seq=56917 Ack=41826 Win=4117 Len=0,8.3E-05,Blackboard,0.000083
201,2.096951,192.168.0.178,54.208.191.177,TLSv1.2,3536,Application Data,0.223863,Blackboard,0.223863
202,2.118644,54.208.191.177,192.168.0.178,TCP,60,443  >  55960 [ACK] Seq=41826 Ack=60399 Win=771 Len=0,0.021693,Blackboard,0.021693
203,2.199084,54.208.191.177,192.168.0.178,TLSv1.2,1406,Application Data,0.08044,Blackboard,0.080439
204,2.202852,192.168.0.178,54.208.191.177,TLSv1.2,768,Application Data,0.003768,Blackboard,0.003767
205,2.20301,192.168.0.178,54.208.191.177,TLSv1.2,776,Application Data,0.000158,Blackboard,0.000157
206,2.23345,54.208.191.177,192.168.0.178,TCP,1514,443  >  56006 [ACK] Seq=1 Ack=723 Win=126 Len=1460 [TCP segment of a reassembled PDU],0.03044,Blackboard,0.03044
207,2.234719,54.208.191.177,192.168.0.178,TCP,1514,443  >  56006 [ACK] Seq=1461 Ack=723 Win=126 Len=1460 [TCP segment of a reassembled PDU],0.001269,Blackboard,0.001269
208,2.234719,54.208.191.177,192.168.0.178,TLSv1.2,277,Application Data,0,Blackboard,0
209,2.234808,192.168.0.178,54.208.191.177,TCP,54,56006  >  443 [ACK] Seq=723 Ack=3144 Win=513 Len=0,8.9E-05,Blackboard,0.000089
210,2.249259,192.168.0.178,54.208.191.177,TCP,54,55960  >  443 [ACK] Seq=60399 Ack=43178 Win=4112 Len=0,0.014451,Blackboard,0.01445
211,2.251357,54.208.191.177,192.168.0.178,TCP,1514,443  >  56005 [ACK] Seq=1 Ack=715 Win=255 Len=1460 [TCP segment of a reassembled PDU],0.002098,Blackboard,0.002098
212,2.252077,54.208.191.177,192.168.0.178,TLSv1.2,636,Application Data,0.00072,Blackboard,0.000719
213,2.252163,192.168.0.178,54.208.191.177,TCP,54,56005  >  443 [ACK] Seq=715 Ack=2043 Win=513 Len=0,8.6E-05,Blackboard,0.000086
214,2.299466,192.168.0.178,54.208.191.177,TLSv1.2,3536,Application Data,0.047303,Blackboard,0.047302
215,2.326854,54.208.191.177,192.168.0.178,TCP,60,443  >  55960 [ACK] Seq=43178 Ack=63881 Win=771 Len=0,0.027388,Blackboard,0.027388
216,2.336367,54.208.191.177,192.168.0.178,TLSv1.2,1409,Application Data,0.009513,Blackboard,0.009513
217,2.389063,192.168.0.178,54.208.191.177,TCP,54,55960  >  443 [ACK] Seq=63881 Ack=44533 Win=4117 Len=0,0.052696,Blackboard,0.052696
218,2.571598,192.168.0.178,54.208.191.177,TLSv1.2,3654,Application Data,0.182535,Blackboard,0.182535
219,2.57169,192.168.0.178,54.208.191.177,TLSv1.2,385,Application Data,9.2E-05,Blackboard,0.000091
220,2.589445,54.208.191.177,192.168.0.178,TCP,60,443  >  55960 [ACK] Seq=44533 Ack=67812 Win=771 Len=0,0.017755,Blackboard,0.017755
221,2.839343,192.168.0.178,54.208.191.177,TLSv1.2,3619,Application Data,0.249898,Blackboard,0.249898
222,2.83952,192.168.0.178,54.208.191.177,TLSv1.2,1079,Application Data,0.000177,Blackboard,0.000176
223,2.855539,54.208.191.177,192.168.0.178,TCP,60,443  >  55963 [ACK] Seq=69285 Ack=29185 Win=771 Len=0,0.016019,Blackboard,0.016019
224,2.900054,54.208.191.177,192.168.0.178,TCP,60,443  >  55963 [ACK] Seq=69285 Ack=30210 Win=771 Len=0,0.044515,Blackboard,0.044515
225,2.91444,54.208.191.177,192.168.0.178,TCP,1514,443  >  55963 [ACK] Seq=69285 Ack=30210 Win=771 Len=1460 [TCP segment of a reassembled PDU],0.014386,Blackboard,0.014386
226,2.914854,54.208.191.177,192.168.0.178,TLSv1.2,1054,Application Data,0.000414,Blackboard,0.000414
227,2.915088,192.168.0.178,54.208.191.177,TCP,54,55963  >  443 [ACK] Seq=30210 Ack=71745 Win=513 Len=0,0.000234,Blackboard,0.000233
228,3.395616,54.208.191.177,192.168.0.178,TCP,1514,443  >  55960 [ACK] Seq=44533 Ack=67812 Win=771 Len=1460 [TCP segment of a reassembled PDU],0.480528,Blackboard,0.480528
229,3.397012,54.208.191.177,192.168.0.178,TCP,14654,443  >  55960 [ACK] Seq=45993 Ack=67812 Win=771 Len=14600 [TCP segment of a reassembled PDU],0.001396,Blackboard,0.001396
230,3.397012,54.208.191.177,192.168.0.178,TLSv1.2,438,"Application Data, Application Data",0,Blackboard,0
231,3.397012,54.208.191.177,192.168.0.178,TCP,7354,443  >  55960 [ACK] Seq=60977 Ack=67812 Win=771 Len=7300 [TCP segment of a reassembled PDU],0,Blackboard,0
232,3.397101,192.168.0.178,54.208.191.177,TCP,54,55960  >  443 [ACK] Seq=67812 Ack=68277 Win=4117 Len=0,8.9E-05,Blackboard,0.000089
233,3.401714,54.208.191.177,192.168.0.178,TCP,8814,443  >  55960 [ACK] Seq=68277 Ack=67812 Win=771 Len=8760 [TCP segment of a reassembled PDU],0.004613,Blackboard,0.004612
234,3.401714,54.208.191.177,192.168.0.178,TLSv1.2,407,Application Data,0,Blackboard,0
235,3.401714,54.208.191.177,192.168.0.178,TCP,16114,443  >  55960 [ACK] Seq=77390 Ack=67812 Win=771 Len=16060 [TCP segment of a reassembled PDU],0,Blackboard,0
236,3.401714,54.208.191.177,192.168.0.178,TLSv1.2,407,Application Data,0,Blackboard,0
237,3.401714,54.208.191.177,192.168.0.178,TCP,16114,443  >  55960 [ACK] Seq=93803 Ack=67812 Win=771 Len=16060 [TCP segment of a reassembled PDU],0,Blackboard,0
238,3.401714,54.208.191.177,192.168.0.178,TLSv1.2,407,Application Data,0,Blackboard,0
239,3.401714,54.208.191.177,192.168.0.178,TLSv1.2,32174,Application Data,0,Blackboard,0
240,3.401714,54.208.191.177,192.168.0.178,TLSv1.2,760,Application Data,0,Blackboard,0
241,3.401714,54.208.191.177,192.168.0.178,TCP,16114,443  >  55960 [ACK] Seq=143042 Ack=67812 Win=771 Len=16060 [TCP segment of a reassembled PDU],0,Blackboard,0
242,3.401714,54.208.191.177,192.168.0.178,TLSv1.2,407,Application Data,0,Blackboard,0
243,3.401714,54.208.191.177,192.168.0.178,TCP,16114,443  >  55960 [ACK] Seq=159455 Ack=67812 Win=771 Len=16060 [TCP segment of a reassembled PDU],0,Blackboard,0
244,3.401714,54.208.191.177,192.168.0.178,TLSv1.2,399,Application Data,0,Blackboard,0
245,3.401951,192.168.0.178,54.208.191.177,TCP,54,55960  >  443 [ACK] Seq=67812 Ack=175860 Win=3986 Len=0,0.000237,Blackboard,0.000236
246,3.40221,192.168.0.178,54.208.191.177,TCP,54,[TCP Window Update] 55960  >  443 [ACK] Seq=67812 Ack=175860 Win=4117 Len=0,0.000259,Blackboard,0.000259
247,3.407733,54.208.191.177,192.168.0.178,TCP,16114,443  >  55960 [ACK] Seq=175860 Ack=67812 Win=771 Len=16060 [TCP segment of a reassembled PDU],0.005523,Blackboard,0.005522
248,3.407733,54.208.191.177,192.168.0.178,TLSv1.2,407,Application Data,0,Blackboard,0
249,3.407733,54.208.191.177,192.168.0.178,TCP,16114,443  >  55960 [ACK] Seq=192273 Ack=67812 Win=771 Len=16060 [TCP segment of a reassembled PDU],0,Blackboard,0
250,3.407733,54.208.191.177,192.168.0.178,TLSv1.2,407,Application Data,0,Blackboard,0
251,3.407733,54.208.191.177,192.168.0.178,TCP,16114,443  >  55960 [ACK] Seq=208686 Ack=67812 Win=771 Len=16060 [TCP segment of a reassembled PDU],0,Blackboard,0
252,3.407733,54.208.191.177,192.168.0.178,TLSv1.2,407,Application Data,0,Blackboard,0
253,3.407733,54.208.191.177,192.168.0.178,TCP,16114,443  >  55960 [ACK] Seq=225099 Ack=67812 Win=771 Len=16060 [TCP segment of a reassembled PDU],0,Blackboard,0
254,3.407733,54.208.191.177,192.168.0.178,TLSv1.2,407,Application Data,0,Blackboard,0
255,3.407733,54.208.191.177,192.168.0.178,TCP,16114,443  >  55960 [ACK] Seq=241512 Ack=67812 Win=771 Len=16060 [TCP segment of a reassembled PDU],0,Blackboard,0
256,3.407733,54.208.191.177,192.168.0.178,TLSv1.2,407,Application Data,0,Blackboard,0
257,3.407733,54.208.191.177,192.168.0.178,TCP,16114,443  >  55960 [ACK] Seq=257925 Ack=67812 Win=771 Len=16060 [TCP segment of a reassembled PDU],0,Blackboard,0
258,3.407733,54.208.191.177,192.168.0.178,TLSv1.2,407,Application Data,0,Blackboard,0
259,3.407733,54.208.191.177,192.168.0.178,TCP,16114,443  >  55960 [ACK] Seq=274338 Ack=67812 Win=771 Len=16060 [TCP segment of a reassembled PDU],0,Blackboard,0
260,3.407733,54.208.191.177,192.168.0.178,TLSv1.2,407,Application Data,0,Blackboard,0
261,3.407733,54.208.191.177,192.168.0.178,TCP,16114,443  >  55960 [ACK] Seq=290751 Ack=67812 Win=771 Len=16060 [TCP segment of a reassembled PDU],0,Blackboard,0
262,3.407733,54.208.191.177,192.168.0.178,TLSv1.2,407,Application Data,0,Blackboard,0
263,3.408102,192.168.0.178,54.208.191.177,TCP,54,55960  >  443 [ACK] Seq=67812 Ack=307164 Win=3861 Len=0,0.000369,Blackboard,0.000369
264,3.408107,192.168.0.178,54.208.191.177,TCP,54,[TCP Window Update] 55960  >  443 [ACK] Seq=67812 Ack=307164 Win=4117 Len=0,5E-06,Blackboard,0.000005
265,3.411249,54.208.191.177,192.168.0.178,TCP,16114,443  >  55960 [ACK] Seq=307164 Ack=67812 Win=771 Len=16060 [TCP segment of a reassembled PDU],0.003142,Blackboard,0.003141
266,3.411249,54.208.191.177,192.168.0.178,TLSv1.2,407,Application Data,0,Blackboard,0
267,3.411345,192.168.0.178,54.208.191.177,TCP,54,55960  >  443 [ACK] Seq=67812 Ack=323577 Win=4117 Len=0,9.6E-05,Blackboard,0.000095
268,3.427296,54.208.191.177,192.168.0.178,TCP,1514,443  >  55960 [ACK] Seq=323577 Ack=67812 Win=771 Len=1460 [TCP segment of a reassembled PDU],0.015951,Blackboard,0.015951
269,3.427353,192.168.0.178,54.208.191.177,TCP,54,55960  >  443 [ACK] Seq=67812 Ack=325037 Win=4117 Len=0,5.7E-05,Blackboard,0.000056
270,3.428602,54.208.191.177,192.168.0.178,TCP,1514,443  >  55960 [ACK] Seq=325037 Ack=67812 Win=771 Len=1460 [TCP segment of a reassembled PDU],0.001249,Blackboard,0.001249
271,3.428602,54.208.191.177,192.168.0.178,TCP,1514,443  >  55960 [ACK] Seq=326497 Ack=67812 Win=771 Len=1460 [TCP segment of a reassembled PDU],0,Blackboard,0
272,3.428644,192.168.0.178,54.208.191.177,TCP,54,55960  >  443 [ACK] Seq=67812 Ack=327957 Win=4117 Len=0,4.2E-05,Blackboard,0.000041
273,3.428783,54.208.191.177,192.168.0.178,TCP,1514,443  >  55960 [ACK] Seq=327957 Ack=67812 Win=771 Len=1460 [TCP segment of a reassembled PDU],0.000139,Blackboard,0.000139
274,3.430079,54.208.191.177,192.168.0.178,TLSv1.2,14654,Application Data,0.001296,Blackboard,0.001295
275,3.430103,192.168.0.178,54.208.191.177,TCP,54,55960  >  443 [ACK] Seq=67812 Ack=344017 Win=4117 Len=0,2.4E-05,Blackboard,0.000023
276,3.433074,54.208.191.177,192.168.0.178,TCP,1514,443  >  55960 [ACK] Seq=344017 Ack=67812 Win=771 Len=1460 [TCP segment of a reassembled PDU],0.002971,Blackboard,0.002971
277,3.433074,54.208.191.177,192.168.0.178,TCP,1514,443  >  55960 [ACK] Seq=345477 Ack=67812 Win=771 Len=1460 [TCP segment of a reassembled PDU],0,Blackboard,0
278,3.433074,54.208.191.177,192.168.0.178,TLSv1.2,64294,"Application Data, Application Data, Application Data, Application Data",0,Blackboard,0
279,3.433074,54.208.191.177,192.168.0.178,TCP,8814,443  >  55960 [ACK] Seq=411177 Ack=67812 Win=771 Len=8760 [TCP segment of a reassembled PDU],0,Blackboard,0
280,3.433168,192.168.0.178,54.208.191.177,TCP,54,55960  >  443 [ACK] Seq=67812 Ack=419937 Win=4083 Len=0,9.4E-05,Blackboard,0.000094
281,3.433206,192.168.0.178,54.208.191.177,TCP,54,[TCP Window Update] 55960  >  443 [ACK] Seq=67812 Ack=419937 Win=4117 Len=0,3.8E-05,Blackboard,0.000037
282,3.436829,54.208.191.177,192.168.0.178,TLSv1.2,64294,"Application Data, Application Data, Application Data, Application Data",0.003623,Blackboard,0.003622
283,3.436829,54.208.191.177,192.168.0.178,TLSv1.2,29254,"Application Data, Application Data",0,Blackboard,0
284,3.436911,192.168.0.178,54.208.191.177,TCP,54,55960  >  443 [ACK] Seq=67812 Ack=513377 Win=4117 Len=0,8.2E-05,Blackboard,0.000081
285,3.438617,54.208.191.177,192.168.0.178,TLSv1.2,33634,"Application Data, Application Data",0.001706,Blackboard,0.001705
286,3.438617,54.208.191.177,192.168.0.178,TLSv1.2,388,Application Data,0,Blackboard,0
287,3.438688,192.168.0.178,54.208.191.177,TCP,54,55960  >  443 [ACK] Seq=67812 Ack=547291 Win=4117 Len=0,7.1E-05,Blackboard,0.000071
288,3.583127,192.168.0.178,54.208.191.177,TLSv1.2,3608,Application Data,0.144439,Blackboard,0.144439
289,3.584058,192.168.0.178,54.208.191.177,TLSv1.2,3526,Application Data,0.000931,Blackboard,0.000931
290,3.601318,54.208.191.177,192.168.0.178,TCP,60,443  >  55960 [ACK] Seq=547291 Ack=70732 Win=771 Len=0,0.01726,Blackboard,0.017259
291,3.618191,54.208.191.177,192.168.0.178,TCP,60,443  >  55963 [ACK] Seq=71745 Ack=33682 Win=763 Len=0,0.016873,Blackboard,0.016872
292,3.618688,54.208.191.177,192.168.0.178,TCP,1514,443  >  55960 [ACK] Seq=547291 Ack=71366 Win=771 Len=1460 [TCP segment of a reassembled PDU],0.000497,Blackboard,0.000497
293,3.618688,54.208.191.177,192.168.0.178,TCP,1514,443  >  55963 [ACK] Seq=71745 Ack=33682 Win=771 Len=1460 [TCP segment of a reassembled PDU],0,Blackboard,0
294,3.618688,54.208.191.177,192.168.0.178,TLSv1.2,1061,Application Data,0,Blackboard,0
295,3.618688,54.208.191.177,192.168.0.178,TLSv1.2,571,Application Data,0,Blackboard,0
296,3.618802,192.168.0.178,54.208.191.177,TCP,54,55960  >  443 [ACK] Seq=71366 Ack=549758 Win=4117 Len=0,0.000114,Blackboard,0.000113
297,3.618846,192.168.0.178,54.208.191.177,TCP,54,55963  >  443 [ACK] Seq=33682 Ack=73722 Win=513 Len=0,4.4E-05,Blackboard,0.000043
298,3.627529,192.168.0.178,54.208.191.177,TLSv1.2,3522,Application Data,0.008683,Blackboard,0.008683
299,3.645572,54.208.191.177,192.168.0.178,TCP,60,443  >  55963 [ACK] Seq=73722 Ack=37150 Win=771 Len=0,0.018043,Blackboard,0.018043
300,3.650849,54.208.191.177,192.168.0.178,TLSv1.2,1329,Application Data,0.005277,Blackboard,0.005276
301,3.656286,192.168.0.178,54.208.191.177,TLSv1.2,3546,Application Data,0.005437,Blackboard,0.005437
302,3.674699,54.208.191.177,192.168.0.178,TCP,60,443  >  55963 [ACK] Seq=74997 Ack=40642 Win=771 Len=0,0.018413,Blackboard,0.018412
303,3.684761,54.208.191.177,192.168.0.178,TCP,1514,443  >  55963 [ACK] Seq=74997 Ack=40642 Win=771 Len=1460 [TCP segment of a reassembled PDU],0.010062,Blackboard,0.010062
304,3.685141,54.208.191.177,192.168.0.178,TLSv1.2,313,Application Data,0.00038,Blackboard,0.00038
305,3.685204,192.168.0.178,54.208.191.177,TCP,54,55963  >  443 [ACK] Seq=40642 Ack=76716 Win=513 Len=0,6.3E-05,Blackboard,0.000062
306,4.053971,192.168.0.178,54.208.191.177,TLSv1.2,3540,Application Data,0.368767,Blackboard,0.368767
307,4.054823,192.168.0.178,54.208.191.177,TLSv1.2,3554,Application Data,0.000852,Blackboard,0.000852
308,4.055448,192.168.0.178,54.208.191.177,TLSv1.2,3547,Application Data,0.000625,Blackboard,0.000625
309,4.065264,192.168.0.178,54.208.191.177,TLSv1.2,3661,Application Data,0.009816,Blackboard,0.009815
310,4.09321,54.208.191.177,192.168.0.178,TCP,60,443  >  55963 [ACK] Seq=76716 Ack=44128 Win=771 Len=0,0.027946,Blackboard,0.027946
311,4.096938,192.168.0.178,54.208.191.177,TLSv1.2,3519,Application Data,0.003728,Blackboard,0.003727
312,4.097537,192.168.0.178,54.208.191.177,TLSv1.2,3528,Application Data,0.000599,Blackboard,0.000599
313,4.104496,192.168.0.178,54.208.191.177,TCP,1514,"[TCP Retransmission] 55962  >  443 [PSH, ACK] Seq=16481 Ack=32793 Win=511 Len=1460",0.006959,Blackboard,0.006959
314,4.104496,192.168.0.178,54.208.191.177,TCP,1514,"[TCP Retransmission] 55960  >  443 [PSH, ACK] Seq=73406 Ack=549758 Win=4117 Len=1460",0,Blackboard,0
315,4.105512,54.208.191.177,192.168.0.178,TCP,60,443  >  55960 [ACK] Seq=549758 Ack=74866 Win=771 Len=0,0.001016,Blackboard,0.001015
316,4.105743,54.208.191.177,192.168.0.178,TCP,60,443  >  55962 [ACK] Seq=32793 Ack=17941 Win=716 Len=0,0.000231,Blackboard,0.000231
317,4.114092,54.208.191.177,192.168.0.178,TCP,1514,443  >  55960 [ACK] Seq=549758 Ack=74866 Win=771 Len=1460 [TCP segment of a reassembled PDU],0.008349,Blackboard,0.008348
318,4.114092,54.208.191.177,192.168.0.178,TLSv1.2,83,Application Data,0,Blackboard,0
319,4.114171,192.168.0.178,54.208.191.177,TCP,54,55960  >  443 [ACK] Seq=74866 Ack=551247 Win=4117 Len=0,7.9E-05,Blackboard,0.000078
320,4.116463,54.208.191.177,192.168.0.178,TCP,60,443  >  55958 [ACK] Seq=19158 Ack=22926 Win=768 Len=0,0.002292,Blackboard,0.002292
