No.,Time,Source,Destination,Protocol,Length,Info,Time_Between,Website,Ttruncated
1,0,2600:8805:3d03:3f00:88c9:1a5:bc23:ce61,2600:1408:ec00:1286::2e03,TCP,86,57928  >  443 [SYN] Seq=0 Win=64800 Len=0 MSS=1440 WS=256 SACK_PERM,0,Weather,0
2,0.020845,2600:1408:ec00:1286::2e03,2600:8805:3d03:3f00:88c9:1a5:bc23:ce61,TCP,86,"443  >  57928 [SYN, ACK] Seq=0 Ack=1 Win=64800 Len=0 MSS=1440 SACK_PERM WS=128",0.020845,Weather,0.020845
3,0.020916,2600:8805:3d03:3f00:88c9:1a5:bc23:ce61,2600:1408:ec00:1286::2e03,TCP,74,57928  >  443 [ACK] Seq=1 Ack=1 Win=132352 Len=0,7.1E-05,Weather,0.000071
4,0.021254,2600:8805:3d03:3f00:88c9:1a5:bc23:ce61,2600:1408:ec00:1286::2e03,TLSv1.3,860,Client Hello (SNI=weather.com),0.000338,Weather,0.000337
5,0.158754,2600:1408:ec00:1286::2e03,2600:8805:3d03:3f00:88c9:1a5:bc23:ce61,TCP,74,443  >  57928 [ACK] Seq=1 Ack=787 Win=64128 Len=0,0.1375,Weather,0.1375
6,0.158754,2600:1408:ec00:1286::2e03,2600:8805:3d03:3f00:88c9:1a5:bc23:ce61,TLSv1.3,338,"Server Hello, Change Cipher Spec, Application Data, Application Data",0,Weather,0
7,0.15924,2600:8805:3d03:3f00:88c9:1a5:bc23:ce61,2600:1408:ec00:1286::2e03,TLSv1.3,154,"Change Cipher Spec, Application Data",0.000486,Weather,0.000485
8,0.15963,2600:8805:3d03:3f00:88c9:1a5:bc23:ce61,2600:1408:ec00:1286::2e03,TLSv1.3,166,Application Data,0.00039,Weather,0.00039
9,0.160152,2600:8805:3d03:3f00:88c9:1a5:bc23:ce61,2600:1408:ec00:1286::2e03,TLSv1.3,2689,Application Data,0.000522,Weather,0.000521
10,0.220898,2600:1408:ec00:1286::2e03,2600:8805:3d03:3f00:88c9:1a5:bc23:ce61,TCP,74,443  >  57928 [ACK] Seq=265 Ack=3574 Win=63104 Len=0,0.060746,Weather,0.060746
11,0.220898,2600:1408:ec00:1286::2e03,2600:8805:3d03:3f00:88c9:1a5:bc23:ce61,TLSv1.3,345,Application Data,0,Weather,0
12,0.220898,2600:1408:ec00:1286::2e03,2600:8805:3d03:3f00:88c9:1a5:bc23:ce61,TLSv1.3,135,Application Data,0,Weather,0
13,0.220898,2600:1408:ec00:1286::2e03,2600:8805:3d03:3f00:88c9:1a5:bc23:ce61,TLSv1.3,105,Application Data,0,Weather,0
14,0.221083,2600:8805:3d03:3f00:88c9:1a5:bc23:ce61,2600:1408:ec00:1286::2e03,TCP,74,57928  >  443 [ACK] Seq=3574 Ack=628 Win=131840 Len=0,0.000185,Weather,0.000184
15,0.221389,2600:8805:3d03:3f00:88c9:1a5:bc23:ce61,2600:1408:ec00:1286::2e03,TLSv1.3,105,Application Data,0.000306,Weather,0.000306
16,0.239256,2600:1408:ec00:1286::2e03,2600:8805:3d03:3f00:88c9:1a5:bc23:ce61,TLSv1.3,1312,Application Data,0.017867,Weather,0.017867
17,0.239256,2600:1408:ec00:1286::2e03,2600:8805:3d03:3f00:88c9:1a5:bc23:ce61,TCP,5834,"443  >  57928 [PSH, ACK] Seq=1866 Ack=3574 Win=64128 Len=5760 [TCP segment of a reassembled PDU]",0,Weather,0
18,0.239343,2600:8805:3d03:3f00:88c9:1a5:bc23:ce61,2600:1408:ec00:1286::2e03,TCP,74,57928  >  443 [ACK] Seq=3605 Ack=7626 Win=132352 Len=0,8.7E-05,Weather,0.000087
19,0.239913,2600:1408:ec00:1286::2e03,2600:8805:3d03:3f00:88c9:1a5:bc23:ce61,TCP,7274,"443  >  57928 [PSH, ACK] Seq=7626 Ack=3574 Win=64128 Len=7200 [TCP segment of a reassembled PDU]",0.00057,Weather,0.000569
20,0.239963,2600:8805:3d03:3f00:88c9:1a5:bc23:ce61,2600:1408:ec00:1286::2e03,TCP,74,57928  >  443 [ACK] Seq=3605 Ack=14826 Win=132352 Len=0,5E-05,Weather,0.00005
21,0.243818,2600:1408:ec00:1286::2e03,2600:8805:3d03:3f00:88c9:1a5:bc23:ce61,TCP,1514,"443  >  57928 [PSH, ACK] Seq=14826 Ack=3574 Win=64128 Len=1440 [TCP segment of a reassembled PDU]",0.003855,Weather,0.003855
22,0.243818,2600:1408:ec00:1286::2e03,2600:8805:3d03:3f00:88c9:1a5:bc23:ce61,TLSv1.3,1514,"[TCP Previous segment not captured] , Continuation Data",0,Weather,0
23,0.243818,2600:1408:ec00:1286::2e03,2600:8805:3d03:3f00:88c9:1a5:bc23:ce61,TCP,1514,[TCP Out-Of-Order] 443  >  57928 [ACK] Seq=16266 Ack=3574 Win=64128 Len=1440 [TCP segment of a reassembled PDU],0,Weather,0
24,0.243818,2600:1408:ec00:1286::2e03,2600:8805:3d03:3f00:88c9:1a5:bc23:ce61,TCP,1514,"[TCP Out-Of-Order] 443  >  57928 [PSH, ACK] Seq=17706 Ack=3574 Win=64128 Len=1440",0,Weather,0
25,0.243961,2600:8805:3d03:3f00:88c9:1a5:bc23:ce61,2600:1408:ec00:1286::2e03,TCP,86,57928  >  443 [ACK] Seq=3605 Ack=16266 Win=132352 Len=0 SLE=22026 SRE=23466,0.000143,Weather,0.000143
26,0.244027,2600:8805:3d03:3f00:88c9:1a5:bc23:ce61,2600:1408:ec00:1286::2e03,TCP,86,57928  >  443 [ACK] Seq=3605 Ack=17706 Win=132352 Len=0 SLE=22026 SRE=23466,6.6E-05,Weather,0.000065
27,0.244061,2600:8805:3d03:3f00:88c9:1a5:bc23:ce61,2600:1408:ec00:1286::2e03,TCP,86,57928  >  443 [ACK] Seq=3605 Ack=19146 Win=132352 Len=0 SLE=22026 SRE=23466,3.4E-05,Weather,0.000034
28,0.245332,2600:1408:ec00:1286::2e03,2600:8805:3d03:3f00:88c9:1a5:bc23:ce61,TLSv1.3,1514,Continuation Data,0.001271,Weather,0.00127
29,0.245332,2600:1408:ec00:1286::2e03,2600:8805:3d03:3f00:88c9:1a5:bc23:ce61,TCP,1514,[TCP Out-Of-Order] 443  >  57928 [ACK] Seq=19146 Ack=3574 Win=64128 Len=1440,0,Weather,0
30,0.245332,2600:1408:ec00:1286::2e03,2600:8805:3d03:3f00:88c9:1a5:bc23:ce61,TCP,1514,"[TCP Out-Of-Order] 443  >  57928 [PSH, ACK] Seq=20586 Ack=3574 Win=64128 Len=1440",0,Weather,0
31,0.245332,2600:1408:ec00:1286::2e03,2600:8805:3d03:3f00:88c9:1a5:bc23:ce61,TLSv1.3,2954,Continuation Data,0,Weather,0
32,0.245445,2600:8805:3d03:3f00:88c9:1a5:bc23:ce61,2600:1408:ec00:1286::2e03,TCP,86,[TCP Dup ACK 27#1] 57928  >  443 [ACK] Seq=3605 Ack=19146 Win=132352 Len=0 SLE=22026 SRE=24906,0.000113,Weather,0.000113
33,0.245582,2600:8805:3d03:3f00:88c9:1a5:bc23:ce61,2600:1408:ec00:1286::2e03,TCP,86,57928  >  443 [ACK] Seq=3605 Ack=20586 Win=132352 Len=0 SLE=22026 SRE=24906,0.000137,Weather,0.000136
34,0.245644,2600:8805:3d03:3f00:88c9:1a5:bc23:ce61,2600:1408:ec00:1286::2e03,TCP,74,57928  >  443 [ACK] Seq=3605 Ack=24906 Win=132352 Len=0,6.2E-05,Weather,0.000062
35,0.2457,2600:8805:3d03:3f00:88c9:1a5:bc23:ce61,2600:1408:ec00:1286::2e03,TCP,74,57928  >  443 [ACK] Seq=3605 Ack=27786 Win=132352 Len=0,5.6E-05,Weather,0.000056
36,0.253397,2600:8805:3d03:3f00:88c9:1a5:bc23:ce61,2600:1408:ec00:1286::2e03,TLSv1.3,2602,Application Data,0.007697,Weather,0.007696
37,0.253555,2600:8805:3d03:3f00:88c9:1a5:bc23:ce61,2600:1408:ec00:1286::2e03,TLSv1.3,2607,Application Data,0.000158,Weather,0.000157
38,0.253741,2600:8805:3d03:3f00:88c9:1a5:bc23:ce61,2600:1408:ec00:1286::2e03,TLSv1.3,2630,Application Data,0.000186,Weather,0.000186
39,0.35107,2600:1408:ec00:1286::2e03,2600:8805:3d03:3f00:88c9:1a5:bc23:ce61,TLSv1.3,2954,Continuation Data,0.097329,Weather,0.097329
40,0.35107,2600:1408:ec00:1286::2e03,2600:8805:3d03:3f00:88c9:1a5:bc23:ce61,TLSv1.3,2954,Continuation Data,0,Weather,0
41,0.35107,2600:1408:ec00:1286::2e03,2600:8805:3d03:3f00:88c9:1a5:bc23:ce61,TLSv1.3,24554,Continuation Data,0,Weather,0
42,0.351353,2600:8805:3d03:3f00:88c9:1a5:bc23:ce61,2600:1408:ec00:1286::2e03,TCP,74,57928  >  443 [ACK] Seq=11222 Ack=33546 Win=132352 Len=0,0.000283,Weather,0.000283
43,0.351631,2600:8805:3d03:3f00:88c9:1a5:bc23:ce61,2600:1408:ec00:1286::2e03,TCP,74,57928  >  443 [ACK] Seq=11222 Ack=58026 Win=132352 Len=0,0.000278,Weather,0.000278
44,0.370078,2600:1408:ec00:1286::2e03,2600:8805:3d03:3f00:88c9:1a5:bc23:ce61,TLSv1.3,1514,Continuation Data,0.018447,Weather,0.018447
45,0.370222,2600:8805:3d03:3f00:88c9:1a5:bc23:ce61,2600:1408:ec00:1286::2e03,TCP,74,57928  >  443 [ACK] Seq=11222 Ack=59466 Win=132352 Len=0,0.000144,Weather,0.000143
46,0.414458,2600:1408:ec00:1286::2e03,2600:8805:3d03:3f00:88c9:1a5:bc23:ce61,TLSv1.3,2954,Continuation Data,0.044236,Weather,0.044236
47,0.414458,2600:1408:ec00:1286::2e03,2600:8805:3d03:3f00:88c9:1a5:bc23:ce61,TLSv1.3,1514,Continuation Data,0,Weather,0
48,0.414458,2600:1408:ec00:1286::2e03,2600:8805:3d03:3f00:88c9:1a5:bc23:ce61,TLSv1.3,1514,Continuation Data,0,Weather,0
49,0.414458,2600:1408:ec00:1286::2e03,2600:8805:3d03:3f00:88c9:1a5:bc23:ce61,TLSv1.3,2954,Continuation Data,0,Weather,0
50,0.414458,2600:1408:ec00:1286::2e03,2600:8805:3d03:3f00:88c9:1a5:bc23:ce61,TLSv1.3,8714,Continuation Data,0,Weather,0
51,0.414458,2600:1408:ec00:1286::2e03,2600:8805:3d03:3f00:88c9:1a5:bc23:ce61,TLSv1.3,2954,Continuation Data,0,Weather,0
52,0.414458,2600:1408:ec00:1286::2e03,2600:8805:3d03:3f00:88c9:1a5:bc23:ce61,TLSv1.3,14474,Continuation Data,0,Weather,0
53,0.414458,2600:1408:ec00:1286::2e03,2600:8805:3d03:3f00:88c9:1a5:bc23:ce61,TLSv1.3,383,Continuation Data,0,Weather,0
54,0.414458,2600:1408:ec00:1286::2e03,2600:8805:3d03:3f00:88c9:1a5:bc23:ce61,TLSv1.3,4394,Continuation Data,0,Weather,0
55,0.415403,2600:8805:3d03:3f00:88c9:1a5:bc23:ce61,2600:1408:ec00:1286::2e03,TCP,74,57928  >  443 [ACK] Seq=11222 Ack=98655 Win=132352 Len=0,0.000945,Weather,0.000945
56,0.431361,2600:1408:ec00:1286::2e03,2600:8805:3d03:3f00:88c9:1a5:bc23:ce61,TLSv1.3,1514,Continuation Data,0.015958,Weather,0.015958
57,0.431678,2600:1408:ec00:1286::2e03,2600:8805:3d03:3f00:88c9:1a5:bc23:ce61,TLSv1.3,1514,Continuation Data,0.000317,Weather,0.000317
58,0.431728,2600:8805:3d03:3f00:88c9:1a5:bc23:ce61,2600:1408:ec00:1286::2e03,TCP,74,57928  >  443 [ACK] Seq=11222 Ack=101535 Win=132352 Len=0,5E-05,Weather,0.000049
59,0.432318,2600:1408:ec00:1286::2e03,2600:8805:3d03:3f00:88c9:1a5:bc23:ce61,TLSv1.3,2954,Continuation Data,0.00059,Weather,0.000589
60,0.43242,2600:8805:3d03:3f00:88c9:1a5:bc23:ce61,2600:1408:ec00:1286::2e03,TCP,74,57928  >  443 [ACK] Seq=11222 Ack=104415 Win=132352 Len=0,0.000102,Weather,0.000102
61,0.438462,2600:1408:ec00:1286::2e03,2600:8805:3d03:3f00:88c9:1a5:bc23:ce61,TLSv1.3,11594,Continuation Data,0.006042,Weather,0.006041
62,0.438629,2600:8805:3d03:3f00:88c9:1a5:bc23:ce61,2600:1408:ec00:1286::2e03,TCP,74,57928  >  443 [ACK] Seq=11222 Ack=115935 Win=132352 Len=0,0.000167,Weather,0.000166
63,0.439994,2600:1408:ec00:1286::2e03,2600:8805:3d03:3f00:88c9:1a5:bc23:ce61,TLSv1.3,2954,Continuation Data,0.001365,Weather,0.001365
64,0.440079,2600:8805:3d03:3f00:88c9:1a5:bc23:ce61,2600:1408:ec00:1286::2e03,TCP,74,57928  >  443 [ACK] Seq=11222 Ack=118815 Win=132352 Len=0,8.5E-05,Weather,0.000085
65,0.440521,2600:1408:ec00:1286::2e03,2600:8805:3d03:3f00:88c9:1a5:bc23:ce61,TLSv1.3,1514,Continuation Data,0.000442,Weather,0.000441
66,0.440521,2600:1408:ec00:1286::2e03,2600:8805:3d03:3f00:88c9:1a5:bc23:ce61,TLSv1.3,1514,Continuation Data,0,Weather,0
67,0.440609,2600:8805:3d03:3f00:88c9:1a5:bc23:ce61,2600:1408:ec00:1286::2e03,TCP,74,57928  >  443 [ACK] Seq=11222 Ack=121695 Win=132352 Len=0,8.8E-05,Weather,0.000087
68,0.443554,2600:1408:ec00:1286::2e03,2600:8805:3d03:3f00:88c9:1a5:bc23:ce61,TLSv1.3,1514,Continuation Data,0.002945,Weather,0.002945
69,0.444302,2600:1408:ec00:1286::2e03,2600:8805:3d03:3f00:88c9:1a5:bc23:ce61,TLSv1.3,5834,Continuation Data,0.000748,Weather,0.000747
70,0.444395,2600:8805:3d03:3f00:88c9:1a5:bc23:ce61,2600:1408:ec00:1286::2e03,TCP,74,57928  >  443 [ACK] Seq=11222 Ack=128895 Win=132352 Len=0,9.3E-05,Weather,0.000093
71,0.444743,2600:1408:ec00:1286::2e03,2600:8805:3d03:3f00:88c9:1a5:bc23:ce61,TCP,1514,"443  >  57928 [PSH, ACK] Seq=128895 Ack=11222 Win=64128 Len=1440",0.000348,Weather,0.000348
72,0.444776,2600:8805:3d03:3f00:88c9:1a5:bc23:ce61,2600:1408:ec00:1286::2e03,TCP,74,57928  >  443 [ACK] Seq=11222 Ack=130335 Win=132352 Len=0,3.3E-05,Weather,0.000033
73,0.445257,2600:1408:ec00:1286::2e03,2600:8805:3d03:3f00:88c9:1a5:bc23:ce61,TLSv1.3,1514,Continuation Data,0.000481,Weather,0.000481
74,0.447987,2600:1408:ec00:1286::2e03,2600:8805:3d03:3f00:88c9:1a5:bc23:ce61,TLSv1.3,1514,Continuation Data,0.00273,Weather,0.00273
75,0.448058,2600:8805:3d03:3f00:88c9:1a5:bc23:ce61,2600:1408:ec00:1286::2e03,TCP,74,57928  >  443 [ACK] Seq=11222 Ack=133215 Win=132352 Len=0,7.1E-05,Weather,0.00007
76,0.449322,2600:1408:ec00:1286::2e03,2600:8805:3d03:3f00:88c9:1a5:bc23:ce61,TLSv1.3,5834,Continuation Data,0.001264,Weather,0.001263
77,0.449433,2600:8805:3d03:3f00:88c9:1a5:bc23:ce61,2600:1408:ec00:1286::2e03,TCP,74,57928  >  443 [ACK] Seq=11222 Ack=138975 Win=132352 Len=0,0.000111,Weather,0.000111
78,0.450387,2600:1408:ec00:1286::2e03,2600:8805:3d03:3f00:88c9:1a5:bc23:ce61,TLSv1.3,2954,Continuation Data,0.000954,Weather,0.000953
79,0.450534,2600:8805:3d03:3f00:88c9:1a5:bc23:ce61,2600:1408:ec00:1286::2e03,TCP,74,57928  >  443 [ACK] Seq=11222 Ack=141855 Win=132352 Len=0,0.000147,Weather,0.000147
80,0.462922,2600:8805:3d03:3f00:88c9:1a5:bc23:ce61,2600:1408:ec00:1286::2e03,TLSv1.3,2581,Application Data,0.012388,Weather,0.012388
81,0.574705,2600:1408:ec00:1286::2e03,2600:8805:3d03:3f00:88c9:1a5:bc23:ce61,TLSv1.3,14474,Continuation Data,0.111783,Weather,0.111783
82,0.574705,2600:1408:ec00:1286::2e03,2600:8805:3d03:3f00:88c9:1a5:bc23:ce61,TLSv1.3,1342,Continuation Data,0,Weather,0
83,0.574705,2600:1408:ec00:1286::2e03,2600:8805:3d03:3f00:88c9:1a5:bc23:ce61,TLSv1.3,7274,Continuation Data,0,Weather,0
84,0.574705,2600:1408:ec00:1286::2e03,2600:8805:3d03:3f00:88c9:1a5:bc23:ce61,TLSv1.3,7274,Continuation Data,0,Weather,0
85,0.575055,2600:8805:3d03:3f00:88c9:1a5:bc23:ce61,2600:1408:ec00:1286::2e03,TCP,74,57928  >  443 [ACK] Seq=13729 Ack=171923 Win=132352 Len=0,0.00035,Weather,0.000349
86,0.586553,2600:1408:ec00:1286::2e03,2600:8805:3d03:3f00:88c9:1a5:bc23:ce61,TLSv1.3,31754,Continuation Data,0.011498,Weather,0.011498
87,0.586553,2600:1408:ec00:1286::2e03,2600:8805:3d03:3f00:88c9:1a5:bc23:ce61,TLSv1.3,13034,Continuation Data,0,Weather,0
88,0.586553,2600:1408:ec00:1286::2e03,2600:8805:3d03:3f00:88c9:1a5:bc23:ce61,TLSv1.3,1514,Continuation Data,0,Weather,0
89,0.586553,2600:1408:ec00:1286::2e03,2600:8805:3d03:3f00:88c9:1a5:bc23:ce61,TLSv1.3,308,Continuation Data,0,Weather,0
90,0.586553,2600:1408:ec00:1286::2e03,2600:8805:3d03:3f00:88c9:1a5:bc23:ce61,TLSv1.3,1514,Continuation Data,0,Weather,0
91,0.587314,2600:8805:3d03:3f00:88c9:1a5:bc23:ce61,2600:1408:ec00:1286::2e03,TCP,74,57928  >  443 [ACK] Seq=13729 Ack=219677 Win=132352 Len=0,0.000761,Weather,0.000761
92,0.601314,2600:1408:ec00:1286::2e03,2600:8805:3d03:3f00:88c9:1a5:bc23:ce61,TLSv1.3,1514,Continuation Data,0.014,Weather,0.014
93,0.601314,2600:1408:ec00:1286::2e03,2600:8805:3d03:3f00:88c9:1a5:bc23:ce61,TLSv1.3,2954,Continuation Data,0,Weather,0
94,0.601314,2600:1408:ec00:1286::2e03,2600:8805:3d03:3f00:88c9:1a5:bc23:ce61,TCP,74,[TCP Dup ACK 88#1] 443  >  57928 [ACK] Seq=223997 Ack=12662 Win=64128 Len=0,0,Weather,0
95,0.601314,2600:1408:ec00:1286::2e03,2600:8805:3d03:3f00:88c9:1a5:bc23:ce61,TLSv1.3,1514,Continuation Data,0,Weather,0
96,0.601314,2600:1408:ec00:1286::2e03,2600:8805:3d03:3f00:88c9:1a5:bc23:ce61,TLSv1.3,1514,Continuation Data,0,Weather,0
97,0.601314,2600:1408:ec00:1286::2e03,2600:8805:3d03:3f00:88c9:1a5:bc23:ce61,TLSv1.3,1514,Continuation Data,0,Weather,0
98,0.601314,2600:1408:ec00:1286::2e03,2600:8805:3d03:3f00:88c9:1a5:bc23:ce61,TLSv1.3,1514,Continuation Data,0,Weather,0
99,0.601314,2600:1408:ec00:1286::2e03,2600:8805:3d03:3f00:88c9:1a5:bc23:ce61,TLSv1.3,1514,Continuation Data,0,Weather,0
100,0.601627,2600:8805:3d03:3f00:88c9:1a5:bc23:ce61,2600:1408:ec00:1286::2e03,TCP,74,57928  >  443 [ACK] Seq=13729 Ack=223997 Win=132352 Len=0,0.000313,Weather,0.000313
101,0.601837,2600:8805:3d03:3f00:88c9:1a5:bc23:ce61,2600:1408:ec00:1286::2e03,TCP,74,57928  >  443 [ACK] Seq=13729 Ack=231197 Win=132352 Len=0,0.00021,Weather,0.000209
102,0.611431,2600:1408:ec00:1286::2e03,2600:8805:3d03:3f00:88c9:1a5:bc23:ce61,TLSv1.3,15914,Continuation Data,0.009594,Weather,0.009593
103,0.611431,2600:1408:ec00:1286::2e03,2600:8805:3d03:3f00:88c9:1a5:bc23:ce61,TLSv1.3,1514,Continuation Data,0,Weather,0
104,0.611431,2600:1408:ec00:1286::2e03,2600:8805:3d03:3f00:88c9:1a5:bc23:ce61,TLSv1.3,1514,Continuation Data,0,Weather,0
105,0.611431,2600:1408:ec00:1286::2e03,2600:8805:3d03:3f00:88c9:1a5:bc23:ce61,TLSv1.3,8714,Continuation Data,0,Weather,0
106,0.611431,2600:1408:ec00:1286::2e03,2600:8805:3d03:3f00:88c9:1a5:bc23:ce61,TLSv1.3,1514,Continuation Data,0,Weather,0
107,0.611431,2600:1408:ec00:1286::2e03,2600:8805:3d03:3f00:88c9:1a5:bc23:ce61,TLSv1.3,13034,Continuation Data,0,Weather,0
108,0.611853,2600:8805:3d03:3f00:88c9:1a5:bc23:ce61,2600:1408:ec00:1286::2e03,TCP,74,57928  >  443 [ACK] Seq=13729 Ack=249917 Win=132352 Len=0,0.000422,Weather,0.000422
109,0.612057,2600:8805:3d03:3f00:88c9:1a5:bc23:ce61,2600:1408:ec00:1286::2e03,TCP,74,57928  >  443 [ACK] Seq=13729 Ack=259997 Win=132352 Len=0,0.000204,Weather,0.000203
110,0.612218,2600:8805:3d03:3f00:88c9:1a5:bc23:ce61,2600:1408:ec00:1286::2e03,TCP,74,57928  >  443 [ACK] Seq=13729 Ack=272957 Win=132352 Len=0,0.000161,Weather,0.000161
111,0.612712,2600:1408:ec00:1286::2e03,2600:8805:3d03:3f00:88c9:1a5:bc23:ce61,TCP,1514,443  >  57928 [ACK] Seq=272957 Ack=13729 Win=64128 Len=1440,0.000494,Weather,0.000493
112,0.612712,2600:1408:ec00:1286::2e03,2600:8805:3d03:3f00:88c9:1a5:bc23:ce61,TLSv1.3,1514,Continuation Data,0,Weather,0
113,0.612712,2600:1408:ec00:1286::2e03,2600:8805:3d03:3f00:88c9:1a5:bc23:ce61,TLSv1.3,1514,Continuation Data,0,Weather,0
114,0.612712,2600:1408:ec00:1286::2e03,2600:8805:3d03:3f00:88c9:1a5:bc23:ce61,TLSv1.3,1514,Continuation Data,0,Weather,0
115,0.612712,2600:1408:ec00:1286::2e03,2600:8805:3d03:3f00:88c9:1a5:bc23:ce61,TLSv1.3,1514,Continuation Data,0,Weather,0
116,0.613234,2600:8805:3d03:3f00:88c9:1a5:bc23:ce61,2600:1408:ec00:1286::2e03,TCP,74,57928  >  443 [ACK] Seq=13729 Ack=280157 Win=132352 Len=0,0.000522,Weather,0.000521
117,0.613631,2600:1408:ec00:1286::2e03,2600:8805:3d03:3f00:88c9:1a5:bc23:ce61,TLSv1.3,1514,Continuation Data,0.000397,Weather,0.000397
118,0.613631,2600:1408:ec00:1286::2e03,2600:8805:3d03:3f00:88c9:1a5:bc23:ce61,TLSv1.3,5834,Continuation Data,0,Weather,0
119,0.613763,2600:8805:3d03:3f00:88c9:1a5:bc23:ce61,2600:1408:ec00:1286::2e03,TCP,74,57928  >  443 [ACK] Seq=13729 Ack=287357 Win=132352 Len=0,0.000132,Weather,0.000131
120,0.614163,2600:1408:ec00:1286::2e03,2600:8805:3d03:3f00:88c9:1a5:bc23:ce61,TLSv1.3,4394,Continuation Data,0.0004,Weather,0.0004
121,0.614249,2600:8805:3d03:3f00:88c9:1a5:bc23:ce61,2600:1408:ec00:1286::2e03,TCP,74,57928  >  443 [ACK] Seq=13729 Ack=291677 Win=132352 Len=0,8.6E-05,Weather,0.000086
122,0.615454,2600:1408:ec00:1286::2e03,2600:8805:3d03:3f00:88c9:1a5:bc23:ce61,TLSv1.3,2954,Continuation Data,0.001205,Weather,0.001204
123,0.615559,2600:8805:3d03:3f00:88c9:1a5:bc23:ce61,2600:1408:ec00:1286::2e03,TCP,74,57928  >  443 [ACK] Seq=13729 Ack=294557 Win=132352 Len=0,0.000105,Weather,0.000105
124,0.616551,2600:1408:ec00:1286::2e03,2600:8805:3d03:3f00:88c9:1a5:bc23:ce61,TLSv1.3,2954,Continuation Data,0.000992,Weather,0.000991
125,0.616673,2600:8805:3d03:3f00:88c9:1a5:bc23:ce61,2600:1408:ec00:1286::2e03,TCP,74,57928  >  443 [ACK] Seq=13729 Ack=297437 Win=132352 Len=0,0.000122,Weather,0.000122
126,0.616913,2600:1408:ec00:1286::2e03,2600:8805:3d03:3f00:88c9:1a5:bc23:ce61,TLSv1.3,2954,Continuation Data,0.00024,Weather,0.00024
127,0.616976,2600:8805:3d03:3f00:88c9:1a5:bc23:ce61,2600:1408:ec00:1286::2e03,TCP,74,57928  >  443 [ACK] Seq=13729 Ack=300317 Win=132352 Len=0,6.3E-05,Weather,0.000062
128,0.617574,2600:1408:ec00:1286::2e03,2600:8805:3d03:3f00:88c9:1a5:bc23:ce61,TLSv1.3,2954,Continuation Data,0.000598,Weather,0.000597
129,0.617635,2600:8805:3d03:3f00:88c9:1a5:bc23:ce61,2600:1408:ec00:1286::2e03,TCP,74,57928  >  443 [ACK] Seq=13729 Ack=303197 Win=132352 Len=0,6.1E-05,Weather,0.000061
130,0.617999,2600:1408:ec00:1286::2e03,2600:8805:3d03:3f00:88c9:1a5:bc23:ce61,TLSv1.3,2954,Continuation Data,0.000364,Weather,0.000363
131,0.618061,2600:8805:3d03:3f00:88c9:1a5:bc23:ce61,2600:1408:ec00:1286::2e03,TCP,74,57928  >  443 [ACK] Seq=13729 Ack=306077 Win=132352 Len=0,6.2E-05,Weather,0.000062
132,0.619056,2600:1408:ec00:1286::2e03,2600:8805:3d03:3f00:88c9:1a5:bc23:ce61,TLSv1.3,1514,Continuation Data,0.000995,Weather,0.000995
133,0.619116,2600:8805:3d03:3f00:88c9:1a5:bc23:ce61,2600:1408:ec00:1286::2e03,TCP,74,57928  >  443 [ACK] Seq=13729 Ack=307517 Win=132352 Len=0,6E-05,Weather,0.000059
134,0.619476,2600:1408:ec00:1286::2e03,2600:8805:3d03:3f00:88c9:1a5:bc23:ce61,TLSv1.3,1514,Continuation Data,0.00036,Weather,0.00036
135,0.620824,2600:1408:ec00:1286::2e03,2600:8805:3d03:3f00:88c9:1a5:bc23:ce61,TLSv1.3,2954,Continuation Data,0.001348,Weather,0.001348
136,0.620956,2600:8805:3d03:3f00:88c9:1a5:bc23:ce61,2600:1408:ec00:1286::2e03,TCP,74,57928  >  443 [ACK] Seq=13729 Ack=311837 Win=132352 Len=0,0.000132,Weather,0.000131
137,0.622616,2600:1408:ec00:1286::2e03,2600:8805:3d03:3f00:88c9:1a5:bc23:ce61,TLSv1.3,2954,Continuation Data,0.00166,Weather,0.001659
138,0.622748,2600:8805:3d03:3f00:88c9:1a5:bc23:ce61,2600:1408:ec00:1286::2e03,TCP,74,57928  >  443 [ACK] Seq=13729 Ack=314717 Win=132352 Len=0,0.000132,Weather,0.000132
139,0.643781,2600:1408:ec00:1286::2e03,2600:8805:3d03:3f00:88c9:1a5:bc23:ce61,TLSv1.3,28874,Continuation Data,0.021033,Weather,0.021033
140,0.643781,2600:1408:ec00:1286::2e03,2600:8805:3d03:3f00:88c9:1a5:bc23:ce61,TLSv1.3,1308,Continuation Data,0,Weather,0
141,0.644121,2600:8805:3d03:3f00:88c9:1a5:bc23:ce61,2600:1408:ec00:1286::2e03,TCP,74,57928  >  443 [ACK] Seq=13729 Ack=344751 Win=132352 Len=0,0.00034,Weather,0.00034
142,0.668833,2600:8805:3d03:3f00:88c9:1a5:bc23:ce61,2600:1408:ec00:1286::2e03,TLSv1.3,2698,Application Data,0.024712,Weather,0.024712
143,0.668925,2600:8805:3d03:3f00:88c9:1a5:bc23:ce61,2600:1408:ec00:1286::2e03,TLSv1.3,178,Application Data,9.2E-05,Weather,0.000091
144,0.670217,2600:8805:3d03:3f00:88c9:1a5:bc23:ce61,2600:1408:ec00:1286::2e03,TLSv1.3,2698,Application Data,0.001292,Weather,0.001291
145,0.670312,2600:8805:3d03:3f00:88c9:1a5:bc23:ce61,2600:1408:ec00:1286::2e03,TLSv1.3,207,Application Data,9.5E-05,Weather,0.000095
146,0.79242,2600:8805:3d03:3f00:88c9:1a5:bc23:ce61,2600:1408:ec00:1286::2e03,TLSv1.3,2604,Application Data,0.122108,Weather,0.122108
147,0.794232,2600:1408:ec00:1286::2e03,2600:8805:3d03:3f00:88c9:1a5:bc23:ce61,TCP,74,443  >  57928 [ACK] Seq=344751 Ack=16353 Win=63616 Len=0,0.001812,Weather,0.001812
148,0.797104,2600:1408:ec00:1286::2e03,2600:8805:3d03:3f00:88c9:1a5:bc23:ce61,TCP,74,443  >  57928 [ACK] Seq=344751 Ack=19214 Win=63104 Len=0,0.002872,Weather,0.002871
149,0.816092,2600:1408:ec00:1286::2e03,2600:8805:3d03:3f00:88c9:1a5:bc23:ce61,TCP,74,443  >  57928 [ACK] Seq=344751 Ack=21744 Win=63744 Len=0,0.018988,Weather,0.018988
150,0.828983,2600:1408:ec00:1286::2e03,2600:8805:3d03:3f00:88c9:1a5:bc23:ce61,TLSv1.3,1275,Application Data,0.012891,Weather,0.012891
151,0.828983,2600:1408:ec00:1286::2e03,2600:8805:3d03:3f00:88c9:1a5:bc23:ce61,TLSv1.3,799,Application Data,0,Weather,0
152,0.829116,2600:8805:3d03:3f00:88c9:1a5:bc23:ce61,2600:1408:ec00:1286::2e03,TCP,74,57928  >  443 [ACK] Seq=21744 Ack=346677 Win=132352 Len=0,0.000133,Weather,0.000132
153,0.882755,2600:8805:3d03:3f00:88c9:1a5:bc23:ce61,2600:1408:ec00:1286::2e03,TLSv1.3,2578,Application Data,0.053639,Weather,0.053639
154,0.882973,2600:8805:3d03:3f00:88c9:1a5:bc23:ce61,2600:1408:ec00:1286::2e03,TLSv1.3,2579,Application Data,0.000218,Weather,0.000218
155,0.885073,2600:8805:3d03:3f00:88c9:1a5:bc23:ce61,2600:1408:ec00:1286::2e03,TLSv1.3,2579,Application Data,0.0021,Weather,0.002099
156,0.885292,2600:8805:3d03:3f00:88c9:1a5:bc23:ce61,2600:1408:ec00:1286::2e03,TLSv1.3,2578,Application Data,0.000219,Weather,0.000218
157,0.890202,2600:8805:3d03:3f00:88c9:1a5:bc23:ce61,2600:1408:ec00:1286::2e03,TLSv1.3,2579,Application Data,0.00491,Weather,0.00491
158,0.890389,2600:8805:3d03:3f00:88c9:1a5:bc23:ce61,2600:1408:ec00:1286::2e03,TLSv1.3,2579,Application Data,0.000187,Weather,0.000186
159,0.890472,2600:8805:3d03:3f00:88c9:1a5:bc23:ce61,2600:1408:ec00:1286::2e03,TLSv1.3,2579,Application Data,8.3E-05,Weather,0.000083
160,0.892364,2600:8805:3d03:3f00:88c9:1a5:bc23:ce61,2600:1408:ec00:1286::2e03,TLSv1.3,2577,Application Data,0.001892,Weather,0.001892
161,0.892497,2600:8805:3d03:3f00:88c9:1a5:bc23:ce61,2600:1408:ec00:1286::2e03,TLSv1.3,2578,Application Data,0.000133,Weather,0.000132
162,0.892599,2600:8805:3d03:3f00:88c9:1a5:bc23:ce61,2600:1408:ec00:1286::2e03,TLSv1.3,2577,Application Data,0.000102,Weather,0.000102
163,0.892675,2600:8805:3d03:3f00:88c9:1a5:bc23:ce61,2600:1408:ec00:1286::2e03,TLSv1.3,2577,Application Data,7.6E-05,Weather,0.000075
164,0.892739,2600:8805:3d03:3f00:88c9:1a5:bc23:ce61,2600:1408:ec00:1286::2e03,TLSv1.3,2581,Application Data,6.4E-05,Weather,0.000063
165,0.892808,2600:8805:3d03:3f00:88c9:1a5:bc23:ce61,2600:1408:ec00:1286::2e03,TLSv1.3,2579,Application Data,6.9E-05,Weather,0.000069
166,0.892875,2600:8805:3d03:3f00:88c9:1a5:bc23:ce61,2600:1408:ec00:1286::2e03,TLSv1.3,2578,Application Data,6.7E-05,Weather,0.000066
167,0.980669,2600:1408:ec00:1286::2e03,2600:8805:3d03:3f00:88c9:1a5:bc23:ce61,TLSv1.3,1441,Application Data,0.087794,Weather,0.087794
168,0.980669,2600:1408:ec00:1286::2e03,2600:8805:3d03:3f00:88c9:1a5:bc23:ce61,TLSv1.3,1245,Application Data,0,Weather,0
169,0.98088,2600:8805:3d03:3f00:88c9:1a5:bc23:ce61,2600:1408:ec00:1286::2e03,TCP,74,57928  >  443 [ACK] Seq=56806 Ack=349215 Win=132352 Len=0,0.000211,Weather,0.00021
170,1.005901,2600:1408:ec00:1286::2e03,2600:8805:3d03:3f00:88c9:1a5:bc23:ce61,TCP,74,443  >  57928 [ACK] Seq=349215 Ack=56806 Win=41088 Len=0,0.025021,Weather,0.025021
171,1.005941,2600:8805:3d03:3f00:88c9:1a5:bc23:ce61,2600:1408:ec00:1286::2e03,TLSv1.3,27918,"Application Data, Application Data, Application Data, Application Data, Application Data, Application Data, Application Data, Application Data, Application Data, Application Data, Application Data, Application Data",4E-05,Weather,0.00004
172,1.02561,2600:1408:ec00:1286::2e03,2600:8805:3d03:3f00:88c9:1a5:bc23:ce61,TCP,74,443  >  57928 [ACK] Seq=349215 Ack=61126 Win=62592 Len=0,0.019669,Weather,0.019668
173,1.027413,2600:1408:ec00:1286::2e03,2600:8805:3d03:3f00:88c9:1a5:bc23:ce61,TLSv1.3,1278,Application Data,0.001803,Weather,0.001803
174,1.027413,2600:1408:ec00:1286::2e03,2600:8805:3d03:3f00:88c9:1a5:bc23:ce61,TCP,2954,443  >  57928 [ACK] Seq=350419 Ack=61126 Win=62592 Len=2880 [TCP segment of a reassembled PDU],0,Weather,0
175,1.0276,2600:8805:3d03:3f00:88c9:1a5:bc23:ce61,2600:1408:ec00:1286::2e03,TCP,74,57928  >  443 [ACK] Seq=84650 Ack=353299 Win=132352 Len=0,0.000187,Weather,0.000187
176,1.028519,2600:1408:ec00:1286::2e03,2600:8805:3d03:3f00:88c9:1a5:bc23:ce61,TCP,1514,443  >  57928 [ACK] Seq=353299 Ack=61126 Win=62592 Len=1440 [TCP segment of a reassembled PDU],0.000919,Weather,0.000918
177,1.028519,2600:1408:ec00:1286::2e03,2600:8805:3d03:3f00:88c9:1a5:bc23:ce61,TCP,1514,443  >  57928 [ACK] Seq=354739 Ack=61126 Win=62592 Len=1440 [TCP segment of a reassembled PDU],0,Weather,0
178,1.028519,2600:1408:ec00:1286::2e03,2600:8805:3d03:3f00:88c9:1a5:bc23:ce61,TCP,2954,"443  >  57928 [PSH, ACK] Seq=356179 Ack=61126 Win=62592 Len=2880 [TCP segment of a reassembled PDU]",0,Weather,0
179,1.028606,2600:8805:3d03:3f00:88c9:1a5:bc23:ce61,2600:1408:ec00:1286::2e03,TCP,74,57928  >  443 [ACK] Seq=84650 Ack=359059 Win=132352 Len=0,8.7E-05,Weather,0.000086
180,1.030321,2600:1408:ec00:1286::2e03,2600:8805:3d03:3f00:88c9:1a5:bc23:ce61,TCP,5834,443  >  57928 [ACK] Seq=359059 Ack=61126 Win=62592 Len=5760 [TCP segment of a reassembled PDU],0.001715,Weather,0.001715
181,1.030321,2600:1408:ec00:1286::2e03,2600:8805:3d03:3f00:88c9:1a5:bc23:ce61,TLSv1.3,229,Application Data,0,Weather,0
182,1.030321,2600:1408:ec00:1286::2e03,2600:8805:3d03:3f00:88c9:1a5:bc23:ce61,TLSv1.3,1514,Application Data,0,Weather,0
183,1.030426,2600:8805:3d03:3f00:88c9:1a5:bc23:ce61,2600:1408:ec00:1286::2e03,TCP,74,57928  >  443 [ACK] Seq=84650 Ack=366414 Win=132352 Len=0,0.000105,Weather,0.000105
184,1.035556,2600:1408:ec00:1286::2e03,2600:8805:3d03:3f00:88c9:1a5:bc23:ce61,TCP,2954,443  >  57928 [ACK] Seq=366414 Ack=61126 Win=62592 Len=2880 [TCP segment of a reassembled PDU],0.00513,Weather,0.005129
185,1.035556,2600:1408:ec00:1286::2e03,2600:8805:3d03:3f00:88c9:1a5:bc23:ce61,TLSv1.3,1152,Application Data,0,Weather,0
186,1.035556,2600:1408:ec00:1286::2e03,2600:8805:3d03:3f00:88c9:1a5:bc23:ce61,TLSv1.3,17354,"Application Data, Application Data, Application Data, Application Data, Application Data",0,Weather,0
187,1.035837,2600:8805:3d03:3f00:88c9:1a5:bc23:ce61,2600:1408:ec00:1286::2e03,TCP,74,57928  >  443 [ACK] Seq=84650 Ack=387652 Win=132352 Len=0,0.000281,Weather,0.00028
188,1.036548,2600:1408:ec00:1286::2e03,2600:8805:3d03:3f00:88c9:1a5:bc23:ce61,TLSv1.3,23114,"Application Data, Application Data, Application Data, Application Data, Application Data",0.000711,Weather,0.000711
189,1.036725,2600:8805:3d03:3f00:88c9:1a5:bc23:ce61,2600:1408:ec00:1286::2e03,TCP,74,57928  >  443 [ACK] Seq=84650 Ack=410692 Win=132352 Len=0,0.000177,Weather,0.000176
190,1.037855,2600:1408:ec00:1286::2e03,2600:8805:3d03:3f00:88c9:1a5:bc23:ce61,TLSv1.3,2954,"Application Data, Application Data",0.00113,Weather,0.00113
191,1.037855,2600:1408:ec00:1286::2e03,2600:8805:3d03:3f00:88c9:1a5:bc23:ce61,TLSv1.3,17354,"Application Data, Application Data, Application Data, Application Data, Application Data",0,Weather,0
192,1.038001,2600:8805:3d03:3f00:88c9:1a5:bc23:ce61,2600:1408:ec00:1286::2e03,TCP,74,57928  >  443 [ACK] Seq=84650 Ack=430852 Win=264960 Len=0,0.000146,Weather,0.000145
193,1.039925,2600:1408:ec00:1286::2e03,2600:8805:3d03:3f00:88c9:1a5:bc23:ce61,TLSv1.3,18794,"Application Data, Application Data",0.001924,Weather,0.001924
194,1.040021,2600:8805:3d03:3f00:88c9:1a5:bc23:ce61,2600:1408:ec00:1286::2e03,TCP,74,57928  >  443 [ACK] Seq=84650 Ack=449572 Win=264960 Len=0,9.6E-05,Weather,0.000096
195,1.041715,2600:1408:ec00:1286::2e03,2600:8805:3d03:3f00:88c9:1a5:bc23:ce61,TLSv1.3,10154,"Application Data, Application Data",0.001694,Weather,0.001693
196,1.041715,2600:1408:ec00:1286::2e03,2600:8805:3d03:3f00:88c9:1a5:bc23:ce61,TCP,11594,"443  >  57928 [PSH, ACK] Seq=459652 Ack=84650 Win=49664 Len=11520 [TCP segment of a reassembled PDU]",0,Weather,0
197,1.041842,2600:8805:3d03:3f00:88c9:1a5:bc23:ce61,2600:1408:ec00:1286::2e03,TCP,74,57928  >  443 [ACK] Seq=84650 Ack=471172 Win=243200 Len=0,0.000127,Weather,0.000126
198,1.042394,2600:1408:ec00:1286::2e03,2600:8805:3d03:3f00:88c9:1a5:bc23:ce61,TLSv1.3,10154,"Application Data, Application Data",0.000552,Weather,0.000552
199,1.042394,2600:1408:ec00:1286::2e03,2600:8805:3d03:3f00:88c9:1a5:bc23:ce61,TCP,389,"443  >  57928 [PSH, ACK] Seq=481252 Ack=84650 Win=49664 Len=315 [TCP segment of a reassembled PDU]",0,Weather,0
200,1.042452,2600:8805:3d03:3f00:88c9:1a5:bc23:ce61,2600:1408:ec00:1286::2e03,TCP,74,57928  >  443 [ACK] Seq=84650 Ack=481567 Win=232960 Len=0,5.8E-05,Weather,0.000057
201,1.045226,2600:1408:ec00:1286::2e03,2600:8805:3d03:3f00:88c9:1a5:bc23:ce61,TCP,1514,443  >  57928 [ACK] Seq=481567 Ack=84650 Win=64128 Len=1440 [TCP segment of a reassembled PDU],0.002774,Weather,0.002774
202,1.04607,2600:1408:ec00:1286::2e03,2600:8805:3d03:3f00:88c9:1a5:bc23:ce61,TLSv1.3,8714,"Application Data, Application Data",0.000844,Weather,0.000844
203,1.046149,2600:8805:3d03:3f00:88c9:1a5:bc23:ce61,2600:1408:ec00:1286::2e03,TCP,74,57928  >  443 [ACK] Seq=84650 Ack=491647 Win=222720 Len=0,7.9E-05,Weather,0.000078
204,1.046809,2600:1408:ec00:1286::2e03,2600:8805:3d03:3f00:88c9:1a5:bc23:ce61,TCP,5834,443  >  57928 [ACK] Seq=491647 Ack=84650 Win=64128 Len=5760 [TCP segment of a reassembled PDU],0.00066,Weather,0.00066
205,1.046809,2600:1408:ec00:1286::2e03,2600:8805:3d03:3f00:88c9:1a5:bc23:ce61,TCP,1433,"443  >  57928 [PSH, ACK] Seq=497407 Ack=84650 Win=64128 Len=1359 [TCP segment of a reassembled PDU]",0,Weather,0
206,1.046901,2600:8805:3d03:3f00:88c9:1a5:bc23:ce61,2600:1408:ec00:1286::2e03,TCP,74,57928  >  443 [ACK] Seq=84650 Ack=498766 Win=215552 Len=0,9.2E-05,Weather,0.000091
207,1.053292,2600:1408:ec00:1286::2e03,2600:8805:3d03:3f00:88c9:1a5:bc23:ce61,TLSv1.3,18794,"Application Data, Application Data",0.006391,Weather,0.00639
208,1.053377,2600:8805:3d03:3f00:88c9:1a5:bc23:ce61,2600:1408:ec00:1286::2e03,TCP,74,57928  >  443 [ACK] Seq=84650 Ack=517486 Win=196864 Len=0,8.5E-05,Weather,0.000085
209,1.054627,2600:1408:ec00:1286::2e03,2600:8805:3d03:3f00:88c9:1a5:bc23:ce61,TLSv1.3,7274,"Application Data, Application Data",0.00125,Weather,0.001249
210,1.054627,2600:1408:ec00:1286::2e03,2600:8805:3d03:3f00:88c9:1a5:bc23:ce61,TCP,8714,"443  >  57928 [PSH, ACK] Seq=524686 Ack=84650 Win=64128 Len=8640 [TCP segment of a reassembled PDU]",0,Weather,0
211,1.054827,2600:8805:3d03:3f00:88c9:1a5:bc23:ce61,2600:1408:ec00:1286::2e03,TCP,74,57928  >  443 [ACK] Seq=84650 Ack=533326 Win=180992 Len=0,0.0002,Weather,0.000199
212,1.055487,2600:1408:ec00:1286::2e03,2600:8805:3d03:3f00:88c9:1a5:bc23:ce61,TCP,1280,443  >  57928 [ACK] Seq=533326 Ack=84650 Win=64128 Len=1206 [TCP segment of a reassembled PDU],0.00066,Weather,0.00066
213,1.055487,2600:1408:ec00:1286::2e03,2600:8805:3d03:3f00:88c9:1a5:bc23:ce61,TLSv1.3,8714,"Application Data, Application Data",0,Weather,0
214,1.055622,2600:8805:3d03:3f00:88c9:1a5:bc23:ce61,2600:1408:ec00:1286::2e03,TCP,74,57928  >  443 [ACK] Seq=84650 Ack=543172 Win=171264 Len=0,0.000135,Weather,0.000134
215,1.058111,2600:1408:ec00:1286::2e03,2600:8805:3d03:3f00:88c9:1a5:bc23:ce61,TCP,8714,"443  >  57928 [PSH, ACK] Seq=543172 Ack=84650 Win=64128 Len=8640 [TCP segment of a reassembled PDU]",0.002489,Weather,0.002488
216,1.058195,2600:8805:3d03:3f00:88c9:1a5:bc23:ce61,2600:1408:ec00:1286::2e03,TCP,74,57928  >  443 [ACK] Seq=84650 Ack=551812 Win=162560 Len=0,8.4E-05,Weather,0.000083
217,1.058628,2600:8805:3d03:3f00:88c9:1a5:bc23:ce61,2600:1408:ec00:1286::2e03,TCP,74,[TCP Window Update] 57928  >  443 [ACK] Seq=84650 Ack=551812 Win=529920 Len=0,0.000433,Weather,0.000432
218,1.060699,2600:1408:ec00:1286::2e03,2600:8805:3d03:3f00:88c9:1a5:bc23:ce61,TLSv1.3,18794,"Application Data, Application Data",0.002071,Weather,0.002071
219,1.060699,2600:1408:ec00:1286::2e03,2600:8805:3d03:3f00:88c9:1a5:bc23:ce61,TLSv1.3,8714,"Application Data, Application Data",0,Weather,0
220,1.060931,2600:8805:3d03:3f00:88c9:1a5:bc23:ce61,2600:1408:ec00:1286::2e03,TCP,74,57928  >  443 [ACK] Seq=84650 Ack=579172 Win=529920 Len=0,0.000232,Weather,0.000232
221,1.064405,2600:1408:ec00:1286::2e03,2600:8805:3d03:3f00:88c9:1a5:bc23:ce61,TCP,1514,443  >  57928 [ACK] Seq=579172 Ack=84650 Win=64128 Len=1440 [TCP segment of a reassembled PDU],0.003474,Weather,0.003473
222,1.064405,2600:1408:ec00:1286::2e03,2600:8805:3d03:3f00:88c9:1a5:bc23:ce61,TCP,1514,443  >  57928 [ACK] Seq=580612 Ack=84650 Win=64128 Len=1440 [TCP segment of a reassembled PDU],0,Weather,0
223,1.064405,2600:1408:ec00:1286::2e03,2600:8805:3d03:3f00:88c9:1a5:bc23:ce61,TCP,1514,443  >  57928 [ACK] Seq=582052 Ack=84650 Win=64128 Len=1440 [TCP segment of a reassembled PDU],0,Weather,0
224,1.064405,2600:1408:ec00:1286::2e03,2600:8805:3d03:3f00:88c9:1a5:bc23:ce61,TCP,1514,"443  >  57928 [PSH, ACK] Seq=583492 Ack=84650 Win=64128 Len=1440 [TCP segment of a reassembled PDU]",0,Weather,0
225,1.064405,2600:1408:ec00:1286::2e03,2600:8805:3d03:3f00:88c9:1a5:bc23:ce61,TLSv1.3,18794,"Application Data, Application Data",0,Weather,0
226,1.064647,2600:8805:3d03:3f00:88c9:1a5:bc23:ce61,2600:1408:ec00:1286::2e03,TCP,74,57928  >  443 [ACK] Seq=84650 Ack=603652 Win=529920 Len=0,0.000242,Weather,0.000241
227,1.187356,2600:1408:ec00:1286::2e03,2600:8805:3d03:3f00:88c9:1a5:bc23:ce61,TLSv1.3,64874,"Application Data, Application Data, Application Data, Application Data, Application Data, Application Data, Application Data, Application Data",0.122709,Weather,0.122709
228,1.187356,2600:1408:ec00:1286::2e03,2600:8805:3d03:3f00:88c9:1a5:bc23:ce61,TLSv1.3,24554,"Application Data, Application Data, Application Data, Application Data",0,Weather,0
229,1.187885,2600:8805:3d03:3f00:88c9:1a5:bc23:ce61,2600:1408:ec00:1286::2e03,TCP,74,57928  >  443 [ACK] Seq=84650 Ack=692932 Win=529920 Len=0,0.000529,Weather,0.000529
230,1.190619,2600:1408:ec00:1286::2e03,2600:8805:3d03:3f00:88c9:1a5:bc23:ce61,TLSv1.3,20234,"Application Data, Application Data, Application Data, Application Data, Application Data, Application Data, Application Data",0.002734,Weather,0.002734
231,1.190619,2600:1408:ec00:1286::2e03,2600:8805:3d03:3f00:88c9:1a5:bc23:ce61,TLSv1.3,1300,Application Data,0,Weather,0
232,1.190619,2600:1408:ec00:1286::2e03,2600:8805:3d03:3f00:88c9:1a5:bc23:ce61,TCP,1300,[TCP Retransmission] 443  >  57928 [ACK] Seq=713092 Ack=84650 Win=64128 Len=1226 [TCP segment of a reassembled PDU],0,Weather,0
233,1.190907,2600:8805:3d03:3f00:88c9:1a5:bc23:ce61,2600:1408:ec00:1286::2e03,TCP,74,57928  >  443 [ACK] Seq=84650 Ack=714318 Win=529920 Len=0,0.000288,Weather,0.000287
234,1.19102,2600:8805:3d03:3f00:88c9:1a5:bc23:ce61,2600:1408:ec00:1286::2e03,TCP,86,[TCP Dup ACK 233#1] 57928  >  443 [ACK] Seq=84650 Ack=714318 Win=529920 Len=0 SLE=713092 SRE=714318,0.000113,Weather,0.000113
235,1.200847,2600:1408:ec00:1286::2e03,2600:8805:3d03:3f00:88c9:1a5:bc23:ce61,TCP,2954,443  >  57928 [ACK] Seq=714318 Ack=84650 Win=64128 Len=2880 [TCP segment of a reassembled PDU],0.009827,Weather,0.009827
236,1.200976,2600:8805:3d03:3f00:88c9:1a5:bc23:ce61,2600:1408:ec00:1286::2e03,TCP,74,57928  >  443 [ACK] Seq=84650 Ack=717198 Win=529920 Len=0,0.000129,Weather,0.000129
237,1.203486,2600:1408:ec00:1286::2e03,2600:8805:3d03:3f00:88c9:1a5:bc23:ce61,TLSv1.3,4394,"Application Data, Application Data",0.00251,Weather,0.00251
238,1.203486,2600:1408:ec00:1286::2e03,2600:8805:3d03:3f00:88c9:1a5:bc23:ce61,TCP,1012,"443  >  57928 [PSH, ACK] Seq=721518 Ack=84650 Win=64128 Len=938 [TCP segment of a reassembled PDU]",0,Weather,0
239,1.203486,2600:1408:ec00:1286::2e03,2600:8805:3d03:3f00:88c9:1a5:bc23:ce61,TLSv1.3,40394,"Application Data, Application Data, Application Data, Application Data, Application Data, Application Data, Application Data, Application Data",0,Weather,0
240,1.203835,2600:8805:3d03:3f00:88c9:1a5:bc23:ce61,2600:1408:ec00:1286::2e03,TCP,74,57928  >  443 [ACK] Seq=84650 Ack=762776 Win=529920 Len=0,0.000349,Weather,0.000348
241,1.205086,2600:1408:ec00:1286::2e03,2600:8805:3d03:3f00:88c9:1a5:bc23:ce61,TLSv1.3,23114,"Application Data, Application Data, Application Data, Application Data",0.001251,Weather,0.001251
242,1.205292,2600:8805:3d03:3f00:88c9:1a5:bc23:ce61,2600:1408:ec00:1286::2e03,TCP,74,57928  >  443 [ACK] Seq=84650 Ack=785816 Win=529920 Len=0,0.000206,Weather,0.000205
243,1.213821,2600:1408:ec00:1286::2e03,2600:8805:3d03:3f00:88c9:1a5:bc23:ce61,TLSv1.3,21674,"Application Data, Application Data, Application Data, Application Data",0.008529,Weather,0.008529
244,1.214059,2600:8805:3d03:3f00:88c9:1a5:bc23:ce61,2600:1408:ec00:1286::2e03,TCP,74,57928  >  443 [ACK] Seq=84650 Ack=807416 Win=1102848 Len=0,0.000238,Weather,0.000237
245,1.214336,2600:1408:ec00:1286::2e03,2600:8805:3d03:3f00:88c9:1a5:bc23:ce61,TLSv1.3,23114,"Application Data, Application Data, Application Data, Application Data, Application Data, Application Data",0.000277,Weather,0.000277
246,1.214539,2600:8805:3d03:3f00:88c9:1a5:bc23:ce61,2600:1408:ec00:1286::2e03,TCP,74,57928  >  443 [ACK] Seq=84650 Ack=830456 Win=1102848 Len=0,0.000203,Weather,0.000202
247,1.214648,2600:1408:ec00:1286::2e03,2600:8805:3d03:3f00:88c9:1a5:bc23:ce61,TLSv1.3,591,Application Data,0.000109,Weather,0.000108
248,1.268169,2600:8805:3d03:3f00:88c9:1a5:bc23:ce61,2600:1408:ec00:1286::2e03,TCP,74,57928  >  443 [ACK] Seq=84650 Ack=830973 Win=1102336 Len=0,0.053521,Weather,0.053521
249,1.383995,2600:8805:3d03:3f00:88c9:1a5:bc23:ce61,2600:1408:ec00:1286::2e03,TLSv1.3,2588,Application Data,0.115826,Weather,0.115826
250,1.387975,2600:8805:3d03:3f00:88c9:1a5:bc23:ce61,2600:1408:ec00:1286::2e03,TLSv1.3,2591,Application Data,0.00398,Weather,0.003979
251,1.404882,2600:1408:ec00:1286::2e03,2600:8805:3d03:3f00:88c9:1a5:bc23:ce61,TCP,74,443  >  57928 [ACK] Seq=830973 Ack=87164 Win=69248 Len=0,0.016907,Weather,0.016907
252,1.40694,2600:1408:ec00:1286::2e03,2600:8805:3d03:3f00:88c9:1a5:bc23:ce61,TCP,74,443  >  57928 [ACK] Seq=830973 Ack=89681 Win=74240 Len=0,0.002058,Weather,0.002058
253,1.421349,2600:1408:ec00:1286::2e03,2600:8805:3d03:3f00:88c9:1a5:bc23:ce61,TLSv1.3,1277,Application Data,0.014409,Weather,0.014408
