No.,Time,Source,Destination,Protocol,Length,Info,Time_Between,Website,Ttruncated
1,0,2600:8805:3d03:3f00:88c9:1a5:bc23:ce61,2600:1408:ec00:128b::2e03,TCP,86,51983  >  443 [SYN] Seq=0 Win=64800 Len=0 MSS=1440 WS=256 SACK_PERM,0,Weather,0
2,0.001429,2600:8805:3d03:3f00:88c9:1a5:bc23:ce61,2600:1408:ec00:128b::2e03,TCP,86,51984  >  443 [SYN] Seq=0 Win=64800 Len=0 MSS=1440 WS=256 SACK_PERM,0.001429,Weather,0.001429
3,0.02548,2600:1408:ec00:128b::2e03,2600:8805:3d03:3f00:88c9:1a5:bc23:ce61,TCP,86,"443  >  51984 [SYN, ACK] Seq=0 Ack=1 Win=64800 Len=0 MSS=1440 SACK_PERM WS=128",0.024051,Weather,0.024051
4,0.02548,2600:1408:ec00:128b::2e03,2600:8805:3d03:3f00:88c9:1a5:bc23:ce61,TCP,86,"443  >  51983 [SYN, ACK] Seq=0 Ack=1 Win=64800 Len=0 MSS=1440 SACK_PERM WS=128",0,Weather,0
5,0.02643,2600:8805:3d03:3f00:88c9:1a5:bc23:ce61,2600:1408:ec00:128b::2e03,TCP,74,51984  >  443 [ACK] Seq=1 Ack=1 Win=263424 Len=0,0.00095,Weather,0.000949
6,0.026562,2600:8805:3d03:3f00:88c9:1a5:bc23:ce61,2600:1408:ec00:128b::2e03,TCP,74,51983  >  443 [ACK] Seq=1 Ack=1 Win=263424 Len=0,0.000132,Weather,0.000132
7,0.028186,2600:8805:3d03:3f00:88c9:1a5:bc23:ce61,2600:1408:ec00:128b::2e03,TLSv1.3,876,Client Hello (SNI=weather.com),0.001624,Weather,0.001624
8,0.028501,2600:8805:3d03:3f00:88c9:1a5:bc23:ce61,2600:1408:ec00:128b::2e03,TLSv1.3,605,Client Hello (SNI=weather.com),0.000315,Weather,0.000314
9,0.049039,2600:1408:ec00:128b::2e03,2600:8805:3d03:3f00:88c9:1a5:bc23:ce61,TCP,74,443  >  51984 [ACK] Seq=1 Ack=803 Win=64128 Len=0,0.020538,Weather,0.020538
10,0.049845,2600:1408:ec00:128b::2e03,2600:8805:3d03:3f00:88c9:1a5:bc23:ce61,TCP,74,443  >  51983 [ACK] Seq=1 Ack=532 Win=64384 Len=0,0.000806,Weather,0.000806
11,0.05339,2600:1408:ec00:128b::2e03,2600:8805:3d03:3f00:88c9:1a5:bc23:ce61,TLSv1.3,2954,"Server Hello, Change Cipher Spec, Application Data",0.003545,Weather,0.003545
12,0.05339,2600:1408:ec00:128b::2e03,2600:8805:3d03:3f00:88c9:1a5:bc23:ce61,TLSv1.3,338,"Server Hello, Change Cipher Spec, Application Data, Application Data",0,Weather,0
13,0.05339,2600:1408:ec00:128b::2e03,2600:8805:3d03:3f00:88c9:1a5:bc23:ce61,TLSv1.3,1240,"Application Data, Application Data, Application Data",0,Weather,0
14,0.053549,2600:8805:3d03:3f00:88c9:1a5:bc23:ce61,2600:1408:ec00:128b::2e03,TCP,74,51983  >  443 [ACK] Seq=532 Ack=4047 Win=263424 Len=0,0.000159,Weather,0.000158
15,0.055978,2600:8805:3d03:3f00:88c9:1a5:bc23:ce61,2600:1408:ec00:128b::2e03,TLSv1.3,154,"Change Cipher Spec, Application Data",0.002429,Weather,0.002429
16,0.056638,2600:8805:3d03:3f00:88c9:1a5:bc23:ce61,2600:1408:ec00:128b::2e03,TLSv1.3,166,Application Data,0.00066,Weather,0.00066
17,0.056914,2600:8805:3d03:3f00:88c9:1a5:bc23:ce61,2600:1408:ec00:128b::2e03,TLSv1.3,154,"Change Cipher Spec, Application Data",0.000276,Weather,0.000275
18,0.057242,2600:8805:3d03:3f00:88c9:1a5:bc23:ce61,2600:1408:ec00:128b::2e03,TLSv1.3,2578,Application Data,0.000328,Weather,0.000328
19,0.077135,2600:1408:ec00:128b::2e03,2600:8805:3d03:3f00:88c9:1a5:bc23:ce61,TLSv1.3,345,Application Data,0.019893,Weather,0.019893
20,0.077135,2600:1408:ec00:128b::2e03,2600:8805:3d03:3f00:88c9:1a5:bc23:ce61,TCP,74,443  >  51983 [ACK] Seq=4047 Ack=3208 Win=63104 Len=0,0,Weather,0
21,0.077135,2600:1408:ec00:128b::2e03,2600:8805:3d03:3f00:88c9:1a5:bc23:ce61,TLSv1.3,345,Application Data,0,Weather,0
22,0.077829,2600:1408:ec00:128b::2e03,2600:8805:3d03:3f00:88c9:1a5:bc23:ce61,TLSv1.3,345,Application Data,0.000694,Weather,0.000694
23,0.077886,2600:8805:3d03:3f00:88c9:1a5:bc23:ce61,2600:1408:ec00:128b::2e03,TCP,74,51983  >  443 [ACK] Seq=3208 Ack=4589 Win=262912 Len=0,5.7E-05,Weather,0.000057
24,0.085146,2600:1408:ec00:128b::2e03,2600:8805:3d03:3f00:88c9:1a5:bc23:ce61,TLSv1.3,135,Application Data,0.00726,Weather,0.00726
25,0.085146,2600:1408:ec00:128b::2e03,2600:8805:3d03:3f00:88c9:1a5:bc23:ce61,TLSv1.3,105,Application Data,0,Weather,0
26,0.085254,2600:8805:3d03:3f00:88c9:1a5:bc23:ce61,2600:1408:ec00:128b::2e03,TCP,74,51983  >  443 [ACK] Seq=3208 Ack=4681 Win=262656 Len=0,0.000108,Weather,0.000107
27,0.085677,2600:8805:3d03:3f00:88c9:1a5:bc23:ce61,2600:1408:ec00:128b::2e03,TLSv1.3,105,Application Data,0.000423,Weather,0.000423
28,0.096011,2600:1408:ec00:128b::2e03,2600:8805:3d03:3f00:88c9:1a5:bc23:ce61,TLSv1.3,1311,Application Data,0.010334,Weather,0.010334
29,0.096076,2600:8805:3d03:3f00:88c9:1a5:bc23:ce61,2600:1408:ec00:128b::2e03,TCP,74,51983  >  443 [ACK] Seq=3239 Ack=5918 Win=263424 Len=0,6.5E-05,Weather,0.000064
30,0.097399,2600:1408:ec00:128b::2e03,2600:8805:3d03:3f00:88c9:1a5:bc23:ce61,TCP,4394,"443  >  51983 [PSH, ACK] Seq=5918 Ack=3208 Win=64128 Len=4320 [TCP segment of a reassembled PDU]",0.001323,Weather,0.001323
31,0.097704,2600:8805:3d03:3f00:88c9:1a5:bc23:ce61,2600:1408:ec00:128b::2e03,TCP,74,51983  >  443 [ACK] Seq=3239 Ack=10238 Win=263424 Len=0,0.000305,Weather,0.000305
32,0.097833,2600:1408:ec00:128b::2e03,2600:8805:3d03:3f00:88c9:1a5:bc23:ce61,TCP,4394,"443  >  51983 [PSH, ACK] Seq=10238 Ack=3208 Win=64128 Len=4320 [TCP segment of a reassembled PDU]",0.000129,Weather,0.000129
33,0.097833,2600:1408:ec00:128b::2e03,2600:8805:3d03:3f00:88c9:1a5:bc23:ce61,TCP,1514,"[TCP Previous segment not captured] 443  >  51983 [PSH, ACK] Seq=18878 Ack=3208 Win=64128 Len=1440 [TCP segment of a reassembled PDU]",0,Weather,0
34,0.097833,2600:1408:ec00:128b::2e03,2600:8805:3d03:3f00:88c9:1a5:bc23:ce61,TCP,1514,[TCP Out-Of-Order] 443  >  51983 [ACK] Seq=17438 Ack=3208 Win=64128 Len=1440 [TCP segment of a reassembled PDU],0,Weather,0
35,0.097888,2600:8805:3d03:3f00:88c9:1a5:bc23:ce61,2600:1408:ec00:128b::2e03,TCP,86,51983  >  443 [ACK] Seq=3239 Ack=14558 Win=263424 Len=0 SLE=18878 SRE=20318,5.5E-05,Weather,0.000054
36,0.097904,2600:8805:3d03:3f00:88c9:1a5:bc23:ce61,2600:1408:ec00:128b::2e03,TCP,86,[TCP Dup ACK 35#1] 51983  >  443 [ACK] Seq=3239 Ack=14558 Win=263424 Len=0 SLE=17438 SRE=20318,1.6E-05,Weather,0.000016
37,0.098421,2600:1408:ec00:128b::2e03,2600:8805:3d03:3f00:88c9:1a5:bc23:ce61,TCP,1514,443  >  51983 [ACK] Seq=20318 Ack=3208 Win=64128 Len=1440 [TCP segment of a reassembled PDU],0.000517,Weather,0.000516
38,0.098457,2600:8805:3d03:3f00:88c9:1a5:bc23:ce61,2600:1408:ec00:128b::2e03,TCP,86,[TCP Dup ACK 35#2] 51983  >  443 [ACK] Seq=3239 Ack=14558 Win=263424 Len=0 SLE=17438 SRE=21758,3.6E-05,Weather,0.000036
39,0.098797,2600:1408:ec00:128b::2e03,2600:8805:3d03:3f00:88c9:1a5:bc23:ce61,TCP,1514,[TCP Fast Retransmission] 443  >  51983 [ACK] Seq=14558 Ack=3208 Win=64128 Len=1440 [TCP segment of a reassembled PDU],0.00034,Weather,0.000339
40,0.098797,2600:1408:ec00:128b::2e03,2600:8805:3d03:3f00:88c9:1a5:bc23:ce61,TCP,1514,"443  >  51983 [PSH, ACK] Seq=21758 Ack=3208 Win=64128 Len=1440 [TCP segment of a reassembled PDU], Application Data",0,Weather,0
41,0.098797,2600:1408:ec00:128b::2e03,2600:8805:3d03:3f00:88c9:1a5:bc23:ce61,TCP,1514,"[TCP Out-Of-Order] 443  >  51983 [PSH, ACK] Seq=15998 Ack=3208 Win=64128 Len=1440",0,Weather,0
42,0.098797,2600:1408:ec00:128b::2e03,2600:8805:3d03:3f00:88c9:1a5:bc23:ce61,TCP,1514,443  >  51983 [ACK] Seq=23198 Ack=3208 Win=64128 Len=1440 [TCP segment of a reassembled PDU],0,Weather,0
43,0.098865,2600:8805:3d03:3f00:88c9:1a5:bc23:ce61,2600:1408:ec00:128b::2e03,TCP,86,51983  >  443 [ACK] Seq=3239 Ack=15998 Win=263424 Len=0 SLE=17438 SRE=21758,6.8E-05,Weather,0.000067
44,0.098892,2600:8805:3d03:3f00:88c9:1a5:bc23:ce61,2600:1408:ec00:128b::2e03,TCP,86,[TCP Dup ACK 43#1] 51983  >  443 [ACK] Seq=3239 Ack=15998 Win=263424 Len=0 SLE=17438 SRE=23198,2.7E-05,Weather,0.000026
45,0.098942,2600:8805:3d03:3f00:88c9:1a5:bc23:ce61,2600:1408:ec00:128b::2e03,TCP,74,51983  >  443 [ACK] Seq=3239 Ack=23198 Win=263424 Len=0,5E-05,Weather,0.00005
46,0.099038,2600:8805:3d03:3f00:88c9:1a5:bc23:ce61,2600:1408:ec00:128b::2e03,TCP,74,51983  >  443 [ACK] Seq=3239 Ack=24638 Win=263424 Len=0,9.6E-05,Weather,0.000095
47,0.10179,2600:1408:ec00:128b::2e03,2600:8805:3d03:3f00:88c9:1a5:bc23:ce61,TCP,2954,"443  >  51983 [PSH, ACK] Seq=24638 Ack=3208 Win=64128 Len=2880 [TCP segment of a reassembled PDU]",0.002752,Weather,0.002752
48,0.10179,2600:1408:ec00:128b::2e03,2600:8805:3d03:3f00:88c9:1a5:bc23:ce61,TCP,4394,"443  >  51983 [PSH, ACK] Seq=27518 Ack=3208 Win=64128 Len=4320 [TCP segment of a reassembled PDU]",0,Weather,0
49,0.10201,2600:8805:3d03:3f00:88c9:1a5:bc23:ce61,2600:1408:ec00:128b::2e03,TCP,74,51983  >  443 [ACK] Seq=3239 Ack=27518 Win=263424 Len=0,0.00022,Weather,0.000219
50,0.102158,2600:8805:3d03:3f00:88c9:1a5:bc23:ce61,2600:1408:ec00:128b::2e03,TCP,74,51983  >  443 [ACK] Seq=3239 Ack=31838 Win=263424 Len=0,0.000148,Weather,0.000147
51,0.102223,2600:1408:ec00:128b::2e03,2600:8805:3d03:3f00:88c9:1a5:bc23:ce61,TCP,1514,443  >  51983 [ACK] Seq=31838 Ack=3208 Win=64128 Len=1440 [TCP segment of a reassembled PDU],6.5E-05,Weather,0.000064
52,0.102291,2600:8805:3d03:3f00:88c9:1a5:bc23:ce61,2600:1408:ec00:128b::2e03,TCP,74,51983  >  443 [ACK] Seq=3239 Ack=33278 Win=263424 Len=0,6.8E-05,Weather,0.000068
53,0.110527,2600:8805:3d03:3f00:88c9:1a5:bc23:ce61,2600:1408:ec00:128b::2e03,TLSv1.3,2495,Application Data,0.008236,Weather,0.008235
54,0.124202,2600:8805:3d03:3f00:88c9:1a5:bc23:ce61,2600:1408:ec00:128b::2e03,TCP,74,51984  >  443 [ACK] Seq=883 Ack=536 Win=262912 Len=0,0.013675,Weather,0.013675
55,0.124361,2600:1408:ec00:128b::2e03,2600:8805:3d03:3f00:88c9:1a5:bc23:ce61,TCP,1514,443  >  51983 [ACK] Seq=33278 Ack=3239 Win=64128 Len=1440 [TCP segment of a reassembled PDU],0.000159,Weather,0.000158
56,0.124361,2600:1408:ec00:128b::2e03,2600:8805:3d03:3f00:88c9:1a5:bc23:ce61,TCP,2954,"443  >  51983 [PSH, ACK] Seq=34718 Ack=3239 Win=64128 Len=2880 [TCP segment of a reassembled PDU]",0,Weather,0
57,0.124361,2600:1408:ec00:128b::2e03,2600:8805:3d03:3f00:88c9:1a5:bc23:ce61,TLSv1.3,7274,"Application Data, Application Data",0,Weather,0
58,0.124742,2600:8805:3d03:3f00:88c9:1a5:bc23:ce61,2600:1408:ec00:128b::2e03,TCP,74,51983  >  443 [ACK] Seq=5660 Ack=37598 Win=263424 Len=0,0.000381,Weather,0.000381
59,0.124876,2600:8805:3d03:3f00:88c9:1a5:bc23:ce61,2600:1408:ec00:128b::2e03,TCP,74,51983  >  443 [ACK] Seq=5660 Ack=44798 Win=263424 Len=0,0.000134,Weather,0.000133
60,0.126478,2600:1408:ec00:128b::2e03,2600:8805:3d03:3f00:88c9:1a5:bc23:ce61,TCP,2954,"443  >  51983 [PSH, ACK] Seq=44798 Ack=3239 Win=64128 Len=2880 [TCP segment of a reassembled PDU]",0.001602,Weather,0.001602
61,0.126578,2600:8805:3d03:3f00:88c9:1a5:bc23:ce61,2600:1408:ec00:128b::2e03,TCP,74,51983  >  443 [ACK] Seq=5660 Ack=47678 Win=263424 Len=0,1E-04,Weather,0.000099
62,0.127295,2600:1408:ec00:128b::2e03,2600:8805:3d03:3f00:88c9:1a5:bc23:ce61,TLSv1.3,8714,Application Data,0.000717,Weather,0.000716
63,0.127537,2600:8805:3d03:3f00:88c9:1a5:bc23:ce61,2600:1408:ec00:128b::2e03,TCP,74,51983  >  443 [ACK] Seq=5660 Ack=56318 Win=263424 Len=0,0.000242,Weather,0.000242
64,0.128106,2600:1408:ec00:128b::2e03,2600:8805:3d03:3f00:88c9:1a5:bc23:ce61,TCP,1514,443  >  51983 [ACK] Seq=56318 Ack=3239 Win=64128 Len=1440 [TCP segment of a reassembled PDU],0.000569,Weather,0.000568
65,0.128169,2600:8805:3d03:3f00:88c9:1a5:bc23:ce61,2600:1408:ec00:128b::2e03,TCP,74,51983  >  443 [ACK] Seq=5660 Ack=57758 Win=263424 Len=0,6.3E-05,Weather,0.000063
66,0.128481,2600:1408:ec00:128b::2e03,2600:8805:3d03:3f00:88c9:1a5:bc23:ce61,TLSv1.3,4394,Application Data,0.000312,Weather,0.000312
67,0.128556,2600:8805:3d03:3f00:88c9:1a5:bc23:ce61,2600:1408:ec00:128b::2e03,TCP,74,51983  >  443 [ACK] Seq=5660 Ack=62078 Win=263424 Len=0,7.5E-05,Weather,0.000074
68,0.129858,2600:1408:ec00:128b::2e03,2600:8805:3d03:3f00:88c9:1a5:bc23:ce61,TCP,1514,443  >  51983 [ACK] Seq=62078 Ack=3239 Win=64128 Len=1440 [TCP segment of a reassembled PDU],0.001302,Weather,0.001302
69,0.129938,2600:8805:3d03:3f00:88c9:1a5:bc23:ce61,2600:1408:ec00:128b::2e03,TCP,74,51983  >  443 [ACK] Seq=5660 Ack=63518 Win=263424 Len=0,8E-05,Weather,0.000079
70,0.130482,2600:1408:ec00:128b::2e03,2600:8805:3d03:3f00:88c9:1a5:bc23:ce61,TCP,5834,"443  >  51983 [PSH, ACK] Seq=63518 Ack=3239 Win=64128 Len=5760 [TCP segment of a reassembled PDU]",0.000544,Weather,0.000543
71,0.13057,2600:8805:3d03:3f00:88c9:1a5:bc23:ce61,2600:1408:ec00:128b::2e03,TCP,74,51983  >  443 [ACK] Seq=5660 Ack=69278 Win=263424 Len=0,8.8E-05,Weather,0.000088
72,0.132662,2600:1408:ec00:128b::2e03,2600:8805:3d03:3f00:88c9:1a5:bc23:ce61,TCP,1514,"443  >  51983 [PSH, ACK] Seq=69278 Ack=3239 Win=64128 Len=1440 [TCP segment of a reassembled PDU]",0.002092,Weather,0.002092
73,0.132747,2600:8805:3d03:3f00:88c9:1a5:bc23:ce61,2600:1408:ec00:128b::2e03,TCP,74,51983  >  443 [ACK] Seq=5660 Ack=70718 Win=263424 Len=0,8.5E-05,Weather,0.000085
74,0.133101,2600:1408:ec00:128b::2e03,2600:8805:3d03:3f00:88c9:1a5:bc23:ce61,TCP,5834,"443  >  51983 [PSH, ACK] Seq=70718 Ack=3239 Win=64128 Len=5760 [TCP segment of a reassembled PDU]",0.000354,Weather,0.000353
75,0.133101,2600:1408:ec00:128b::2e03,2600:8805:3d03:3f00:88c9:1a5:bc23:ce61,TCP,74,443  >  51983 [ACK] Seq=76478 Ack=5660 Win=63744 Len=0,0,Weather,0
76,0.133101,2600:1408:ec00:128b::2e03,2600:8805:3d03:3f00:88c9:1a5:bc23:ce61,TLSv1.3,2954,"Application Data, Application Data",0,Weather,0
77,0.133233,2600:8805:3d03:3f00:88c9:1a5:bc23:ce61,2600:1408:ec00:128b::2e03,TCP,74,51983  >  443 [ACK] Seq=5660 Ack=79358 Win=263424 Len=0,0.000132,Weather,0.000131
78,0.134077,2600:1408:ec00:128b::2e03,2600:8805:3d03:3f00:88c9:1a5:bc23:ce61,TCP,2954,"443  >  51983 [PSH, ACK] Seq=79358 Ack=5660 Win=64128 Len=2880 [TCP segment of a reassembled PDU]",0.000844,Weather,0.000844
79,0.134166,2600:8805:3d03:3f00:88c9:1a5:bc23:ce61,2600:1408:ec00:128b::2e03,TCP,74,51983  >  443 [ACK] Seq=5660 Ack=82238 Win=263424 Len=0,8.9E-05,Weather,0.000089
80,0.134438,2600:1408:ec00:128b::2e03,2600:8805:3d03:3f00:88c9:1a5:bc23:ce61,TCP,1514,443  >  51983 [ACK] Seq=82238 Ack=5660 Win=64128 Len=1440 [TCP segment of a reassembled PDU],0.000272,Weather,0.000271
81,0.13509,2600:1408:ec00:128b::2e03,2600:8805:3d03:3f00:88c9:1a5:bc23:ce61,TCP,1514,"443  >  51983 [PSH, ACK] Seq=83678 Ack=5660 Win=64128 Len=1440 [TCP segment of a reassembled PDU]",0.000652,Weather,0.000651
82,0.135154,2600:8805:3d03:3f00:88c9:1a5:bc23:ce61,2600:1408:ec00:128b::2e03,TCP,74,51983  >  443 [ACK] Seq=5660 Ack=85118 Win=263424 Len=0,6.4E-05,Weather,0.000064
83,0.135484,2600:1408:ec00:128b::2e03,2600:8805:3d03:3f00:88c9:1a5:bc23:ce61,TLSv1.3,2954,Application Data,0.00033,Weather,0.000329
84,0.135547,2600:8805:3d03:3f00:88c9:1a5:bc23:ce61,2600:1408:ec00:128b::2e03,TCP,74,51983  >  443 [ACK] Seq=5660 Ack=87998 Win=263424 Len=0,6.3E-05,Weather,0.000063
85,0.135839,2600:1408:ec00:128b::2e03,2600:8805:3d03:3f00:88c9:1a5:bc23:ce61,TCP,2954,"443  >  51983 [PSH, ACK] Seq=87998 Ack=5660 Win=64128 Len=2880 [TCP segment of a reassembled PDU]",0.000292,Weather,0.000291
86,0.135917,2600:8805:3d03:3f00:88c9:1a5:bc23:ce61,2600:1408:ec00:128b::2e03,TCP,74,51983  >  443 [ACK] Seq=5660 Ack=90878 Win=263424 Len=0,7.8E-05,Weather,0.000078
87,0.148903,2600:1408:ec00:128b::2e03,2600:8805:3d03:3f00:88c9:1a5:bc23:ce61,TCP,1514,443  >  51983 [ACK] Seq=90878 Ack=5660 Win=64128 Len=1440 [TCP segment of a reassembled PDU],0.012986,Weather,0.012986
88,0.14987,2600:1408:ec00:128b::2e03,2600:8805:3d03:3f00:88c9:1a5:bc23:ce61,TCP,4394,"443  >  51983 [PSH, ACK] Seq=92318 Ack=5660 Win=64128 Len=4320 [TCP segment of a reassembled PDU]",0.000967,Weather,0.000966
89,0.150181,2600:8805:3d03:3f00:88c9:1a5:bc23:ce61,2600:1408:ec00:128b::2e03,TCP,74,51983  >  443 [ACK] Seq=5660 Ack=96638 Win=263424 Len=0,0.000311,Weather,0.000311
90,0.150548,2600:1408:ec00:128b::2e03,2600:8805:3d03:3f00:88c9:1a5:bc23:ce61,TCP,1514,443  >  51983 [ACK] Seq=96638 Ack=5660 Win=64128 Len=1440 [TCP segment of a reassembled PDU],0.000367,Weather,0.000366
91,0.150548,2600:1408:ec00:128b::2e03,2600:8805:3d03:3f00:88c9:1a5:bc23:ce61,TCP,2954,"443  >  51983 [PSH, ACK] Seq=98078 Ack=5660 Win=64128 Len=2880 [TCP segment of a reassembled PDU]",0,Weather,0
92,0.150766,2600:8805:3d03:3f00:88c9:1a5:bc23:ce61,2600:1408:ec00:128b::2e03,TCP,74,51983  >  443 [ACK] Seq=5660 Ack=100958 Win=263424 Len=0,0.000218,Weather,0.000218
93,0.151031,2600:1408:ec00:128b::2e03,2600:8805:3d03:3f00:88c9:1a5:bc23:ce61,TCP,1514,"443  >  51983 [PSH, ACK] Seq=100958 Ack=5660 Win=64128 Len=1440 [TCP segment of a reassembled PDU]",0.000265,Weather,0.000264
94,0.151031,2600:1408:ec00:128b::2e03,2600:8805:3d03:3f00:88c9:1a5:bc23:ce61,TLSv1.3,648,"Application Data, Application Data",0,Weather,0
95,0.151411,2600:8805:3d03:3f00:88c9:1a5:bc23:ce61,2600:1408:ec00:128b::2e03,TCP,74,51983  >  443 [ACK] Seq=5660 Ack=102972 Win=263424 Len=0,0.00038,Weather,0.000379
96,0.151499,2600:1408:ec00:128b::2e03,2600:8805:3d03:3f00:88c9:1a5:bc23:ce61,TCP,2954,"443  >  51983 [PSH, ACK] Seq=102972 Ack=5660 Win=64128 Len=2880 [TCP segment of a reassembled PDU]",8.8E-05,Weather,0.000088
97,0.151621,2600:8805:3d03:3f00:88c9:1a5:bc23:ce61,2600:1408:ec00:128b::2e03,TCP,74,51983  >  443 [ACK] Seq=5660 Ack=105852 Win=263424 Len=0,0.000122,Weather,0.000122
98,0.153494,2600:1408:ec00:128b::2e03,2600:8805:3d03:3f00:88c9:1a5:bc23:ce61,TCP,7274,"443  >  51983 [PSH, ACK] Seq=105852 Ack=5660 Win=64128 Len=7200 [TCP segment of a reassembled PDU]",0.001873,Weather,0.001872
99,0.153622,2600:8805:3d03:3f00:88c9:1a5:bc23:ce61,2600:1408:ec00:128b::2e03,TCP,74,51983  >  443 [ACK] Seq=5660 Ack=113052 Win=263424 Len=0,0.000128,Weather,0.000128
100,0.153695,2600:1408:ec00:128b::2e03,2600:8805:3d03:3f00:88c9:1a5:bc23:ce61,TCP,2954,"443  >  51983 [PSH, ACK] Seq=113052 Ack=5660 Win=64128 Len=2880 [TCP segment of a reassembled PDU]",7.3E-05,Weather,0.000072
101,0.153794,2600:8805:3d03:3f00:88c9:1a5:bc23:ce61,2600:1408:ec00:128b::2e03,TCP,74,51983  >  443 [ACK] Seq=5660 Ack=115932 Win=263424 Len=0,9.9E-05,Weather,0.000098
102,0.15472,2600:1408:ec00:128b::2e03,2600:8805:3d03:3f00:88c9:1a5:bc23:ce61,TCP,2954,443  >  51983 [ACK] Seq=115932 Ack=5660 Win=64128 Len=2880 [TCP segment of a reassembled PDU],0.000926,Weather,0.000926
103,0.154808,2600:8805:3d03:3f00:88c9:1a5:bc23:ce61,2600:1408:ec00:128b::2e03,TCP,74,51983  >  443 [ACK] Seq=5660 Ack=118812 Win=263424 Len=0,8.8E-05,Weather,0.000088
104,0.155367,2600:1408:ec00:128b::2e03,2600:8805:3d03:3f00:88c9:1a5:bc23:ce61,TLSv1.3,4394,"Application Data, Application Data",0.000559,Weather,0.000559
105,0.155446,2600:8805:3d03:3f00:88c9:1a5:bc23:ce61,2600:1408:ec00:128b::2e03,TCP,74,51983  >  443 [ACK] Seq=5660 Ack=123132 Win=263424 Len=0,7.9E-05,Weather,0.000078
106,0.156191,2600:1408:ec00:128b::2e03,2600:8805:3d03:3f00:88c9:1a5:bc23:ce61,TCP,1514,"443  >  51983 [PSH, ACK] Seq=123132 Ack=5660 Win=64128 Len=1440 [TCP segment of a reassembled PDU]",0.000745,Weather,0.000744
107,0.156272,2600:8805:3d03:3f00:88c9:1a5:bc23:ce61,2600:1408:ec00:128b::2e03,TCP,74,51983  >  443 [ACK] Seq=5660 Ack=124572 Win=263424 Len=0,8.1E-05,Weather,0.00008
108,0.157173,2600:1408:ec00:128b::2e03,2600:8805:3d03:3f00:88c9:1a5:bc23:ce61,TCP,4394,"443  >  51983 [PSH, ACK] Seq=124572 Ack=5660 Win=64128 Len=4320 [TCP segment of a reassembled PDU]",0.000901,Weather,0.000901
109,0.157277,2600:8805:3d03:3f00:88c9:1a5:bc23:ce61,2600:1408:ec00:128b::2e03,TCP,74,51983  >  443 [ACK] Seq=5660 Ack=128892 Win=263424 Len=0,0.000104,Weather,0.000103
110,0.159115,2600:1408:ec00:128b::2e03,2600:8805:3d03:3f00:88c9:1a5:bc23:ce61,TLSv1.3,11594,"Application Data, Application Data",0.001838,Weather,0.001838
111,0.159276,2600:8805:3d03:3f00:88c9:1a5:bc23:ce61,2600:1408:ec00:128b::2e03,TCP,74,51983  >  443 [ACK] Seq=5660 Ack=140412 Win=263424 Len=0,0.000161,Weather,0.00016
112,0.159739,2600:1408:ec00:128b::2e03,2600:8805:3d03:3f00:88c9:1a5:bc23:ce61,TCP,4394,"443  >  51983 [PSH, ACK] Seq=140412 Ack=5660 Win=64128 Len=4320 [TCP segment of a reassembled PDU]",0.000463,Weather,0.000462
113,0.159833,2600:8805:3d03:3f00:88c9:1a5:bc23:ce61,2600:1408:ec00:128b::2e03,TCP,74,51983  >  443 [ACK] Seq=5660 Ack=144732 Win=263424 Len=0,9.4E-05,Weather,0.000094
114,0.160439,2600:1408:ec00:128b::2e03,2600:8805:3d03:3f00:88c9:1a5:bc23:ce61,TCP,1514,"443  >  51983 [PSH, ACK] Seq=144732 Ack=5660 Win=64128 Len=1440 [TCP segment of a reassembled PDU]",0.000606,Weather,0.000605
115,0.161888,2600:1408:ec00:128b::2e03,2600:8805:3d03:3f00:88c9:1a5:bc23:ce61,TCP,5834,"443  >  51983 [PSH, ACK] Seq=146172 Ack=5660 Win=64128 Len=5760 [TCP segment of a reassembled PDU]",0.001449,Weather,0.001449
116,0.161994,2600:8805:3d03:3f00:88c9:1a5:bc23:ce61,2600:1408:ec00:128b::2e03,TCP,74,51983  >  443 [ACK] Seq=5660 Ack=151932 Win=263424 Len=0,0.000106,Weather,0.000105
117,0.162994,2600:1408:ec00:128b::2e03,2600:8805:3d03:3f00:88c9:1a5:bc23:ce61,TLSv1.3,4394,"Application Data, Application Data",0.001,Weather,0.001
118,0.163083,2600:8805:3d03:3f00:88c9:1a5:bc23:ce61,2600:1408:ec00:128b::2e03,TCP,74,51983  >  443 [ACK] Seq=5660 Ack=156252 Win=263424 Len=0,8.9E-05,Weather,0.000089
119,0.163732,2600:1408:ec00:128b::2e03,2600:8805:3d03:3f00:88c9:1a5:bc23:ce61,TCP,2954,"443  >  51983 [PSH, ACK] Seq=156252 Ack=5660 Win=64128 Len=2880 [TCP segment of a reassembled PDU]",0.000649,Weather,0.000648
120,0.163838,2600:8805:3d03:3f00:88c9:1a5:bc23:ce61,2600:1408:ec00:128b::2e03,TCP,74,51983  >  443 [ACK] Seq=5660 Ack=159132 Win=263424 Len=0,0.000106,Weather,0.000106
121,0.165488,2600:1408:ec00:128b::2e03,2600:8805:3d03:3f00:88c9:1a5:bc23:ce61,TLSv1.3,8714,"Application Data, Application Data",0.00165,Weather,0.001649
122,0.165616,2600:8805:3d03:3f00:88c9:1a5:bc23:ce61,2600:1408:ec00:128b::2e03,TCP,74,51983  >  443 [ACK] Seq=5660 Ack=167772 Win=263424 Len=0,0.000128,Weather,0.000128
123,0.166254,2600:1408:ec00:128b::2e03,2600:8805:3d03:3f00:88c9:1a5:bc23:ce61,TLSv1.3,5834,Application Data,0.000638,Weather,0.000638
124,0.166319,2600:8805:3d03:3f00:88c9:1a5:bc23:ce61,2600:1408:ec00:128b::2e03,TCP,74,51983  >  443 [ACK] Seq=5660 Ack=173532 Win=263424 Len=0,6.5E-05,Weather,0.000064
125,0.167224,2600:1408:ec00:128b::2e03,2600:8805:3d03:3f00:88c9:1a5:bc23:ce61,TCP,7274,"443  >  51983 [PSH, ACK] Seq=173532 Ack=5660 Win=64128 Len=7200 [TCP segment of a reassembled PDU]",0.000905,Weather,0.000905
126,0.167298,2600:8805:3d03:3f00:88c9:1a5:bc23:ce61,2600:1408:ec00:128b::2e03,TCP,74,51983  >  443 [ACK] Seq=5660 Ack=180732 Win=263424 Len=0,7.4E-05,Weather,0.000073
127,0.167483,2600:1408:ec00:128b::2e03,2600:8805:3d03:3f00:88c9:1a5:bc23:ce61,TCP,1514,443  >  51983 [ACK] Seq=180732 Ack=5660 Win=64128 Len=1440 [TCP segment of a reassembled PDU],0.000185,Weather,0.000184
128,0.167547,2600:8805:3d03:3f00:88c9:1a5:bc23:ce61,2600:1408:ec00:128b::2e03,TCP,74,51983  >  443 [ACK] Seq=5660 Ack=182172 Win=263424 Len=0,6.4E-05,Weather,0.000064
129,0.168057,2600:1408:ec00:128b::2e03,2600:8805:3d03:3f00:88c9:1a5:bc23:ce61,TCP,2954,"443  >  51983 [PSH, ACK] Seq=182172 Ack=5660 Win=64128 Len=2880 [TCP segment of a reassembled PDU]",0.00051,Weather,0.00051
130,0.16813,2600:8805:3d03:3f00:88c9:1a5:bc23:ce61,2600:1408:ec00:128b::2e03,TCP,74,51983  >  443 [ACK] Seq=5660 Ack=185052 Win=263424 Len=0,7.3E-05,Weather,0.000072
131,0.168464,2600:1408:ec00:128b::2e03,2600:8805:3d03:3f00:88c9:1a5:bc23:ce61,TLSv1.3,1514,"Application Data, Application Data",0.000334,Weather,0.000334
132,0.169115,2600:1408:ec00:128b::2e03,2600:8805:3d03:3f00:88c9:1a5:bc23:ce61,TCP,2954,"443  >  51983 [PSH, ACK] Seq=186492 Ack=5660 Win=64128 Len=2880 [TCP segment of a reassembled PDU]",0.000651,Weather,0.00065
133,0.169154,2600:8805:3d03:3f00:88c9:1a5:bc23:ce61,2600:1408:ec00:128b::2e03,TCP,74,51983  >  443 [ACK] Seq=5660 Ack=189372 Win=263424 Len=0,3.9E-05,Weather,0.000039
134,0.169505,2600:1408:ec00:128b::2e03,2600:8805:3d03:3f00:88c9:1a5:bc23:ce61,TCP,1514,443  >  51983 [ACK] Seq=189372 Ack=5660 Win=64128 Len=1440 [TCP segment of a reassembled PDU],0.000351,Weather,0.00035
135,0.169569,2600:8805:3d03:3f00:88c9:1a5:bc23:ce61,2600:1408:ec00:128b::2e03,TCP,74,51983  >  443 [ACK] Seq=5660 Ack=190812 Win=263424 Len=0,6.4E-05,Weather,0.000064
136,0.170405,2600:1408:ec00:128b::2e03,2600:8805:3d03:3f00:88c9:1a5:bc23:ce61,TCP,2954,"443  >  51983 [PSH, ACK] Seq=190812 Ack=5660 Win=64128 Len=2880 [TCP segment of a reassembled PDU]",0.000836,Weather,0.000836
137,0.170496,2600:8805:3d03:3f00:88c9:1a5:bc23:ce61,2600:1408:ec00:128b::2e03,TCP,74,51983  >  443 [ACK] Seq=5660 Ack=193692 Win=263424 Len=0,9.1E-05,Weather,0.000091
138,0.170729,2600:1408:ec00:128b::2e03,2600:8805:3d03:3f00:88c9:1a5:bc23:ce61,TCP,4394,"443  >  51983 [PSH, ACK] Seq=193692 Ack=5660 Win=64128 Len=4320 [TCP segment of a reassembled PDU]",0.000233,Weather,0.000232
139,0.170817,2600:8805:3d03:3f00:88c9:1a5:bc23:ce61,2600:1408:ec00:128b::2e03,TCP,74,51983  >  443 [ACK] Seq=5660 Ack=198012 Win=263424 Len=0,8.8E-05,Weather,0.000088
140,0.171111,2600:1408:ec00:128b::2e03,2600:8805:3d03:3f00:88c9:1a5:bc23:ce61,TCP,2954,443  >  51983 [ACK] Seq=198012 Ack=5660 Win=64128 Len=2880 [TCP segment of a reassembled PDU],0.000294,Weather,0.000294
141,0.171173,2600:8805:3d03:3f00:88c9:1a5:bc23:ce61,2600:1408:ec00:128b::2e03,TCP,74,51983  >  443 [ACK] Seq=5660 Ack=200892 Win=263424 Len=0,6.2E-05,Weather,0.000061
142,0.172156,2600:1408:ec00:128b::2e03,2600:8805:3d03:3f00:88c9:1a5:bc23:ce61,TLSv1.3,1514,"Application Data, Application Data",0.000983,Weather,0.000983
143,0.172222,2600:8805:3d03:3f00:88c9:1a5:bc23:ce61,2600:1408:ec00:128b::2e03,TCP,74,51983  >  443 [ACK] Seq=5660 Ack=202332 Win=263424 Len=0,6.6E-05,Weather,0.000065
144,0.172595,2600:1408:ec00:128b::2e03,2600:8805:3d03:3f00:88c9:1a5:bc23:ce61,TCP,4394,"443  >  51983 [PSH, ACK] Seq=202332 Ack=5660 Win=64128 Len=4320 [TCP segment of a reassembled PDU]",0.000373,Weather,0.000373
145,0.172688,2600:8805:3d03:3f00:88c9:1a5:bc23:ce61,2600:1408:ec00:128b::2e03,TCP,74,51983  >  443 [ACK] Seq=5660 Ack=206652 Win=263424 Len=0,9.3E-05,Weather,0.000093
146,0.173812,2600:1408:ec00:128b::2e03,2600:8805:3d03:3f00:88c9:1a5:bc23:ce61,TCP,5834,"443  >  51983 [PSH, ACK] Seq=206652 Ack=5660 Win=64128 Len=5760 [TCP segment of a reassembled PDU]",0.001124,Weather,0.001123
147,0.173922,2600:8805:3d03:3f00:88c9:1a5:bc23:ce61,2600:1408:ec00:128b::2e03,TCP,74,51983  >  443 [ACK] Seq=5660 Ack=212412 Win=263424 Len=0,0.00011,Weather,0.000109
148,0.175132,2600:1408:ec00:128b::2e03,2600:8805:3d03:3f00:88c9:1a5:bc23:ce61,TCP,2954,"443  >  51983 [PSH, ACK] Seq=212412 Ack=5660 Win=64128 Len=2880 [TCP segment of a reassembled PDU]",0.00121,Weather,0.00121
149,0.175226,2600:8805:3d03:3f00:88c9:1a5:bc23:ce61,2600:1408:ec00:128b::2e03,TCP,74,51983  >  443 [ACK] Seq=5660 Ack=215292 Win=263424 Len=0,9.4E-05,Weather,0.000093
150,0.175979,2600:1408:ec00:128b::2e03,2600:8805:3d03:3f00:88c9:1a5:bc23:ce61,TLSv1.3,2954,"Application Data, Application Data",0.000753,Weather,0.000753
151,0.175979,2600:1408:ec00:128b::2e03,2600:8805:3d03:3f00:88c9:1a5:bc23:ce61,TLSv1.3,429,Application Data,0,Weather,0
152,0.176074,2600:8805:3d03:3f00:88c9:1a5:bc23:ce61,2600:1408:ec00:128b::2e03,TCP,74,51983  >  443 [ACK] Seq=5660 Ack=218527 Win=263424 Len=0,9.5E-05,Weather,0.000095
153,0.226135,2600:8805:3d03:3f00:88c9:1a5:bc23:ce61,2600:1408:ec00:128b::2e03,TLSv1.3,2468,Application Data,0.050061,Weather,0.050061
154,0.22623,2600:8805:3d03:3f00:88c9:1a5:bc23:ce61,2600:1408:ec00:128b::2e03,TLSv1.3,178,Application Data,9.5E-05,Weather,0.000094
155,0.226921,2600:8805:3d03:3f00:88c9:1a5:bc23:ce61,2600:1408:ec00:128b::2e03,TLSv1.3,2468,Application Data,0.000691,Weather,0.000691
156,0.226986,2600:8805:3d03:3f00:88c9:1a5:bc23:ce61,2600:1408:ec00:128b::2e03,TLSv1.3,207,Application Data,6.5E-05,Weather,0.000064
157,0.247736,2600:1408:ec00:128b::2e03,2600:8805:3d03:3f00:88c9:1a5:bc23:ce61,TCP,74,443  >  51983 [ACK] Seq=218527 Ack=10685 Win=61440 Len=0,0.02075,Weather,0.02075
158,0.290668,2600:1408:ec00:128b::2e03,2600:8805:3d03:3f00:88c9:1a5:bc23:ce61,TLSv1.3,1441,Application Data,0.042932,Weather,0.042932
159,0.290668,2600:1408:ec00:128b::2e03,2600:8805:3d03:3f00:88c9:1a5:bc23:ce61,TLSv1.3,1245,Application Data,0,Weather,0
160,0.291182,2600:8805:3d03:3f00:88c9:1a5:bc23:ce61,2600:1408:ec00:128b::2e03,TCP,74,51983  >  443 [ACK] Seq=10685 Ack=221065 Win=263424 Len=0,0.000514,Weather,0.000514
161,0.409431,2600:1408:ec00:128b::2e03,2600:8805:3d03:3f00:88c9:1a5:bc23:ce61,TLSv1.3,1441,Application Data,0.118249,Weather,0.118249
162,0.409845,2600:1408:ec00:128b::2e03,2600:8805:3d03:3f00:88c9:1a5:bc23:ce61,TLSv1.3,572,Application Data,0.000414,Weather,0.000414
163,0.409906,2600:8805:3d03:3f00:88c9:1a5:bc23:ce61,2600:1408:ec00:128b::2e03,TCP,74,51983  >  443 [ACK] Seq=10685 Ack=222930 Win=263424 Len=0,6.1E-05,Weather,0.00006
164,0.411188,2600:8805:3d03:3f00:88c9:1a5:bc23:ce61,2600:1408:ec00:128b::2e03,TLSv1.3,2564,Application Data,0.001282,Weather,0.001282
165,0.411271,2600:8805:3d03:3f00:88c9:1a5:bc23:ce61,2600:1408:ec00:128b::2e03,TLSv1.3,248,Application Data,8.3E-05,Weather,0.000082
166,0.435754,2600:1408:ec00:128b::2e03,2600:8805:3d03:3f00:88c9:1a5:bc23:ce61,TCP,74,443  >  51983 [ACK] Seq=222930 Ack=13349 Win=63360 Len=0,0.024483,Weather,0.024483
167,0.481569,2600:1408:ec00:128b::2e03,2600:8805:3d03:3f00:88c9:1a5:bc23:ce61,TLSv1.3,1441,Application Data,0.045815,Weather,0.045815
168,0.481569,2600:1408:ec00:128b::2e03,2600:8805:3d03:3f00:88c9:1a5:bc23:ce61,TLSv1.3,996,Application Data,0,Weather,0
169,0.482152,2600:8805:3d03:3f00:88c9:1a5:bc23:ce61,2600:1408:ec00:128b::2e03,TCP,74,51983  >  443 [ACK] Seq=13349 Ack=225219 Win=263424 Len=0,0.000583,Weather,0.000583
170,0.797195,2600:8805:3d03:3f00:88c9:1a5:bc23:ce61,2600:1408:ec00:128b::2e03,TLSv1.3,2540,Application Data,0.315043,Weather,0.315043
171,0.797312,2600:8805:3d03:3f00:88c9:1a5:bc23:ce61,2600:1408:ec00:128b::2e03,TLSv1.3,228,Application Data,0.000117,Weather,0.000117
172,0.799387,2600:8805:3d03:3f00:88c9:1a5:bc23:ce61,2600:1408:ec00:128b::2e03,TLSv1.3,2543,Application Data,0.002075,Weather,0.002074
173,0.79946,2600:8805:3d03:3f00:88c9:1a5:bc23:ce61,2600:1408:ec00:128b::2e03,TLSv1.3,203,Application Data,7.3E-05,Weather,0.000072
174,0.817686,2600:1408:ec00:128b::2e03,2600:8805:3d03:3f00:88c9:1a5:bc23:ce61,TCP,74,443  >  51983 [ACK] Seq=225219 Ack=18438 Win=61696 Len=0,0.018226,Weather,0.018226
175,0.856326,2600:1408:ec00:128b::2e03,2600:8805:3d03:3f00:88c9:1a5:bc23:ce61,TCP,74,443  >  51983 [ACK] Seq=225219 Ack=18567 Win=64128 Len=0,0.03864,Weather,0.03864
176,0.857943,2600:1408:ec00:128b::2e03,2600:8805:3d03:3f00:88c9:1a5:bc23:ce61,TLSv1.3,1440,Application Data,0.001617,Weather,0.001616
177,0.858296,2600:1408:ec00:128b::2e03,2600:8805:3d03:3f00:88c9:1a5:bc23:ce61,TLSv1.3,1241,Application Data,0.000353,Weather,0.000352
178,0.858361,2600:8805:3d03:3f00:88c9:1a5:bc23:ce61,2600:1408:ec00:128b::2e03,TCP,74,51983  >  443 [ACK] Seq=18567 Ack=227752 Win=263424 Len=0,6.5E-05,Weather,0.000065
179,0.901457,2600:1408:ec00:128b::2e03,2600:8805:3d03:3f00:88c9:1a5:bc23:ce61,TLSv1.3,1440,Application Data,0.043096,Weather,0.043095
180,0.901457,2600:1408:ec00:128b::2e03,2600:8805:3d03:3f00:88c9:1a5:bc23:ce61,TLSv1.3,673,Application Data,0,Weather,0
181,0.901563,2600:8805:3d03:3f00:88c9:1a5:bc23:ce61,2600:1408:ec00:128b::2e03,TCP,74,51983  >  443 [ACK] Seq=18567 Ack=229717 Win=263424 Len=0,0.000106,Weather,0.000106
182,0.913736,2600:8805:3d03:3f00:88c9:1a5:bc23:ce61,2600:1408:ec00:128b::2e03,TLSv1.3,2607,Application Data,0.012173,Weather,0.012173
183,0.913828,2600:8805:3d03:3f00:88c9:1a5:bc23:ce61,2600:1408:ec00:128b::2e03,TLSv1.3,477,Application Data,9.2E-05,Weather,0.000091
184,0.938805,2600:1408:ec00:128b::2e03,2600:8805:3d03:3f00:88c9:1a5:bc23:ce61,TCP,74,443  >  51983 [ACK] Seq=229717 Ack=20007 Win=64128 Len=0,0.024977,Weather,0.024977
185,0.938805,2600:1408:ec00:128b::2e03,2600:8805:3d03:3f00:88c9:1a5:bc23:ce61,TCP,74,443  >  51983 [ACK] Seq=229717 Ack=21100 Win=63744 Len=0,0,Weather,0
186,0.943173,2600:1408:ec00:128b::2e03,2600:8805:3d03:3f00:88c9:1a5:bc23:ce61,TCP,74,443  >  51983 [ACK] Seq=229717 Ack=21503 Win=64128 Len=0,0.004368,Weather,0.004368
187,1.056676,2600:1408:ec00:128b::2e03,2600:8805:3d03:3f00:88c9:1a5:bc23:ce61,TLSv1.3,1439,Application Data,0.113503,Weather,0.113503
188,1.056676,2600:1408:ec00:128b::2e03,2600:8805:3d03:3f00:88c9:1a5:bc23:ce61,TLSv1.3,1310,Application Data,0,Weather,0
189,1.056676,2600:1408:ec00:128b::2e03,2600:8805:3d03:3f00:88c9:1a5:bc23:ce61,TLSv1.3,553,Application Data,0,Weather,0
190,1.057175,2600:8805:3d03:3f00:88c9:1a5:bc23:ce61,2600:1408:ec00:128b::2e03,TCP,74,51983  >  443 [ACK] Seq=21503 Ack=232797 Win=263424 Len=0,0.000499,Weather,0.000499
191,1.087452,2600:8805:3d03:3f00:88c9:1a5:bc23:ce61,2600:1408:ec00:128b::2e03,TCP,86,52027  >  443 [SYN] Seq=0 Win=64800 Len=0 MSS=1440 WS=256 SACK_PERM,0.030277,Weather,0.030277
192,1.10517,2600:1408:ec00:128b::2e03,2600:8805:3d03:3f00:88c9:1a5:bc23:ce61,TCP,86,"443  >  52027 [SYN, ACK] Seq=0 Ack=1 Win=64800 Len=0 MSS=1440 SACK_PERM WS=128",0.017718,Weather,0.017717
193,1.105305,2600:8805:3d03:3f00:88c9:1a5:bc23:ce61,2600:1408:ec00:128b::2e03,TCP,74,52027  >  443 [ACK] Seq=1 Ack=1 Win=263424 Len=0,0.000135,Weather,0.000134
194,1.105824,2600:8805:3d03:3f00:88c9:1a5:bc23:ce61,2600:1408:ec00:128b::2e03,TLSv1.3,956,Client Hello (SNI=weather.com),0.000519,Weather,0.000518
195,1.131347,2600:1408:ec00:128b::2e03,2600:8805:3d03:3f00:88c9:1a5:bc23:ce61,TCP,74,443  >  52027 [ACK] Seq=1 Ack=883 Win=64128 Len=0,0.025523,Weather,0.025523
196,1.131347,2600:1408:ec00:128b::2e03,2600:8805:3d03:3f00:88c9:1a5:bc23:ce61,TCP,74,[TCP Dup ACK 195#1] 443  >  52027 [ACK] Seq=1 Ack=883 Win=64128 Len=0,0,Weather,0
197,1.131347,2600:1408:ec00:128b::2e03,2600:8805:3d03:3f00:88c9:1a5:bc23:ce61,TLSv1.3,338,"Server Hello, Change Cipher Spec, Application Data, Application Data",0,Weather,0
198,1.182914,2600:8805:3d03:3f00:88c9:1a5:bc23:ce61,2600:1408:ec00:128b::2e03,TCP,74,52027  >  443 [ACK] Seq=883 Ack=265 Win=263168 Len=0,0.051567,Weather,0.051566
199,1.480538,2600:8805:3d03:3f00:88c9:1a5:bc23:ce61,2600:1408:ec00:128b::2e03,TLSv1.3,154,"Change Cipher Spec, Application Data",0.297624,Weather,0.297624
200,1.481148,2600:8805:3d03:3f00:88c9:1a5:bc23:ce61,2600:1408:ec00:128b::2e03,TLSv1.3,166,Application Data,0.00061,Weather,0.000609
201,1.481363,2600:8805:3d03:3f00:88c9:1a5:bc23:ce61,2600:1408:ec00:128b::2e03,TLSv1.3,499,Application Data,0.000215,Weather,0.000215
202,1.501928,2600:1408:ec00:128b::2e03,2600:8805:3d03:3f00:88c9:1a5:bc23:ce61,TLSv1.3,361,Application Data,0.020565,Weather,0.020564
203,1.51085,2600:1408:ec00:128b::2e03,2600:8805:3d03:3f00:88c9:1a5:bc23:ce61,TCP,74,443  >  52027 [ACK] Seq=552 Ack=1480 Win=64128 Len=0,0.008922,Weather,0.008922
204,1.512888,2600:1408:ec00:128b::2e03,2600:8805:3d03:3f00:88c9:1a5:bc23:ce61,TLSv1.3,135,Application Data,0.002038,Weather,0.002037
205,1.512983,2600:8805:3d03:3f00:88c9:1a5:bc23:ce61,2600:1408:ec00:128b::2e03,TCP,74,52027  >  443 [ACK] Seq=1480 Ack=613 Win=262656 Len=0,9.5E-05,Weather,0.000094
206,1.513378,2600:8805:3d03:3f00:88c9:1a5:bc23:ce61,2600:1408:ec00:128b::2e03,TLSv1.3,105,Application Data,0.000395,Weather,0.000394
207,1.51905,2600:1408:ec00:128b::2e03,2600:8805:3d03:3f00:88c9:1a5:bc23:ce61,TLSv1.3,105,Application Data,0.005672,Weather,0.005672
208,1.521958,2600:1408:ec00:128b::2e03,2600:8805:3d03:3f00:88c9:1a5:bc23:ce61,TLSv1.3,1017,Application Data,0.002908,Weather,0.002907
209,1.522062,2600:8805:3d03:3f00:88c9:1a5:bc23:ce61,2600:1408:ec00:128b::2e03,TCP,74,52027  >  443 [ACK] Seq=1511 Ack=1587 Win=263424 Len=0,0.000104,Weather,0.000104
210,1.522263,2600:1408:ec00:128b::2e03,2600:8805:3d03:3f00:88c9:1a5:bc23:ce61,TLSv1.3,105,Application Data,0.000201,Weather,0.0002
211,1.566024,2600:8805:3d03:3f00:88c9:1a5:bc23:ce61,2600:1408:ec00:128b::2e03,TCP,74,52027  >  443 [ACK] Seq=1511 Ack=1618 Win=263424 Len=0,0.043761,Weather,0.043761
212,1.571087,2600:1408:ec00:128b::2e03,2600:8805:3d03:3f00:88c9:1a5:bc23:ce61,TCP,74,443  >  52027 [ACK] Seq=1618 Ack=1511 Win=64128 Len=0,0.005063,Weather,0.005062
213,2.254442,2600:8805:3d03:3f00:88c9:1a5:bc23:ce61,2600:1408:ec00:128b::2e03,TLSv1.3,2632,Application Data,0.683355,Weather,0.683355
214,2.254543,2600:8805:3d03:3f00:88c9:1a5:bc23:ce61,2600:1408:ec00:128b::2e03,TLSv1.3,228,Application Data,0.000101,Weather,0.0001
215,2.276827,2600:1408:ec00:128b::2e03,2600:8805:3d03:3f00:88c9:1a5:bc23:ce61,TCP,74,443  >  51983 [ACK] Seq=232797 Ack=24061 Win=63744 Len=0,0.022284,Weather,0.022284
216,2.276827,2600:1408:ec00:128b::2e03,2600:8805:3d03:3f00:88c9:1a5:bc23:ce61,TCP,74,443  >  51983 [ACK] Seq=232797 Ack=24215 Win=63616 Len=0,0,Weather,0
217,2.357483,2600:8805:3d03:3f00:88c9:1a5:bc23:ce61,2600:1408:ec00:128b::2e03,TLSv1.3,2632,Application Data,0.080656,Weather,0.080656
218,2.357571,2600:8805:3d03:3f00:88c9:1a5:bc23:ce61,2600:1408:ec00:128b::2e03,TLSv1.3,221,Application Data,8.8E-05,Weather,0.000087
219,2.360911,2600:8805:3d03:3f00:88c9:1a5:bc23:ce61,2600:1408:ec00:128b::2e03,TLSv1.3,2632,Application Data,0.00334,Weather,0.00334
220,2.361078,2600:8805:3d03:3f00:88c9:1a5:bc23:ce61,2600:1408:ec00:128b::2e03,TLSv1.3,221,Application Data,0.000167,Weather,0.000166
221,2.367396,2600:8805:3d03:3f00:88c9:1a5:bc23:ce61,2600:1408:ec00:128b::2e03,TLSv1.3,2538,Application Data,0.006318,Weather,0.006317
222,2.367482,2600:8805:3d03:3f00:88c9:1a5:bc23:ce61,2600:1408:ec00:128b::2e03,TLSv1.3,436,Application Data,8.6E-05,Weather,0.000086
223,2.371417,2600:8805:3d03:3f00:88c9:1a5:bc23:ce61,2600:1408:ec00:128b::2e03,TLSv1.3,2537,Application Data,0.003935,Weather,0.003935
224,2.371482,2600:8805:3d03:3f00:88c9:1a5:bc23:ce61,2600:1408:ec00:128b::2e03,TLSv1.3,406,Application Data,6.5E-05,Weather,0.000064
225,2.378026,2600:1408:ec00:128b::2e03,2600:8805:3d03:3f00:88c9:1a5:bc23:ce61,TCP,74,443  >  51983 [ACK] Seq=232797 Ack=25655 Win=64128 Len=0,0.006544,Weather,0.006544
226,2.378026,2600:1408:ec00:128b::2e03,2600:8805:3d03:3f00:88c9:1a5:bc23:ce61,TCP,74,443  >  51983 [ACK] Seq=232797 Ack=26773 Win=63744 Len=0,0,Weather,0
227,2.378026,2600:1408:ec00:128b::2e03,2600:8805:3d03:3f00:88c9:1a5:bc23:ce61,TCP,74,443  >  51983 [ACK] Seq=232797 Ack=26920 Win=63616 Len=0,0,Weather,0
228,2.378634,2600:1408:ec00:128b::2e03,2600:8805:3d03:3f00:88c9:1a5:bc23:ce61,TCP,74,443  >  51983 [ACK] Seq=232797 Ack=28360 Win=64128 Len=0,0.000608,Weather,0.000607
229,2.383812,2600:1408:ec00:128b::2e03,2600:8805:3d03:3f00:88c9:1a5:bc23:ce61,TCP,74,443  >  51983 [ACK] Seq=232797 Ack=29478 Win=64128 Len=0,0.005178,Weather,0.005177
230,2.384608,2600:1408:ec00:128b::2e03,2600:8805:3d03:3f00:88c9:1a5:bc23:ce61,TCP,74,443  >  51983 [ACK] Seq=232797 Ack=29625 Win=64128 Len=0,0.000796,Weather,0.000796
231,2.387804,2600:1408:ec00:128b::2e03,2600:8805:3d03:3f00:88c9:1a5:bc23:ce61,TCP,74,443  >  51983 [ACK] Seq=232797 Ack=32089 Win=63744 Len=0,0.003196,Weather,0.003195
232,2.392128,2600:1408:ec00:128b::2e03,2600:8805:3d03:3f00:88c9:1a5:bc23:ce61,TCP,74,443  >  51983 [ACK] Seq=232797 Ack=32451 Win=64128 Len=0,0.004324,Weather,0.004323
233,2.392128,2600:1408:ec00:128b::2e03,2600:8805:3d03:3f00:88c9:1a5:bc23:ce61,TCP,74,443  >  51983 [ACK] Seq=232797 Ack=34914 Win=63360 Len=0,0,Weather,0
234,2.392128,2600:1408:ec00:128b::2e03,2600:8805:3d03:3f00:88c9:1a5:bc23:ce61,TCP,74,443  >  51983 [ACK] Seq=232797 Ack=35246 Win=63104 Len=0,0,Weather,0
235,2.41726,2600:1408:ec00:128b::2e03,2600:8805:3d03:3f00:88c9:1a5:bc23:ce61,TLSv1.3,1440,Application Data,0.025132,Weather,0.025132
236,2.417671,2600:1408:ec00:128b::2e03,2600:8805:3d03:3f00:88c9:1a5:bc23:ce61,TLSv1.3,1313,Application Data,0.000411,Weather,0.00041
237,2.417671,2600:1408:ec00:128b::2e03,2600:8805:3d03:3f00:88c9:1a5:bc23:ce61,TLSv1.3,174,Application Data,0,Weather,0
238,2.417763,2600:8805:3d03:3f00:88c9:1a5:bc23:ce61,2600:1408:ec00:128b::2e03,TCP,74,51983  >  443 [ACK] Seq=35246 Ack=235502 Win=263424 Len=0,9.2E-05,Weather,0.000091
239,2.418206,2600:1408:ec00:128b::2e03,2600:8805:3d03:3f00:88c9:1a5:bc23:ce61,TLSv1.3,1444,Application Data,0.000443,Weather,0.000443
240,2.418206,2600:1408:ec00:128b::2e03,2600:8805:3d03:3f00:88c9:1a5:bc23:ce61,TLSv1.3,673,Application Data,0,Weather,0
