No.,Time,Source,Destination,Protocol,Length,Info,Time_Between,Website,Ttruncated
1,0,2600:8805:3d03:3f00:88c9:1a5:bc23:ce61,2620:0:861:ed1a::1,TLSv1.2,173,Application Data,0,Wikipedia,0
2,0.000059,2600:8805:3d03:3f00:88c9:1a5:bc23:ce61,2620:0:861:ed1a::1,TLSv1.2,113,Application Data,0.000059,Wikipedia,0.000059
3,0.022945,2620:0:861:ed1a::1,2600:8805:3d03:3f00:88c9:1a5:bc23:ce61,TCP,74,443  >  55903 [ACK] Seq=1 Ack=139 Win=83 Len=0,0.022886,Wikipedia,0.022886
4,0.022945,2620:0:861:ed1a::1,2600:8805:3d03:3f00:88c9:1a5:bc23:ce61,TLSv1.2,113,Application Data,0,Wikipedia,0
5,0.023341,2620:0:861:ed1a::1,2600:8805:3d03:3f00:88c9:1a5:bc23:ce61,TCP,1514,443  >  55903 [ACK] Seq=40 Ack=139 Win=83 Len=1440 [TCP segment of a reassembled PDU],0.000396,Wikipedia,0.000396
6,0.023376,2600:8805:3d03:3f00:88c9:1a5:bc23:ce61,2620:0:861:ed1a::1,TCP,74,55903  >  443 [ACK] Seq=139 Ack=1480 Win=517 Len=0,3.5E-05,Wikipedia,0.000035
7,0.025169,2620:0:861:ed1a::1,2600:8805:3d03:3f00:88c9:1a5:bc23:ce61,TCP,1514,443  >  55903 [ACK] Seq=1480 Ack=139 Win=83 Len=1440 [TCP segment of a reassembled PDU],0.001793,Wikipedia,0.001793
8,0.025169,2620:0:861:ed1a::1,2600:8805:3d03:3f00:88c9:1a5:bc23:ce61,TCP,1514,443  >  55903 [ACK] Seq=2920 Ack=139 Win=83 Len=1440 [TCP segment of a reassembled PDU],0,Wikipedia,0
9,0.025169,2620:0:861:ed1a::1,2600:8805:3d03:3f00:88c9:1a5:bc23:ce61,TCP,1514,443  >  55903 [ACK] Seq=4360 Ack=139 Win=83 Len=1440 [TCP segment of a reassembled PDU],0,Wikipedia,0
10,0.025304,2600:8805:3d03:3f00:88c9:1a5:bc23:ce61,2620:0:861:ed1a::1,TCP,74,55903  >  443 [ACK] Seq=139 Ack=5800 Win=517 Len=0,0.000135,Wikipedia,0.000135
11,0.026831,2620:0:861:ed1a::1,2600:8805:3d03:3f00:88c9:1a5:bc23:ce61,TLSv1.2,15914,Application Data,0.001527,Wikipedia,0.001527
12,0.026952,2600:8805:3d03:3f00:88c9:1a5:bc23:ce61,2620:0:861:ed1a::1,TCP,74,55903  >  443 [ACK] Seq=139 Ack=21640 Win=517 Len=0,0.000121,Wikipedia,0.000121
13,0.028106,2600:8805:3d03:3f00:88c9:1a5:bc23:ce61,2620:0:861:ed1a::1,TLSv1.2,109,Application Data,0.001154,Wikipedia,0.001154
14,0.028504,2620:0:861:ed1a::1,2600:8805:3d03:3f00:88c9:1a5:bc23:ce61,TCP,1514,443  >  55903 [ACK] Seq=21640 Ack=139 Win=83 Len=1440 [TCP segment of a reassembled PDU],0.000398,Wikipedia,0.000398
15,0.028504,2620:0:861:ed1a::1,2600:8805:3d03:3f00:88c9:1a5:bc23:ce61,TCP,1514,443  >  55903 [ACK] Seq=23080 Ack=139 Win=83 Len=1440 [TCP segment of a reassembled PDU],0,Wikipedia,0
16,0.028504,2620:0:861:ed1a::1,2600:8805:3d03:3f00:88c9:1a5:bc23:ce61,TCP,5834,"443  >  55903 [PSH, ACK] Seq=24520 Ack=139 Win=83 Len=5760 [TCP segment of a reassembled PDU]",0,Wikipedia,0
17,0.028631,2600:8805:3d03:3f00:88c9:1a5:bc23:ce61,2620:0:861:ed1a::1,TCP,74,55903  >  443 [ACK] Seq=174 Ack=30280 Win=517 Len=0,0.000127,Wikipedia,0.000126
18,0.0316,2620:0:861:ed1a::1,2600:8805:3d03:3f00:88c9:1a5:bc23:ce61,TLSv1.2,15914,Application Data,0.002969,Wikipedia,0.002969
19,0.032251,2600:8805:3d03:3f00:88c9:1a5:bc23:ce61,2620:0:861:ed1a::1,TCP,74,55903  >  443 [ACK] Seq=174 Ack=46120 Win=517 Len=0,0.000651,Wikipedia,0.00065
20,0.034986,2620:0:861:ed1a::1,2600:8805:3d03:3f00:88c9:1a5:bc23:ce61,TLSv1.2,1514,Application Data,0.002735,Wikipedia,0.002735
21,0.034986,2620:0:861:ed1a::1,2600:8805:3d03:3f00:88c9:1a5:bc23:ce61,TCP,1514,443  >  55903 [ACK] Seq=47560 Ack=139 Win=83 Len=1440 [TCP segment of a reassembled PDU],0,Wikipedia,0
22,0.034986,2620:0:861:ed1a::1,2600:8805:3d03:3f00:88c9:1a5:bc23:ce61,TLSv1.2,205,Application Data,0,Wikipedia,0
23,0.035095,2600:8805:3d03:3f00:88c9:1a5:bc23:ce61,2620:0:861:ed1a::1,TCP,74,55903  >  443 [ACK] Seq=174 Ack=49131 Win=517 Len=0,0.000109,Wikipedia,0.000108
24,0.095678,2620:0:861:ed1a::1,2600:8805:3d03:3f00:88c9:1a5:bc23:ce61,TCP,74,443  >  55903 [ACK] Seq=49131 Ack=174 Win=83 Len=0,0.060583,Wikipedia,0.060583
25,0.20535,2600:8805:3d03:3f00:88c9:1a5:bc23:ce61,2620:0:861:ed1a::1,TLSv1.2,180,Application Data,0.109672,Wikipedia,0.109672
26,0.223302,2620:0:861:ed1a::1,2600:8805:3d03:3f00:88c9:1a5:bc23:ce61,TCP,74,443  >  55903 [ACK] Seq=49131 Ack=280 Win=83 Len=0,0.017952,Wikipedia,0.017952
27,0.224439,2620:0:861:ed1a::1,2600:8805:3d03:3f00:88c9:1a5:bc23:ce61,TCP,1514,443  >  55903 [ACK] Seq=49131 Ack=280 Win=83 Len=1440 [TCP segment of a reassembled PDU],0.001137,Wikipedia,0.001137
28,0.22681,2620:0:861:ed1a::1,2600:8805:3d03:3f00:88c9:1a5:bc23:ce61,TCP,1514,443  >  55903 [ACK] Seq=50571 Ack=280 Win=83 Len=1440 [TCP segment of a reassembled PDU],0.002371,Wikipedia,0.002371
29,0.22681,2620:0:861:ed1a::1,2600:8805:3d03:3f00:88c9:1a5:bc23:ce61,TCP,1514,443  >  55903 [ACK] Seq=52011 Ack=280 Win=83 Len=1440 [TCP segment of a reassembled PDU],0,Wikipedia,0
30,0.22681,2620:0:861:ed1a::1,2600:8805:3d03:3f00:88c9:1a5:bc23:ce61,TCP,1514,443  >  55903 [ACK] Seq=53451 Ack=280 Win=83 Len=1440 [TCP segment of a reassembled PDU],0,Wikipedia,0
31,0.22681,2620:0:861:ed1a::1,2600:8805:3d03:3f00:88c9:1a5:bc23:ce61,TCP,1514,"443  >  55903 [PSH, ACK] Seq=54891 Ack=280 Win=83 Len=1440 [TCP segment of a reassembled PDU]",0,Wikipedia,0
32,0.22681,2620:0:861:ed1a::1,2600:8805:3d03:3f00:88c9:1a5:bc23:ce61,TCP,1514,443  >  55903 [ACK] Seq=56331 Ack=280 Win=83 Len=1440 [TCP segment of a reassembled PDU],0,Wikipedia,0
33,0.227093,2600:8805:3d03:3f00:88c9:1a5:bc23:ce61,2620:0:861:ed1a::1,TCP,74,55903  >  443 [ACK] Seq=280 Ack=57771 Win=517 Len=0,0.000283,Wikipedia,0.000282
34,0.229282,2620:0:861:ed1a::1,2600:8805:3d03:3f00:88c9:1a5:bc23:ce61,TCP,1514,443  >  55903 [ACK] Seq=57771 Ack=280 Win=83 Len=1440 [TCP segment of a reassembled PDU],0.002189,Wikipedia,0.002189
35,0.229282,2620:0:861:ed1a::1,2600:8805:3d03:3f00:88c9:1a5:bc23:ce61,TCP,1514,443  >  55903 [ACK] Seq=59211 Ack=280 Win=83 Len=1440 [TCP segment of a reassembled PDU],0,Wikipedia,0
36,0.229282,2620:0:861:ed1a::1,2600:8805:3d03:3f00:88c9:1a5:bc23:ce61,TCP,1514,443  >  55903 [ACK] Seq=60651 Ack=280 Win=83 Len=1440 [TCP segment of a reassembled PDU],0,Wikipedia,0
37,0.229282,2620:0:861:ed1a::1,2600:8805:3d03:3f00:88c9:1a5:bc23:ce61,TCP,1514,"443  >  55903 [PSH, ACK] Seq=62091 Ack=280 Win=83 Len=1440 [TCP segment of a reassembled PDU]",0,Wikipedia,0
38,0.229282,2620:0:861:ed1a::1,2600:8805:3d03:3f00:88c9:1a5:bc23:ce61,TLSv1.2,1514,Application Data,0,Wikipedia,0
39,0.229282,2620:0:861:ed1a::1,2600:8805:3d03:3f00:88c9:1a5:bc23:ce61,TCP,1514,443  >  55903 [ACK] Seq=64971 Ack=280 Win=83 Len=1440 [TCP segment of a reassembled PDU],0,Wikipedia,0
40,0.229282,2620:0:861:ed1a::1,2600:8805:3d03:3f00:88c9:1a5:bc23:ce61,TCP,1514,443  >  55903 [ACK] Seq=66411 Ack=280 Win=83 Len=1440 [TCP segment of a reassembled PDU],0,Wikipedia,0
41,0.229282,2620:0:861:ed1a::1,2600:8805:3d03:3f00:88c9:1a5:bc23:ce61,TCP,1514,443  >  55903 [ACK] Seq=67851 Ack=280 Win=83 Len=1440 [TCP segment of a reassembled PDU],0,Wikipedia,0
42,0.229282,2620:0:861:ed1a::1,2600:8805:3d03:3f00:88c9:1a5:bc23:ce61,TCP,1514,"443  >  55903 [PSH, ACK] Seq=69291 Ack=280 Win=83 Len=1440 [TCP segment of a reassembled PDU]",0,Wikipedia,0
43,0.229282,2620:0:861:ed1a::1,2600:8805:3d03:3f00:88c9:1a5:bc23:ce61,TCP,1514,443  >  55903 [ACK] Seq=70731 Ack=280 Win=83 Len=1440 [TCP segment of a reassembled PDU],0,Wikipedia,0
44,0.229282,2620:0:861:ed1a::1,2600:8805:3d03:3f00:88c9:1a5:bc23:ce61,TCP,1514,443  >  55903 [ACK] Seq=72171 Ack=280 Win=83 Len=1440 [TCP segment of a reassembled PDU],0,Wikipedia,0
45,0.229542,2600:8805:3d03:3f00:88c9:1a5:bc23:ce61,2620:0:861:ed1a::1,TCP,74,55903  >  443 [ACK] Seq=280 Ack=73611 Win=517 Len=0,0.00026,Wikipedia,0.000259
46,0.233598,2620:0:861:ed1a::1,2600:8805:3d03:3f00:88c9:1a5:bc23:ce61,TCP,1514,443  >  55903 [ACK] Seq=73611 Ack=280 Win=83 Len=1440 [TCP segment of a reassembled PDU],0.004056,Wikipedia,0.004056
47,0.233598,2620:0:861:ed1a::1,2600:8805:3d03:3f00:88c9:1a5:bc23:ce61,TCP,1514,443  >  55903 [ACK] Seq=75051 Ack=280 Win=83 Len=1440 [TCP segment of a reassembled PDU],0,Wikipedia,0
48,0.233598,2620:0:861:ed1a::1,2600:8805:3d03:3f00:88c9:1a5:bc23:ce61,TCP,1514,"443  >  55903 [PSH, ACK] Seq=76491 Ack=280 Win=83 Len=1440 [TCP segment of a reassembled PDU]",0,Wikipedia,0
49,0.233598,2620:0:861:ed1a::1,2600:8805:3d03:3f00:88c9:1a5:bc23:ce61,TCP,1514,443  >  55903 [ACK] Seq=77931 Ack=280 Win=83 Len=1440 [TCP segment of a reassembled PDU],0,Wikipedia,0
50,0.233598,2620:0:861:ed1a::1,2600:8805:3d03:3f00:88c9:1a5:bc23:ce61,TLSv1.2,1514,Application Data,0,Wikipedia,0
51,0.233598,2620:0:861:ed1a::1,2600:8805:3d03:3f00:88c9:1a5:bc23:ce61,TCP,1514,443  >  55903 [ACK] Seq=80811 Ack=280 Win=83 Len=1440 [TCP segment of a reassembled PDU],0,Wikipedia,0
52,0.233598,2620:0:861:ed1a::1,2600:8805:3d03:3f00:88c9:1a5:bc23:ce61,TCP,1514,443  >  55903 [ACK] Seq=82251 Ack=280 Win=83 Len=1440 [TCP segment of a reassembled PDU],0,Wikipedia,0
53,0.233598,2620:0:861:ed1a::1,2600:8805:3d03:3f00:88c9:1a5:bc23:ce61,TCP,1514,"443  >  55903 [PSH, ACK] Seq=83691 Ack=280 Win=83 Len=1440 [TCP segment of a reassembled PDU]",0,Wikipedia,0
54,0.233598,2620:0:861:ed1a::1,2600:8805:3d03:3f00:88c9:1a5:bc23:ce61,TCP,1514,443  >  55903 [ACK] Seq=85131 Ack=280 Win=83 Len=1440 [TCP segment of a reassembled PDU],0,Wikipedia,0
55,0.233598,2620:0:861:ed1a::1,2600:8805:3d03:3f00:88c9:1a5:bc23:ce61,TCP,1514,443  >  55903 [ACK] Seq=86571 Ack=280 Win=83 Len=1440 [TCP segment of a reassembled PDU],0,Wikipedia,0
56,0.233598,2620:0:861:ed1a::1,2600:8805:3d03:3f00:88c9:1a5:bc23:ce61,TCP,1514,443  >  55903 [ACK] Seq=88011 Ack=280 Win=83 Len=1440 [TCP segment of a reassembled PDU],0,Wikipedia,0
57,0.233598,2620:0:861:ed1a::1,2600:8805:3d03:3f00:88c9:1a5:bc23:ce61,TLSv1.2,699,Application Data,0,Wikipedia,0
58,0.233938,2600:8805:3d03:3f00:88c9:1a5:bc23:ce61,2620:0:861:ed1a::1,TCP,74,55903  >  443 [ACK] Seq=280 Ack=90076 Win=517 Len=0,0.00034,Wikipedia,0.00034
59,0.294189,2600:8805:3d03:3f00:88c9:1a5:bc23:ce61,2620:0:861:ed1a::1,TLSv1.2,207,Application Data,0.060251,Wikipedia,0.060251
60,0.329882,2620:0:861:ed1a::1,2600:8805:3d03:3f00:88c9:1a5:bc23:ce61,TLSv1.2,1100,Application Data,0.035693,Wikipedia,0.035693
61,0.369589,2600:8805:3d03:3f00:88c9:1a5:bc23:ce61,2620:0:861:ed1a::1,TCP,74,55903  >  443 [ACK] Seq=413 Ack=91102 Win=513 Len=0,0.039707,Wikipedia,0.039707
62,0.37787,2600:8805:3d03:3f00:88c9:1a5:bc23:ce61,2620:0:861:ed1a::1,TLSv1.2,152,Application Data,0.008281,Wikipedia,0.00828
63,0.39602,2620:0:861:ed1a::1,2600:8805:3d03:3f00:88c9:1a5:bc23:ce61,TCP,1514,443  >  55903 [ACK] Seq=91102 Ack=491 Win=83 Len=1440 [TCP segment of a reassembled PDU],0.01815,Wikipedia,0.01815
64,0.397133,2620:0:861:ed1a::1,2600:8805:3d03:3f00:88c9:1a5:bc23:ce61,TLSv1.2,541,Application Data,0.001113,Wikipedia,0.001113
65,0.397223,2600:8805:3d03:3f00:88c9:1a5:bc23:ce61,2620:0:861:ed1a::1,TCP,74,55903  >  443 [ACK] Seq=491 Ack=93009 Win=517 Len=0,9E-05,Wikipedia,0.000089
66,1.244683,2600:8805:3d03:3f00:88c9:1a5:bc23:ce61,2620:0:861:ed1a::1,TLSv1.2,252,Application Data,0.84746,Wikipedia,0.84746
67,1.275238,2620:0:861:ed1a::1,2600:8805:3d03:3f00:88c9:1a5:bc23:ce61,TCP,1514,443  >  55903 [ACK] Seq=93009 Ack=669 Win=83 Len=1440 [TCP segment of a reassembled PDU],0.030555,Wikipedia,0.030555
68,1.275618,2620:0:861:ed1a::1,2600:8805:3d03:3f00:88c9:1a5:bc23:ce61,TLSv1.2,1104,Application Data,0.00038,Wikipedia,0.000379
69,1.27584,2600:8805:3d03:3f00:88c9:1a5:bc23:ce61,2620:0:861:ed1a::1,TCP,74,55903  >  443 [ACK] Seq=669 Ack=95479 Win=517 Len=0,0.000222,Wikipedia,0.000222
70,1.676598,2600:8805:3d03:3f00:88c9:1a5:bc23:ce61,2620:0:861:ed1a::1,TLSv1.2,163,Application Data,0.400758,Wikipedia,0.400758
71,1.69564,2620:0:861:ed1a::1,2600:8805:3d03:3f00:88c9:1a5:bc23:ce61,TCP,1514,443  >  55903 [ACK] Seq=95479 Ack=758 Win=83 Len=1440 [TCP segment of a reassembled PDU],0.019042,Wikipedia,0.019042
72,1.696045,2620:0:861:ed1a::1,2600:8805:3d03:3f00:88c9:1a5:bc23:ce61,TLSv1.2,1015,Application Data,0.000405,Wikipedia,0.000404
73,1.696083,2600:8805:3d03:3f00:88c9:1a5:bc23:ce61,2620:0:861:ed1a::1,TCP,74,55903  >  443 [ACK] Seq=758 Ack=97860 Win=517 Len=0,3.8E-05,Wikipedia,0.000037
74,2.56621,2600:8805:3d03:3f00:88c9:1a5:bc23:ce61,2620:0:861:ed1a::1,TLSv1.2,163,Application Data,0.870127,Wikipedia,0.870127
75,2.583664,2620:0:861:ed1a::1,2600:8805:3d03:3f00:88c9:1a5:bc23:ce61,TCP,1514,443  >  55903 [ACK] Seq=97860 Ack=847 Win=83 Len=1440 [TCP segment of a reassembled PDU],0.017454,Wikipedia,0.017454
76,2.583975,2620:0:861:ed1a::1,2600:8805:3d03:3f00:88c9:1a5:bc23:ce61,TLSv1.2,1010,Application Data,0.000311,Wikipedia,0.00031
77,2.584093,2600:8805:3d03:3f00:88c9:1a5:bc23:ce61,2620:0:861:ed1a::1,TCP,74,55903  >  443 [ACK] Seq=847 Ack=100236 Win=517 Len=0,0.000118,Wikipedia,0.000118
78,3.139116,2600:8805:3d03:3f00:88c9:1a5:bc23:ce61,2620:0:861:ed1a::1,TLSv1.2,151,Application Data,0.555023,Wikipedia,0.555023
79,3.161303,2620:0:861:ed1a::1,2600:8805:3d03:3f00:88c9:1a5:bc23:ce61,TCP,1514,443  >  55903 [ACK] Seq=100236 Ack=924 Win=83 Len=1440 [TCP segment of a reassembled PDU],0.022187,Wikipedia,0.022187
80,3.161864,2620:0:861:ed1a::1,2600:8805:3d03:3f00:88c9:1a5:bc23:ce61,TCP,2954,443  >  55903 [ACK] Seq=101676 Ack=924 Win=83 Len=2880 [TCP segment of a reassembled PDU],0.000561,Wikipedia,0.00056
81,3.16201,2600:8805:3d03:3f00:88c9:1a5:bc23:ce61,2620:0:861:ed1a::1,TCP,74,55903  >  443 [ACK] Seq=924 Ack=104556 Win=517 Len=0,0.000146,Wikipedia,0.000145
82,3.162586,2620:0:861:ed1a::1,2600:8805:3d03:3f00:88c9:1a5:bc23:ce61,TCP,7274,"443  >  55903 [PSH, ACK] Seq=104556 Ack=924 Win=83 Len=7200 [TCP segment of a reassembled PDU]",0.000576,Wikipedia,0.000576
83,3.162638,2600:8805:3d03:3f00:88c9:1a5:bc23:ce61,2620:0:861:ed1a::1,TCP,74,55903  >  443 [ACK] Seq=924 Ack=111756 Win=517 Len=0,5.2E-05,Wikipedia,0.000051
84,3.163162,2620:0:861:ed1a::1,2600:8805:3d03:3f00:88c9:1a5:bc23:ce61,TLSv1.2,5834,Application Data,0.000524,Wikipedia,0.000523
85,3.16325,2600:8805:3d03:3f00:88c9:1a5:bc23:ce61,2620:0:861:ed1a::1,TCP,74,55903  >  443 [ACK] Seq=924 Ack=117516 Win=517 Len=0,8.8E-05,Wikipedia,0.000088
86,3.164615,2620:0:861:ed1a::1,2600:8805:3d03:3f00:88c9:1a5:bc23:ce61,TCP,4394,"443  >  55903 [PSH, ACK] Seq=117516 Ack=924 Win=83 Len=4320 [TCP segment of a reassembled PDU]",0.001365,Wikipedia,0.001364
87,3.164703,2600:8805:3d03:3f00:88c9:1a5:bc23:ce61,2620:0:861:ed1a::1,TCP,74,55903  >  443 [ACK] Seq=924 Ack=121836 Win=517 Len=0,8.8E-05,Wikipedia,0.000087
88,3.165289,2620:0:861:ed1a::1,2600:8805:3d03:3f00:88c9:1a5:bc23:ce61,TCP,8714,"443  >  55903 [PSH, ACK] Seq=121836 Ack=924 Win=83 Len=8640 [TCP segment of a reassembled PDU]",0.000586,Wikipedia,0.000586
89,3.165358,2600:8805:3d03:3f00:88c9:1a5:bc23:ce61,2620:0:861:ed1a::1,TCP,74,55903  >  443 [ACK] Seq=924 Ack=130476 Win=517 Len=0,6.9E-05,Wikipedia,0.000068
90,3.166493,2620:0:861:ed1a::1,2600:8805:3d03:3f00:88c9:1a5:bc23:ce61,TLSv1.2,5834,Application Data,0.001135,Wikipedia,0.001135
91,3.166565,2600:8805:3d03:3f00:88c9:1a5:bc23:ce61,2620:0:861:ed1a::1,TCP,74,55903  >  443 [ACK] Seq=924 Ack=136236 Win=517 Len=0,7.2E-05,Wikipedia,0.000071
92,3.167228,2620:0:861:ed1a::1,2600:8805:3d03:3f00:88c9:1a5:bc23:ce61,TCP,8714,"443  >  55903 [PSH, ACK] Seq=136236 Ack=924 Win=83 Len=8640 [TCP segment of a reassembled PDU]",0.000663,Wikipedia,0.000663
93,3.167298,2600:8805:3d03:3f00:88c9:1a5:bc23:ce61,2620:0:861:ed1a::1,TCP,74,55903  >  443 [ACK] Seq=924 Ack=144876 Win=517 Len=0,7E-05,Wikipedia,0.00007
94,3.168247,2620:0:861:ed1a::1,2600:8805:3d03:3f00:88c9:1a5:bc23:ce61,TLSv1.2,5834,Application Data,0.000949,Wikipedia,0.000948
95,3.168318,2600:8805:3d03:3f00:88c9:1a5:bc23:ce61,2620:0:861:ed1a::1,TCP,74,55903  >  443 [ACK] Seq=924 Ack=150636 Win=517 Len=0,7.1E-05,Wikipedia,0.000071
96,3.169249,2620:0:861:ed1a::1,2600:8805:3d03:3f00:88c9:1a5:bc23:ce61,TCP,7274,"443  >  55903 [PSH, ACK] Seq=150636 Ack=924 Win=83 Len=7200 [TCP segment of a reassembled PDU]",0.000931,Wikipedia,0.000931
97,3.169315,2600:8805:3d03:3f00:88c9:1a5:bc23:ce61,2620:0:861:ed1a::1,TCP,74,55903  >  443 [ACK] Seq=924 Ack=157836 Win=517 Len=0,6.6E-05,Wikipedia,0.000065
98,3.171003,2620:0:861:ed1a::1,2600:8805:3d03:3f00:88c9:1a5:bc23:ce61,TLSv1.2,8714,Application Data,0.001688,Wikipedia,0.001687
99,3.171222,2600:8805:3d03:3f00:88c9:1a5:bc23:ce61,2620:0:861:ed1a::1,TCP,74,55903  >  443 [ACK] Seq=924 Ack=166476 Win=517 Len=0,0.000219,Wikipedia,0.000219
100,3.171495,2620:0:861:ed1a::1,2600:8805:3d03:3f00:88c9:1a5:bc23:ce61,TCP,1514,443  >  55903 [ACK] Seq=166476 Ack=924 Win=83 Len=1440 [TCP segment of a reassembled PDU],0.000273,Wikipedia,0.000272
101,3.171495,2620:0:861:ed1a::1,2600:8805:3d03:3f00:88c9:1a5:bc23:ce61,TLSv1.2,236,Application Data,0,Wikipedia,0
102,3.171583,2600:8805:3d03:3f00:88c9:1a5:bc23:ce61,2620:0:861:ed1a::1,TCP,74,55903  >  443 [ACK] Seq=924 Ack=168078 Win=517 Len=0,8.8E-05,Wikipedia,0.000087
103,3.216047,2600:8805:3d03:3f00:88c9:1a5:bc23:ce61,2620:0:861:ed1a::1,TLSv1.2,425,Application Data,0.044464,Wikipedia,0.044464
104,3.23784,2620:0:861:ed1a::1,2600:8805:3d03:3f00:88c9:1a5:bc23:ce61,TCP,1514,443  >  55903 [ACK] Seq=168078 Ack=1275 Win=83 Len=1440 [TCP segment of a reassembled PDU],0.021793,Wikipedia,0.021792
105,3.239127,2620:0:861:ed1a::1,2600:8805:3d03:3f00:88c9:1a5:bc23:ce61,TLSv1.2,17354,Application Data,0.001287,Wikipedia,0.001287
106,3.239127,2620:0:861:ed1a::1,2600:8805:3d03:3f00:88c9:1a5:bc23:ce61,TLSv1.2,1257,Application Data,0,Wikipedia,0
107,3.239329,2600:8805:3d03:3f00:88c9:1a5:bc23:ce61,2620:0:861:ed1a::1,TCP,74,55903  >  443 [ACK] Seq=1275 Ack=187981 Win=517 Len=0,0.000202,Wikipedia,0.000202
108,3.999496,2600:8805:3d03:3f00:88c9:1a5:bc23:ce61,2620:0:861:ed1a::1,TLSv1.2,161,Application Data,0.760167,Wikipedia,0.760167
109,4.02866,2620:0:861:ed1a::1,2600:8805:3d03:3f00:88c9:1a5:bc23:ce61,TCP,1514,443  >  55903 [ACK] Seq=187981 Ack=1362 Win=83 Len=1440 [TCP segment of a reassembled PDU],0.029164,Wikipedia,0.029164
110,4.02866,2620:0:861:ed1a::1,2600:8805:3d03:3f00:88c9:1a5:bc23:ce61,TLSv1.2,961,Application Data,0,Wikipedia,0
111,4.028832,2600:8805:3d03:3f00:88c9:1a5:bc23:ce61,2620:0:861:ed1a::1,TCP,74,55903  >  443 [ACK] Seq=1362 Ack=190308 Win=517 Len=0,0.000172,Wikipedia,0.000172
112,4.541644,2600:8805:3d03:3f00:88c9:1a5:bc23:ce61,2620:0:861:ed1a::1,TLSv1.2,200,Application Data,0.512812,Wikipedia,0.512811
113,4.559888,2620:0:861:ed1a::1,2600:8805:3d03:3f00:88c9:1a5:bc23:ce61,TCP,1514,443  >  55903 [ACK] Seq=190308 Ack=1488 Win=83 Len=1440 [TCP segment of a reassembled PDU],0.018244,Wikipedia,0.018244
114,4.559888,2620:0:861:ed1a::1,2600:8805:3d03:3f00:88c9:1a5:bc23:ce61,TLSv1.2,166,Application Data,0,Wikipedia,0
115,4.559995,2600:8805:3d03:3f00:88c9:1a5:bc23:ce61,2620:0:861:ed1a::1,TCP,74,55903  >  443 [ACK] Seq=1488 Ack=191840 Win=517 Len=0,0.000107,Wikipedia,0.000106
116,8.642734,2600:8805:3d03:3f00:88c9:1a5:bc23:ce61,2620:0:861:ed1a::1,TLSv1.2,161,Application Data,4.082739,Wikipedia,4.082739
117,8.663115,2620:0:861:ed1a::1,2600:8805:3d03:3f00:88c9:1a5:bc23:ce61,TCP,1514,443  >  55903 [ACK] Seq=191840 Ack=1575 Win=83 Len=1440 [TCP segment of a reassembled PDU],0.020381,Wikipedia,0.02038
118,8.663934,2620:0:861:ed1a::1,2600:8805:3d03:3f00:88c9:1a5:bc23:ce61,TLSv1.2,1444,Application Data,0.000819,Wikipedia,0.000818
119,8.663994,2600:8805:3d03:3f00:88c9:1a5:bc23:ce61,2620:0:861:ed1a::1,TCP,74,55903  >  443 [ACK] Seq=1575 Ack=194650 Win=517 Len=0,6E-05,Wikipedia,0.00006
120,8.664721,2600:8805:3d03:3f00:88c9:1a5:bc23:ce61,2620:0:861:ed1a::1,TLSv1.2,109,Application Data,0.000727,Wikipedia,0.000726
121,8.725473,2620:0:861:ed1a::1,2600:8805:3d03:3f00:88c9:1a5:bc23:ce61,TCP,74,443  >  55903 [ACK] Seq=194650 Ack=1610 Win=83 Len=0,0.060752,Wikipedia,0.060751
122,9.447033,2600:8805:3d03:3f00:88c9:1a5:bc23:ce61,2620:0:861:ed1a::1,TLSv1.2,149,Application Data,0.72156,Wikipedia,0.72156
123,9.477098,2620:0:861:ed1a::1,2600:8805:3d03:3f00:88c9:1a5:bc23:ce61,TCP,74,443  >  55903 [ACK] Seq=194650 Ack=1685 Win=83 Len=0,0.030065,Wikipedia,0.030065
124,9.478401,2620:0:861:ed1a::1,2600:8805:3d03:3f00:88c9:1a5:bc23:ce61,TLSv1.2,23114,Application Data,0.001303,Wikipedia,0.001303
125,9.478754,2600:8805:3d03:3f00:88c9:1a5:bc23:ce61,2620:0:861:ed1a::1,TCP,74,55903  >  443 [ACK] Seq=1685 Ack=217690 Win=517 Len=0,0.000353,Wikipedia,0.000353
126,9.479507,2620:0:861:ed1a::1,2600:8805:3d03:3f00:88c9:1a5:bc23:ce61,TLSv1.2,27434,"Application Data, Application Data",0.000753,Wikipedia,0.000752
127,9.479625,2600:8805:3d03:3f00:88c9:1a5:bc23:ce61,2620:0:861:ed1a::1,TCP,74,55903  >  443 [ACK] Seq=1685 Ack=245050 Win=517 Len=0,0.000118,Wikipedia,0.000118
128,9.480438,2620:0:861:ed1a::1,2600:8805:3d03:3f00:88c9:1a5:bc23:ce61,TLSv1.2,15914,Application Data,0.000813,Wikipedia,0.000812
129,9.480533,2600:8805:3d03:3f00:88c9:1a5:bc23:ce61,2620:0:861:ed1a::1,TCP,74,55903  >  443 [ACK] Seq=1685 Ack=260890 Win=517 Len=0,9.5E-05,Wikipedia,0.000094
130,9.481335,2620:0:861:ed1a::1,2600:8805:3d03:3f00:88c9:1a5:bc23:ce61,TCP,8714,"443  >  55903 [PSH, ACK] Seq=260890 Ack=1685 Win=83 Len=8640 [TCP segment of a reassembled PDU]",0.000802,Wikipedia,0.000802
131,9.481413,2600:8805:3d03:3f00:88c9:1a5:bc23:ce61,2620:0:861:ed1a::1,TCP,74,55903  >  443 [ACK] Seq=1685 Ack=269530 Win=517 Len=0,7.8E-05,Wikipedia,0.000078
132,9.481885,2620:0:861:ed1a::1,2600:8805:3d03:3f00:88c9:1a5:bc23:ce61,TLSv1.2,7274,Application Data,0.000472,Wikipedia,0.000472
133,9.481951,2600:8805:3d03:3f00:88c9:1a5:bc23:ce61,2620:0:861:ed1a::1,TCP,74,55903  >  443 [ACK] Seq=1685 Ack=276730 Win=517 Len=0,6.6E-05,Wikipedia,0.000066
134,9.483399,2620:0:861:ed1a::1,2600:8805:3d03:3f00:88c9:1a5:bc23:ce61,TCP,4394,"443  >  55903 [PSH, ACK] Seq=276730 Ack=1685 Win=83 Len=4320 [TCP segment of a reassembled PDU]",0.001448,Wikipedia,0.001447
135,9.483544,2600:8805:3d03:3f00:88c9:1a5:bc23:ce61,2620:0:861:ed1a::1,TCP,74,55903  >  443 [ACK] Seq=1685 Ack=281050 Win=517 Len=0,0.000145,Wikipedia,0.000144
136,9.484001,2620:0:861:ed1a::1,2600:8805:3d03:3f00:88c9:1a5:bc23:ce61,TCP,5834,443  >  55903 [ACK] Seq=281050 Ack=1685 Win=83 Len=5760 [TCP segment of a reassembled PDU],0.000457,Wikipedia,0.000456
137,9.484001,2620:0:861:ed1a::1,2600:8805:3d03:3f00:88c9:1a5:bc23:ce61,TLSv1.2,664,Application Data,0,Wikipedia,0
138,9.484078,2600:8805:3d03:3f00:88c9:1a5:bc23:ce61,2620:0:861:ed1a::1,TCP,74,55903  >  443 [ACK] Seq=1685 Ack=287400 Win=517 Len=0,7.7E-05,Wikipedia,0.000077
139,9.52412,2600:8805:3d03:3f00:88c9:1a5:bc23:ce61,2620:0:861:ed1a::1,TLSv1.2,409,Application Data,0.040042,Wikipedia,0.040041
140,9.542737,2620:0:861:ed1a::1,2600:8805:3d03:3f00:88c9:1a5:bc23:ce61,TCP,1514,443  >  55903 [ACK] Seq=287400 Ack=2020 Win=83 Len=1440 [TCP segment of a reassembled PDU],0.018617,Wikipedia,0.018617
141,9.543813,2620:0:861:ed1a::1,2600:8805:3d03:3f00:88c9:1a5:bc23:ce61,TCP,13034,"443  >  55903 [PSH, ACK] Seq=288840 Ack=2020 Win=83 Len=12960 [TCP segment of a reassembled PDU]",0.001076,Wikipedia,0.001075
142,9.543813,2620:0:861:ed1a::1,2600:8805:3d03:3f00:88c9:1a5:bc23:ce61,TLSv1.2,344,Application Data,0,Wikipedia,0
143,9.543813,2620:0:861:ed1a::1,2600:8805:3d03:3f00:88c9:1a5:bc23:ce61,TCP,4394,443  >  55903 [ACK] Seq=302070 Ack=2020 Win=83 Len=4320 [TCP segment of a reassembled PDU],0,Wikipedia,0
144,9.543813,2620:0:861:ed1a::1,2600:8805:3d03:3f00:88c9:1a5:bc23:ce61,TLSv1.2,151,Application Data,0,Wikipedia,0
145,9.544041,2600:8805:3d03:3f00:88c9:1a5:bc23:ce61,2620:0:861:ed1a::1,TCP,74,55903  >  443 [ACK] Seq=2020 Ack=306467 Win=517 Len=0,0.000228,Wikipedia,0.000227
146,13.152265,2600:8805:3d03:3f00:88c9:1a5:bc23:ce61,2620:0:861:ed1a::1,TLSv1.2,156,Application Data,3.608224,Wikipedia,3.608224
147,13.16955,2620:0:861:ed1a::1,2600:8805:3d03:3f00:88c9:1a5:bc23:ce61,TCP,1514,443  >  55903 [ACK] Seq=306467 Ack=2102 Win=83 Len=1440 [TCP segment of a reassembled PDU],0.017285,Wikipedia,0.017284
148,13.169939,2620:0:861:ed1a::1,2600:8805:3d03:3f00:88c9:1a5:bc23:ce61,TLSv1.2,772,Application Data,0.000389,Wikipedia,0.000389
149,13.170001,2600:8805:3d03:3f00:88c9:1a5:bc23:ce61,2620:0:861:ed1a::1,TCP,74,55903  >  443 [ACK] Seq=2102 Ack=308605 Win=517 Len=0,6.2E-05,Wikipedia,0.000061
150,15.203076,2600:8805:3d03:3f00:88c9:1a5:bc23:ce61,2620:0:861:ed1a::1,TLSv1.2,160,Application Data,2.033075,Wikipedia,2.033075
151,15.232978,2620:0:861:ed1a::1,2600:8805:3d03:3f00:88c9:1a5:bc23:ce61,TLSv1.2,1487,Application Data,0.029902,Wikipedia,0.029901
152,15.236179,2600:8805:3d03:3f00:88c9:1a5:bc23:ce61,2620:0:861:ed1a::1,TLSv1.2,178,Application Data,0.003201,Wikipedia,0.003201
153,15.254051,2620:0:861:ed1a::1,2600:8805:3d03:3f00:88c9:1a5:bc23:ce61,TCP,1514,443  >  55903 [ACK] Seq=310018 Ack=2292 Win=83 Len=1440 [TCP segment of a reassembled PDU],0.017872,Wikipedia,0.017872
154,15.255996,2620:0:861:ed1a::1,2600:8805:3d03:3f00:88c9:1a5:bc23:ce61,TLSv1.2,1084,Application Data,0.001945,Wikipedia,0.001944
155,15.256162,2600:8805:3d03:3f00:88c9:1a5:bc23:ce61,2620:0:861:ed1a::1,TCP,74,55903  >  443 [ACK] Seq=2292 Ack=312468 Win=517 Len=0,0.000166,Wikipedia,0.000166
156,15.25764,2600:8805:3d03:3f00:88c9:1a5:bc23:ce61,2620:0:861:ed1a::1,TLSv1.2,109,Application Data,0.001478,Wikipedia,0.001478
157,15.317236,2620:0:861:ed1a::1,2600:8805:3d03:3f00:88c9:1a5:bc23:ce61,TCP,74,443  >  55903 [ACK] Seq=312468 Ack=2327 Win=83 Len=0,0.059596,Wikipedia,0.059595
158,15.43614,2600:8805:3d03:3f00:88c9:1a5:bc23:ce61,2620:0:861:ed1a::1,TLSv1.2,148,Application Data,0.118904,Wikipedia,0.118904
159,15.458693,2620:0:861:ed1a::1,2600:8805:3d03:3f00:88c9:1a5:bc23:ce61,TCP,74,443  >  55903 [ACK] Seq=312468 Ack=2401 Win=83 Len=0,0.022553,Wikipedia,0.022553
160,15.507569,2620:0:861:ed1a::1,2600:8805:3d03:3f00:88c9:1a5:bc23:ce61,TLSv1.2,1297,Application Data,0.048876,Wikipedia,0.048875
161,15.508883,2620:0:861:ed1a::1,2600:8805:3d03:3f00:88c9:1a5:bc23:ce61,TCP,15914,"443  >  55903 [PSH, ACK] Seq=313691 Ack=2401 Win=83 Len=15840 [TCP segment of a reassembled PDU]",0.001314,Wikipedia,0.001314
162,15.508883,2620:0:861:ed1a::1,2600:8805:3d03:3f00:88c9:1a5:bc23:ce61,TLSv1.2,577,Application Data,0,Wikipedia,0
163,15.508883,2620:0:861:ed1a::1,2600:8805:3d03:3f00:88c9:1a5:bc23:ce61,TCP,5834,443  >  55903 [ACK] Seq=330034 Ack=2401 Win=83 Len=5760 [TCP segment of a reassembled PDU],0,Wikipedia,0
164,15.509085,2600:8805:3d03:3f00:88c9:1a5:bc23:ce61,2620:0:861:ed1a::1,TCP,74,55903  >  443 [ACK] Seq=2401 Ack=335794 Win=517 Len=0,0.000202,Wikipedia,0.000201
165,15.509487,2620:0:861:ed1a::1,2600:8805:3d03:3f00:88c9:1a5:bc23:ce61,TLSv1.2,14474,Application Data,0.000402,Wikipedia,0.000401
166,15.509568,2600:8805:3d03:3f00:88c9:1a5:bc23:ce61,2620:0:861:ed1a::1,TCP,74,55903  >  443 [ACK] Seq=2401 Ack=350194 Win=517 Len=0,8.1E-05,Wikipedia,0.00008
167,15.513268,2620:0:861:ed1a::1,2600:8805:3d03:3f00:88c9:1a5:bc23:ce61,TCP,1514,443  >  55903 [ACK] Seq=350194 Ack=2401 Win=83 Len=1440 [TCP segment of a reassembled PDU],0.0037,Wikipedia,0.0037
168,15.513268,2620:0:861:ed1a::1,2600:8805:3d03:3f00:88c9:1a5:bc23:ce61,TCP,1514,443  >  55903 [ACK] Seq=351634 Ack=2401 Win=83 Len=1440 [TCP segment of a reassembled PDU],0,Wikipedia,0
169,15.513268,2620:0:861:ed1a::1,2600:8805:3d03:3f00:88c9:1a5:bc23:ce61,TCP,2954,443  >  55903 [ACK] Seq=353074 Ack=2401 Win=83 Len=2880 [TCP segment of a reassembled PDU],0,Wikipedia,0
170,15.513268,2620:0:861:ed1a::1,2600:8805:3d03:3f00:88c9:1a5:bc23:ce61,TLSv1.2,616,Application Data,0,Wikipedia,0
171,15.513403,2600:8805:3d03:3f00:88c9:1a5:bc23:ce61,2620:0:861:ed1a::1,TCP,74,55903  >  443 [ACK] Seq=2401 Ack=356496 Win=517 Len=0,0.000135,Wikipedia,0.000135
172,17.481724,2600:8805:3d03:3f00:88c9:1a5:bc23:ce61,2620:0:861:ed1a::1,TLSv1.2,233,Application Data,1.968321,Wikipedia,1.968321
173,17.499546,2620:0:861:ed1a::1,2600:8805:3d03:3f00:88c9:1a5:bc23:ce61,TLSv1.2,1460,Application Data,0.017822,Wikipedia,0.017821
174,17.50309,2600:8805:3d03:3f00:88c9:1a5:bc23:ce61,2620:0:861:ed1a::1,TLSv1.2,157,Application Data,0.003544,Wikipedia,0.003544
175,17.524231,2620:0:861:ed1a::1,2600:8805:3d03:3f00:88c9:1a5:bc23:ce61,TCP,1514,443  >  55903 [ACK] Seq=357882 Ack=2643 Win=83 Len=1440 [TCP segment of a reassembled PDU],0.021141,Wikipedia,0.021141
176,17.524583,2620:0:861:ed1a::1,2600:8805:3d03:3f00:88c9:1a5:bc23:ce61,TLSv1.2,1217,Application Data,0.000352,Wikipedia,0.000351
177,17.524657,2600:8805:3d03:3f00:88c9:1a5:bc23:ce61,2620:0:861:ed1a::1,TCP,74,55903  >  443 [ACK] Seq=2643 Ack=360465 Win=517 Len=0,7.4E-05,Wikipedia,0.000074
178,18.671101,2600:8805:3d03:3f00:88c9:1a5:bc23:ce61,2620:0:861:ed1a::1,TLSv1.2,152,Application Data,1.146444,Wikipedia,1.146444
179,18.695141,2620:0:861:ed1a::1,2600:8805:3d03:3f00:88c9:1a5:bc23:ce61,TCP,1514,443  >  55903 [ACK] Seq=360465 Ack=2721 Win=83 Len=1440 [TCP segment of a reassembled PDU],0.02404,Wikipedia,0.024039
180,18.6955,2620:0:861:ed1a::1,2600:8805:3d03:3f00:88c9:1a5:bc23:ce61,TCP,1514,443  >  55903 [ACK] Seq=361905 Ack=2721 Win=83 Len=1440 [TCP segment of a reassembled PDU],0.000359,Wikipedia,0.000358
181,18.695527,2600:8805:3d03:3f00:88c9:1a5:bc23:ce61,2620:0:861:ed1a::1,TCP,74,55903  >  443 [ACK] Seq=2721 Ack=363345 Win=517 Len=0,2.7E-05,Wikipedia,0.000026
182,18.696296,2620:0:861:ed1a::1,2600:8805:3d03:3f00:88c9:1a5:bc23:ce61,TCP,11594,"443  >  55903 [PSH, ACK] Seq=363345 Ack=2721 Win=83 Len=11520 [TCP segment of a reassembled PDU]",0.000769,Wikipedia,0.000769
183,18.696296,2620:0:861:ed1a::1,2600:8805:3d03:3f00:88c9:1a5:bc23:ce61,TLSv1.2,282,Application Data,0,Wikipedia,0
184,18.696364,2600:8805:3d03:3f00:88c9:1a5:bc23:ce61,2620:0:861:ed1a::1,TCP,74,55903  >  443 [ACK] Seq=2721 Ack=375073 Win=517 Len=0,6.8E-05,Wikipedia,0.000067
185,18.698605,2620:0:861:ed1a::1,2600:8805:3d03:3f00:88c9:1a5:bc23:ce61,TCP,1514,443  >  55903 [ACK] Seq=375073 Ack=2721 Win=83 Len=1440 [TCP segment of a reassembled PDU],0.002241,Wikipedia,0.002241
186,18.698605,2620:0:861:ed1a::1,2600:8805:3d03:3f00:88c9:1a5:bc23:ce61,TCP,1514,443  >  55903 [ACK] Seq=376513 Ack=2721 Win=83 Len=1440 [TCP segment of a reassembled PDU],0,Wikipedia,0
187,18.698605,2620:0:861:ed1a::1,2600:8805:3d03:3f00:88c9:1a5:bc23:ce61,TCP,1514,443  >  55903 [ACK] Seq=377953 Ack=2721 Win=83 Len=1440 [TCP segment of a reassembled PDU],0,Wikipedia,0
188,18.698731,2600:8805:3d03:3f00:88c9:1a5:bc23:ce61,2620:0:861:ed1a::1,TCP,74,55903  >  443 [ACK] Seq=2721 Ack=379393 Win=517 Len=0,0.000126,Wikipedia,0.000125
189,18.698877,2620:0:861:ed1a::1,2600:8805:3d03:3f00:88c9:1a5:bc23:ce61,TLSv1.2,15914,Application Data,0.000146,Wikipedia,0.000146
190,18.698983,2600:8805:3d03:3f00:88c9:1a5:bc23:ce61,2620:0:861:ed1a::1,TCP,74,55903  >  443 [ACK] Seq=2721 Ack=395233 Win=517 Len=0,0.000106,Wikipedia,0.000105
191,18.699683,2620:0:861:ed1a::1,2600:8805:3d03:3f00:88c9:1a5:bc23:ce61,TLSv1.2,13034,Application Data,0.0007,Wikipedia,0.0007
192,18.699779,2600:8805:3d03:3f00:88c9:1a5:bc23:ce61,2620:0:861:ed1a::1,TCP,74,55903  >  443 [ACK] Seq=2721 Ack=408193 Win=517 Len=0,9.6E-05,Wikipedia,0.000095
193,18.700721,2620:0:861:ed1a::1,2600:8805:3d03:3f00:88c9:1a5:bc23:ce61,TCP,8714,"443  >  55903 [PSH, ACK] Seq=408193 Ack=2721 Win=83 Len=8640 [TCP segment of a reassembled PDU]",0.000942,Wikipedia,0.000942
194,18.701215,2600:8805:3d03:3f00:88c9:1a5:bc23:ce61,2620:0:861:ed1a::1,TCP,74,55903  >  443 [ACK] Seq=2721 Ack=416833 Win=517 Len=0,0.000494,Wikipedia,0.000493
195,18.701797,2620:0:861:ed1a::1,2600:8805:3d03:3f00:88c9:1a5:bc23:ce61,TLSv1.2,13034,Application Data,0.000582,Wikipedia,0.000581
196,18.70189,2600:8805:3d03:3f00:88c9:1a5:bc23:ce61,2620:0:861:ed1a::1,TCP,74,55903  >  443 [ACK] Seq=2721 Ack=429793 Win=517 Len=0,9.3E-05,Wikipedia,0.000092
197,18.702982,2620:0:861:ed1a::1,2600:8805:3d03:3f00:88c9:1a5:bc23:ce61,TCP,2954,443  >  55903 [ACK] Seq=429793 Ack=2721 Win=83 Len=2880 [TCP segment of a reassembled PDU],0.001092,Wikipedia,0.001091
198,18.703065,2600:8805:3d03:3f00:88c9:1a5:bc23:ce61,2620:0:861:ed1a::1,TCP,74,55903  >  443 [ACK] Seq=2721 Ack=432673 Win=517 Len=0,8.3E-05,Wikipedia,0.000083
199,18.704363,2620:0:861:ed1a::1,2600:8805:3d03:3f00:88c9:1a5:bc23:ce61,TCP,1514,443  >  55903 [ACK] Seq=432673 Ack=2721 Win=83 Len=1440 [TCP segment of a reassembled PDU],0.001298,Wikipedia,0.001298
200,18.704363,2620:0:861:ed1a::1,2600:8805:3d03:3f00:88c9:1a5:bc23:ce61,TCP,1514,"443  >  55903 [PSH, ACK] Seq=434113 Ack=2721 Win=83 Len=1440 [TCP segment of a reassembled PDU]",0,Wikipedia,0
201,18.704363,2620:0:861:ed1a::1,2600:8805:3d03:3f00:88c9:1a5:bc23:ce61,TCP,2954,443  >  55903 [ACK] Seq=435553 Ack=2721 Win=83 Len=2880 [TCP segment of a reassembled PDU],0,Wikipedia,0
202,18.704438,2600:8805:3d03:3f00:88c9:1a5:bc23:ce61,2620:0:861:ed1a::1,TCP,74,55903  >  443 [ACK] Seq=2721 Ack=438433 Win=517 Len=0,7.5E-05,Wikipedia,0.000074
203,18.705877,2620:0:861:ed1a::1,2600:8805:3d03:3f00:88c9:1a5:bc23:ce61,TLSv1.2,27434,"Application Data, Application Data",0.001439,Wikipedia,0.001439
204,18.705983,2600:8805:3d03:3f00:88c9:1a5:bc23:ce61,2620:0:861:ed1a::1,TCP,74,55903  >  443 [ACK] Seq=2721 Ack=465793 Win=517 Len=0,0.000106,Wikipedia,0.000105
205,18.706771,2620:0:861:ed1a::1,2600:8805:3d03:3f00:88c9:1a5:bc23:ce61,TLSv1.2,14474,Application Data,0.000788,Wikipedia,0.000788
206,18.70683,2600:8805:3d03:3f00:88c9:1a5:bc23:ce61,2620:0:861:ed1a::1,TCP,74,55903  >  443 [ACK] Seq=2721 Ack=480193 Win=517 Len=0,5.9E-05,Wikipedia,0.000059
207,18.709023,2620:0:861:ed1a::1,2600:8805:3d03:3f00:88c9:1a5:bc23:ce61,TCP,1514,443  >  55903 [ACK] Seq=480193 Ack=2721 Win=83 Len=1440 [TCP segment of a reassembled PDU],0.002193,Wikipedia,0.002192
208,18.709023,2620:0:861:ed1a::1,2600:8805:3d03:3f00:88c9:1a5:bc23:ce61,TCP,1514,443  >  55903 [ACK] Seq=481633 Ack=2721 Win=83 Len=1440 [TCP segment of a reassembled PDU],0,Wikipedia,0
209,18.709023,2620:0:861:ed1a::1,2600:8805:3d03:3f00:88c9:1a5:bc23:ce61,TLSv1.2,7274,Application Data,0,Wikipedia,0
210,18.709107,2600:8805:3d03:3f00:88c9:1a5:bc23:ce61,2620:0:861:ed1a::1,TCP,74,55903  >  443 [ACK] Seq=2721 Ack=490273 Win=517 Len=0,8.4E-05,Wikipedia,0.000084
211,18.712454,2620:0:861:ed1a::1,2600:8805:3d03:3f00:88c9:1a5:bc23:ce61,TCP,1514,443  >  55903 [ACK] Seq=490273 Ack=2721 Win=83 Len=1440 [TCP segment of a reassembled PDU],0.003347,Wikipedia,0.003347
212,18.712454,2620:0:861:ed1a::1,2600:8805:3d03:3f00:88c9:1a5:bc23:ce61,TCP,1178,"443  >  55903 [PSH, ACK] Seq=491713 Ack=2721 Win=83 Len=1104 [TCP segment of a reassembled PDU]",0,Wikipedia,0
213,18.712516,2600:8805:3d03:3f00:88c9:1a5:bc23:ce61,2620:0:861:ed1a::1,TCP,74,55903  >  443 [ACK] Seq=2721 Ack=492817 Win=517 Len=0,6.2E-05,Wikipedia,0.000061
214,18.712857,2620:0:861:ed1a::1,2600:8805:3d03:3f00:88c9:1a5:bc23:ce61,TCP,2954,443  >  55903 [ACK] Seq=492817 Ack=2721 Win=83 Len=2880 [TCP segment of a reassembled PDU],0.000341,Wikipedia,0.00034
215,18.712891,2600:8805:3d03:3f00:88c9:1a5:bc23:ce61,2620:0:861:ed1a::1,TCP,74,55903  >  443 [ACK] Seq=2721 Ack=495697 Win=517 Len=0,3.4E-05,Wikipedia,0.000033
216,18.715361,2620:0:861:ed1a::1,2600:8805:3d03:3f00:88c9:1a5:bc23:ce61,TCP,1514,443  >  55903 [ACK] Seq=495697 Ack=2721 Win=83 Len=1440 [TCP segment of a reassembled PDU],0.00247,Wikipedia,0.00247
217,18.715361,2620:0:861:ed1a::1,2600:8805:3d03:3f00:88c9:1a5:bc23:ce61,TCP,1514,443  >  55903 [ACK] Seq=497137 Ack=2721 Win=83 Len=1440 [TCP segment of a reassembled PDU],0,Wikipedia,0
218,18.71542,2600:8805:3d03:3f00:88c9:1a5:bc23:ce61,2620:0:861:ed1a::1,TCP,74,55903  >  443 [ACK] Seq=2721 Ack=498577 Win=517 Len=0,5.9E-05,Wikipedia,0.000059
219,18.716877,2620:0:861:ed1a::1,2600:8805:3d03:3f00:88c9:1a5:bc23:ce61,TCP,1514,443  >  55903 [ACK] Seq=498577 Ack=2721 Win=83 Len=1440 [TCP segment of a reassembled PDU],0.001457,Wikipedia,0.001456
220,18.716877,2620:0:861:ed1a::1,2600:8805:3d03:3f00:88c9:1a5:bc23:ce61,TCP,1514,443  >  55903 [ACK] Seq=500017 Ack=2721 Win=83 Len=1440 [TCP segment of a reassembled PDU],0,Wikipedia,0
221,18.716877,2620:0:861:ed1a::1,2600:8805:3d03:3f00:88c9:1a5:bc23:ce61,TCP,1514,"443  >  55903 [PSH, ACK] Seq=501457 Ack=2721 Win=83 Len=1440 [TCP segment of a reassembled PDU]",0,Wikipedia,0
222,18.716945,2600:8805:3d03:3f00:88c9:1a5:bc23:ce61,2620:0:861:ed1a::1,TCP,74,55903  >  443 [ACK] Seq=2721 Ack=502897 Win=517 Len=0,6.8E-05,Wikipedia,0.000067
223,18.718669,2620:0:861:ed1a::1,2600:8805:3d03:3f00:88c9:1a5:bc23:ce61,TCP,1514,443  >  55903 [ACK] Seq=502897 Ack=2721 Win=83 Len=1440 [TCP segment of a reassembled PDU],0.001724,Wikipedia,0.001723
224,18.719976,2620:0:861:ed1a::1,2600:8805:3d03:3f00:88c9:1a5:bc23:ce61,TCP,1514,443  >  55903 [ACK] Seq=504337 Ack=2721 Win=83 Len=1440 [TCP segment of a reassembled PDU],0.001307,Wikipedia,0.001307
225,18.719976,2620:0:861:ed1a::1,2600:8805:3d03:3f00:88c9:1a5:bc23:ce61,TLSv1.2,1514,Application Data,0,Wikipedia,0
226,18.720036,2600:8805:3d03:3f00:88c9:1a5:bc23:ce61,2620:0:861:ed1a::1,TCP,74,55903  >  443 [ACK] Seq=2721 Ack=507217 Win=517 Len=0,6E-05,Wikipedia,0.00006
227,18.721372,2620:0:861:ed1a::1,2600:8805:3d03:3f00:88c9:1a5:bc23:ce61,TCP,1514,443  >  55903 [ACK] Seq=507217 Ack=2721 Win=83 Len=1440 [TCP segment of a reassembled PDU],0.001336,Wikipedia,0.001335
228,18.721372,2620:0:861:ed1a::1,2600:8805:3d03:3f00:88c9:1a5:bc23:ce61,TCP,1514,443  >  55903 [ACK] Seq=508657 Ack=2721 Win=83 Len=1440 [TCP segment of a reassembled PDU],0,Wikipedia,0
229,18.721372,2620:0:861:ed1a::1,2600:8805:3d03:3f00:88c9:1a5:bc23:ce61,TCP,2954,"443  >  55903 [PSH, ACK] Seq=510097 Ack=2721 Win=83 Len=2880 [TCP segment of a reassembled PDU]",0,Wikipedia,0
230,18.721441,2600:8805:3d03:3f00:88c9:1a5:bc23:ce61,2620:0:861:ed1a::1,TCP,74,55903  >  443 [ACK] Seq=2721 Ack=512977 Win=517 Len=0,6.9E-05,Wikipedia,0.000068
231,18.721585,2620:0:861:ed1a::1,2600:8805:3d03:3f00:88c9:1a5:bc23:ce61,TCP,1514,443  >  55903 [ACK] Seq=512977 Ack=2721 Win=83 Len=1440 [TCP segment of a reassembled PDU],0.000144,Wikipedia,0.000144
232,18.721585,2620:0:861:ed1a::1,2600:8805:3d03:3f00:88c9:1a5:bc23:ce61,TCP,1514,443  >  55903 [ACK] Seq=514417 Ack=2721 Win=83 Len=1440 [TCP segment of a reassembled PDU],0,Wikipedia,0
233,18.721585,2620:0:861:ed1a::1,2600:8805:3d03:3f00:88c9:1a5:bc23:ce61,TLSv1.2,8714,Application Data,0,Wikipedia,0
234,18.721661,2600:8805:3d03:3f00:88c9:1a5:bc23:ce61,2620:0:861:ed1a::1,TCP,74,55903  >  443 [ACK] Seq=2721 Ack=524497 Win=517 Len=0,7.6E-05,Wikipedia,0.000075
235,18.722884,2620:0:861:ed1a::1,2600:8805:3d03:3f00:88c9:1a5:bc23:ce61,TLSv1.2,14474,Application Data,0.001223,Wikipedia,0.001222
236,18.722884,2620:0:861:ed1a::1,2600:8805:3d03:3f00:88c9:1a5:bc23:ce61,TLSv1.2,738,Application Data,0,Wikipedia,0
237,18.722954,2600:8805:3d03:3f00:88c9:1a5:bc23:ce61,2620:0:861:ed1a::1,TCP,74,55903  >  443 [ACK] Seq=2721 Ack=539561 Win=517 Len=0,7E-05,Wikipedia,0.00007
238,18.78282,2600:8805:3d03:3f00:88c9:1a5:bc23:ce61,2620:0:861:ed1a::1,TLSv1.2,460,Application Data,0.059866,Wikipedia,0.059865
239,18.802695,2620:0:861:ed1a::1,2600:8805:3d03:3f00:88c9:1a5:bc23:ce61,TCP,11594,443  >  55903 [ACK] Seq=539561 Ack=3107 Win=83 Len=11520 [TCP segment of a reassembled PDU],0.019875,Wikipedia,0.019874
240,18.802906,2600:8805:3d03:3f00:88c9:1a5:bc23:ce61,2620:0:861:ed1a::1,TCP,74,55903  >  443 [ACK] Seq=3107 Ack=551081 Win=517 Len=0,0.000211,Wikipedia,0.000211
241,18.803233,2620:0:861:ed1a::1,2600:8805:3d03:3f00:88c9:1a5:bc23:ce61,TCP,2954,443  >  55903 [ACK] Seq=551081 Ack=3107 Win=83 Len=2880 [TCP segment of a reassembled PDU],0.000327,Wikipedia,0.000326
242,18.803233,2620:0:861:ed1a::1,2600:8805:3d03:3f00:88c9:1a5:bc23:ce61,TLSv1.2,342,Application Data,0,Wikipedia,0
243,18.803233,2620:0:861:ed1a::1,2600:8805:3d03:3f00:88c9:1a5:bc23:ce61,TCP,1514,443  >  55903 [ACK] Seq=554229 Ack=3107 Win=83 Len=1440 [TCP segment of a reassembled PDU],0,Wikipedia,0
244,18.803233,2620:0:861:ed1a::1,2600:8805:3d03:3f00:88c9:1a5:bc23:ce61,TCP,2954,443  >  55903 [ACK] Seq=555669 Ack=3107 Win=83 Len=2880 [TCP segment of a reassembled PDU],0,Wikipedia,0
245,18.803392,2600:8805:3d03:3f00:88c9:1a5:bc23:ce61,2620:0:861:ed1a::1,TCP,74,55903  >  443 [ACK] Seq=3107 Ack=558549 Win=517 Len=0,0.000159,Wikipedia,0.000159
246,18.803581,2620:0:861:ed1a::1,2600:8805:3d03:3f00:88c9:1a5:bc23:ce61,TCP,1514,443  >  55903 [ACK] Seq=558549 Ack=3107 Win=83 Len=1440 [TCP segment of a reassembled PDU],0.000189,Wikipedia,0.000189
247,18.803581,2620:0:861:ed1a::1,2600:8805:3d03:3f00:88c9:1a5:bc23:ce61,TLSv1.2,1023,Application Data,0,Wikipedia,0
248,18.803663,2600:8805:3d03:3f00:88c9:1a5:bc23:ce61,2620:0:861:ed1a::1,TCP,74,55903  >  443 [ACK] Seq=3107 Ack=560938 Win=517 Len=0,8.2E-05,Wikipedia,0.000081
249,18.830254,2600:8805:3d03:3f00:88c9:1a5:bc23:ce61,2620:0:861:ed1a::1,TLSv1.2,198,Application Data,0.026591,Wikipedia,0.02659
250,18.875113,2620:0:861:ed1a::1,2600:8805:3d03:3f00:88c9:1a5:bc23:ce61,TCP,14474,443  >  55903 [ACK] Seq=560938 Ack=3231 Win=83 Len=14400 [TCP segment of a reassembled PDU],0.044859,Wikipedia,0.044858
251,18.875113,2620:0:861:ed1a::1,2600:8805:3d03:3f00:88c9:1a5:bc23:ce61,TLSv1.2,372,Application Data,0,Wikipedia,0
252,18.875113,2620:0:861:ed1a::1,2600:8805:3d03:3f00:88c9:1a5:bc23:ce61,TCP,15914,443  >  55903 [ACK] Seq=575636 Ack=3231 Win=83 Len=15840 [TCP segment of a reassembled PDU],0,Wikipedia,0
253,18.875113,2620:0:861:ed1a::1,2600:8805:3d03:3f00:88c9:1a5:bc23:ce61,TLSv1.2,585,Application Data,0,Wikipedia,0
254,18.875113,2620:0:861:ed1a::1,2600:8805:3d03:3f00:88c9:1a5:bc23:ce61,TCP,7274,443  >  55903 [ACK] Seq=591987 Ack=3231 Win=83 Len=7200 [TCP segment of a reassembled PDU],0,Wikipedia,0
255,18.875828,2600:8805:3d03:3f00:88c9:1a5:bc23:ce61,2620:0:861:ed1a::1,TCP,74,55903  >  443 [ACK] Seq=3231 Ack=599187 Win=517 Len=0,0.000715,Wikipedia,0.000714
256,18.882777,2620:0:861:ed1a::1,2600:8805:3d03:3f00:88c9:1a5:bc23:ce61,TCP,2954,443  >  55903 [ACK] Seq=599187 Ack=3231 Win=83 Len=2880 [TCP segment of a reassembled PDU],0.006949,Wikipedia,0.006949
257,18.882777,2620:0:861:ed1a::1,2600:8805:3d03:3f00:88c9:1a5:bc23:ce61,TLSv1.2,492,Application Data,0,Wikipedia,0
258,18.883263,2600:8805:3d03:3f00:88c9:1a5:bc23:ce61,2620:0:861:ed1a::1,TCP,74,55903  >  443 [ACK] Seq=3231 Ack=602485 Win=517 Len=0,0.000486,Wikipedia,0.000485
259,19.462047,2600:8805:3d03:3f00:88c9:1a5:bc23:ce61,2620:0:861:ed1a::1,TLSv1.2,213,Application Data,0.578784,Wikipedia,0.578783
260,19.480383,2620:0:861:ed1a::1,2600:8805:3d03:3f00:88c9:1a5:bc23:ce61,TCP,5834,443  >  55903 [ACK] Seq=602485 Ack=3370 Win=83 Len=5760 [TCP segment of a reassembled PDU],0.018336,Wikipedia,0.018336
261,19.480563,2600:8805:3d03:3f00:88c9:1a5:bc23:ce61,2620:0:861:ed1a::1,TCP,74,55903  >  443 [ACK] Seq=3370 Ack=608245 Win=517 Len=0,0.00018,Wikipedia,0.00018
262,19.480678,2620:0:861:ed1a::1,2600:8805:3d03:3f00:88c9:1a5:bc23:ce61,TCP,8714,443  >  55903 [ACK] Seq=608245 Ack=3370 Win=83 Len=8640 [TCP segment of a reassembled PDU],0.000115,Wikipedia,0.000115
263,19.480678,2620:0:861:ed1a::1,2600:8805:3d03:3f00:88c9:1a5:bc23:ce61,TLSv1.2,372,Application Data,0,Wikipedia,0
264,19.480678,2620:0:861:ed1a::1,2600:8805:3d03:3f00:88c9:1a5:bc23:ce61,TCP,2954,443  >  55903 [ACK] Seq=617183 Ack=3370 Win=83 Len=2880 [TCP segment of a reassembled PDU],0,Wikipedia,0
265,19.480878,2600:8805:3d03:3f00:88c9:1a5:bc23:ce61,2620:0:861:ed1a::1,TCP,74,55903  >  443 [ACK] Seq=3370 Ack=620063 Win=517 Len=0,0.0002,Wikipedia,0.000199
266,19.48177,2620:0:861:ed1a::1,2600:8805:3d03:3f00:88c9:1a5:bc23:ce61,TCP,13034,443  >  55903 [ACK] Seq=620063 Ack=3370 Win=83 Len=12960 [TCP segment of a reassembled PDU],0.000892,Wikipedia,0.000892
267,19.48177,2620:0:861:ed1a::1,2600:8805:3d03:3f00:88c9:1a5:bc23:ce61,TLSv1.2,585,Application Data,0,Wikipedia,0
268,19.48177,2620:0:861:ed1a::1,2600:8805:3d03:3f00:88c9:1a5:bc23:ce61,TCP,7274,443  >  55903 [ACK] Seq=633534 Ack=3370 Win=83 Len=7200 [TCP segment of a reassembled PDU],0,Wikipedia,0
269,19.48177,2620:0:861:ed1a::1,2600:8805:3d03:3f00:88c9:1a5:bc23:ce61,TLSv1.2,947,Application Data,0,Wikipedia,0
270,19.48201,2600:8805:3d03:3f00:88c9:1a5:bc23:ce61,2620:0:861:ed1a::1,TCP,74,55903  >  443 [ACK] Seq=3370 Ack=641607 Win=517 Len=0,0.00024,Wikipedia,0.000239
271,21.499594,2600:8805:3d03:3f00:88c9:1a5:bc23:ce61,2620:0:861:ed1a::1,TLSv1.2,161,Application Data,2.017584,Wikipedia,2.017584
272,21.518237,2620:0:861:ed1a::1,2600:8805:3d03:3f00:88c9:1a5:bc23:ce61,TCP,1514,443  >  55903 [ACK] Seq=641607 Ack=3457 Win=83 Len=1440 [TCP segment of a reassembled PDU],0.018643,Wikipedia,0.018643
273,21.518685,2620:0:861:ed1a::1,2600:8805:3d03:3f00:88c9:1a5:bc23:ce61,TLSv1.2,1101,Application Data,0.000448,Wikipedia,0.000448
274,21.518721,2600:8805:3d03:3f00:88c9:1a5:bc23:ce61,2620:0:861:ed1a::1,TCP,74,55903  >  443 [ACK] Seq=3457 Ack=644074 Win=517 Len=0,3.6E-05,Wikipedia,0.000035
275,21.519537,2600:8805:3d03:3f00:88c9:1a5:bc23:ce61,2620:0:861:ed1a::1,TLSv1.2,109,Application Data,0.000816,Wikipedia,0.000816
276,21.579162,2620:0:861:ed1a::1,2600:8805:3d03:3f00:88c9:1a5:bc23:ce61,TCP,74,443  >  55903 [ACK] Seq=644074 Ack=3492 Win=83 Len=0,0.059625,Wikipedia,0.059625
277,21.726503,2600:8805:3d03:3f00:88c9:1a5:bc23:ce61,2620:0:861:ed1a::1,TLSv1.2,149,Application Data,0.147341,Wikipedia,0.147341
278,21.750537,2620:0:861:ed1a::1,2600:8805:3d03:3f00:88c9:1a5:bc23:ce61,TCP,74,443  >  55903 [ACK] Seq=644074 Ack=3567 Win=83 Len=0,0.024034,Wikipedia,0.024034
279,21.750966,2620:0:861:ed1a::1,2600:8805:3d03:3f00:88c9:1a5:bc23:ce61,TCP,1514,443  >  55903 [ACK] Seq=644074 Ack=3567 Win=83 Len=1440 [TCP segment of a reassembled PDU],0.000429,Wikipedia,0.000428
280,21.751378,2620:0:861:ed1a::1,2600:8805:3d03:3f00:88c9:1a5:bc23:ce61,TCP,1514,443  >  55903 [ACK] Seq=645514 Ack=3567 Win=83 Len=1440 [TCP segment of a reassembled PDU],0.000412,Wikipedia,0.000412
281,21.751416,2600:8805:3d03:3f00:88c9:1a5:bc23:ce61,2620:0:861:ed1a::1,TCP,74,55903  >  443 [ACK] Seq=3567 Ack=646954 Win=517 Len=0,3.8E-05,Wikipedia,0.000037
282,21.752677,2620:0:861:ed1a::1,2600:8805:3d03:3f00:88c9:1a5:bc23:ce61,TCP,11594,443  >  55903 [ACK] Seq=646954 Ack=3567 Win=83 Len=11520 [TCP segment of a reassembled PDU],0.001261,Wikipedia,0.00126
283,21.752677,2620:0:861:ed1a::1,2600:8805:3d03:3f00:88c9:1a5:bc23:ce61,TLSv1.2,282,Application Data,0,Wikipedia,0
284,21.752677,2620:0:861:ed1a::1,2600:8805:3d03:3f00:88c9:1a5:bc23:ce61,TCP,1514,443  >  55903 [ACK] Seq=658682 Ack=3567 Win=83 Len=1440 [TCP segment of a reassembled PDU],0,Wikipedia,0
285,21.752798,2600:8805:3d03:3f00:88c9:1a5:bc23:ce61,2620:0:861:ed1a::1,TCP,74,55903  >  443 [ACK] Seq=3567 Ack=660122 Win=517 Len=0,0.000121,Wikipedia,0.000121
286,21.754581,2620:0:861:ed1a::1,2600:8805:3d03:3f00:88c9:1a5:bc23:ce61,TCP,14474,443  >  55903 [ACK] Seq=660122 Ack=3567 Win=83 Len=14400 [TCP segment of a reassembled PDU],0.001783,Wikipedia,0.001783
287,21.754581,2620:0:861:ed1a::1,2600:8805:3d03:3f00:88c9:1a5:bc23:ce61,TLSv1.2,585,Application Data,0,Wikipedia,0
288,21.754581,2620:0:861:ed1a::1,2600:8805:3d03:3f00:88c9:1a5:bc23:ce61,TCP,15914,443  >  55903 [ACK] Seq=675033 Ack=3567 Win=83 Len=15840 [TCP segment of a reassembled PDU],0,Wikipedia,0
289,21.754581,2620:0:861:ed1a::1,2600:8805:3d03:3f00:88c9:1a5:bc23:ce61,TLSv1.2,585,Application Data,0,Wikipedia,0
290,21.754581,2620:0:861:ed1a::1,2600:8805:3d03:3f00:88c9:1a5:bc23:ce61,TCP,1514,443  >  55903 [ACK] Seq=691384 Ack=3567 Win=83 Len=1440 [TCP segment of a reassembled PDU],0,Wikipedia,0
291,21.754817,2600:8805:3d03:3f00:88c9:1a5:bc23:ce61,2620:0:861:ed1a::1,TCP,74,55903  >  443 [ACK] Seq=3567 Ack=692824 Win=1035 Len=0,0.000236,Wikipedia,0.000235
292,21.754986,2620:0:861:ed1a::1,2600:8805:3d03:3f00:88c9:1a5:bc23:ce61,TCP,2954,443  >  55903 [ACK] Seq=692824 Ack=3567 Win=83 Len=2880 [TCP segment of a reassembled PDU],0.000169,Wikipedia,0.000168
293,21.755048,2600:8805:3d03:3f00:88c9:1a5:bc23:ce61,2620:0:861:ed1a::1,TCP,74,55903  >  443 [ACK] Seq=3567 Ack=695704 Win=1035 Len=0,6.2E-05,Wikipedia,0.000061
294,21.756563,2620:0:861:ed1a::1,2600:8805:3d03:3f00:88c9:1a5:bc23:ce61,TLSv1.2,23114,Application Data,0.001515,Wikipedia,0.001515
295,21.757029,2600:8805:3d03:3f00:88c9:1a5:bc23:ce61,2620:0:861:ed1a::1,TCP,74,55903  >  443 [ACK] Seq=3567 Ack=718744 Win=1035 Len=0,0.000466,Wikipedia,0.000465
296,21.757283,2620:0:861:ed1a::1,2600:8805:3d03:3f00:88c9:1a5:bc23:ce61,TCP,1514,443  >  55903 [ACK] Seq=718744 Ack=3567 Win=83 Len=1440 [TCP segment of a reassembled PDU],0.000254,Wikipedia,0.000254
297,21.757283,2620:0:861:ed1a::1,2600:8805:3d03:3f00:88c9:1a5:bc23:ce61,TCP,1514,443  >  55903 [ACK] Seq=720184 Ack=3567 Win=83 Len=1440 [TCP segment of a reassembled PDU],0,Wikipedia,0
298,21.757283,2620:0:861:ed1a::1,2600:8805:3d03:3f00:88c9:1a5:bc23:ce61,TCP,1514,443  >  55903 [ACK] Seq=721624 Ack=3567 Win=83 Len=1440 [TCP segment of a reassembled PDU],0,Wikipedia,0
299,21.757283,2620:0:861:ed1a::1,2600:8805:3d03:3f00:88c9:1a5:bc23:ce61,TLSv1.2,1514,Application Data,0,Wikipedia,0
300,21.757283,2620:0:861:ed1a::1,2600:8805:3d03:3f00:88c9:1a5:bc23:ce61,TCP,5834,"443  >  55903 [PSH, ACK] Seq=724504 Ack=3567 Win=83 Len=5760 [TCP segment of a reassembled PDU]",0,Wikipedia,0
301,21.757531,2600:8805:3d03:3f00:88c9:1a5:bc23:ce61,2620:0:861:ed1a::1,TCP,74,55903  >  443 [ACK] Seq=3567 Ack=730264 Win=1035 Len=0,0.000248,Wikipedia,0.000247
302,21.758081,2620:0:861:ed1a::1,2600:8805:3d03:3f00:88c9:1a5:bc23:ce61,TLSv1.2,23114,Application Data,0.00055,Wikipedia,0.00055
303,21.758188,2600:8805:3d03:3f00:88c9:1a5:bc23:ce61,2620:0:861:ed1a::1,TCP,74,55903  >  443 [ACK] Seq=3567 Ack=753304 Win=1035 Len=0,0.000107,Wikipedia,0.000106
304,21.759082,2620:0:861:ed1a::1,2600:8805:3d03:3f00:88c9:1a5:bc23:ce61,TCP,2954,443  >  55903 [ACK] Seq=753304 Ack=3567 Win=83 Len=2880 [TCP segment of a reassembled PDU],0.000894,Wikipedia,0.000893
305,21.759116,2600:8805:3d03:3f00:88c9:1a5:bc23:ce61,2620:0:861:ed1a::1,TCP,74,55903  >  443 [ACK] Seq=3567 Ack=756184 Win=1035 Len=0,3.4E-05,Wikipedia,0.000033
306,21.759291,2620:0:861:ed1a::1,2600:8805:3d03:3f00:88c9:1a5:bc23:ce61,TLSv1.2,1514,Application Data,0.000175,Wikipedia,0.000175
307,21.759291,2620:0:861:ed1a::1,2600:8805:3d03:3f00:88c9:1a5:bc23:ce61,TCP,1514,443  >  55903 [ACK] Seq=757624 Ack=3567 Win=83 Len=1440 [TCP segment of a reassembled PDU],0,Wikipedia,0
308,21.759291,2620:0:861:ed1a::1,2600:8805:3d03:3f00:88c9:1a5:bc23:ce61,TCP,7274,"443  >  55903 [PSH, ACK] Seq=759064 Ack=3567 Win=83 Len=7200 [TCP segment of a reassembled PDU]",0,Wikipedia,0
309,21.759363,2600:8805:3d03:3f00:88c9:1a5:bc23:ce61,2620:0:861:ed1a::1,TCP,74,55903  >  443 [ACK] Seq=3567 Ack=766264 Win=2070 Len=0,7.2E-05,Wikipedia,0.000071
310,21.761807,2620:0:861:ed1a::1,2600:8805:3d03:3f00:88c9:1a5:bc23:ce61,TCP,1514,443  >  55903 [ACK] Seq=766264 Ack=3567 Win=83 Len=1440 [TCP segment of a reassembled PDU],0.002444,Wikipedia,0.002444
311,21.761807,2620:0:861:ed1a::1,2600:8805:3d03:3f00:88c9:1a5:bc23:ce61,TCP,1514,443  >  55903 [ACK] Seq=767704 Ack=3567 Win=83 Len=1440 [TCP segment of a reassembled PDU],0,Wikipedia,0
312,21.761807,2620:0:861:ed1a::1,2600:8805:3d03:3f00:88c9:1a5:bc23:ce61,TCP,1514,443  >  55903 [ACK] Seq=769144 Ack=3567 Win=83 Len=1440 [TCP segment of a reassembled PDU],0,Wikipedia,0
313,21.761807,2620:0:861:ed1a::1,2600:8805:3d03:3f00:88c9:1a5:bc23:ce61,TCP,1514,443  >  55903 [ACK] Seq=770584 Ack=3567 Win=83 Len=1440 [TCP segment of a reassembled PDU],0,Wikipedia,0
314,21.761807,2620:0:861:ed1a::1,2600:8805:3d03:3f00:88c9:1a5:bc23:ce61,TLSv1.2,1514,Application Data,0,Wikipedia,0
315,21.761807,2620:0:861:ed1a::1,2600:8805:3d03:3f00:88c9:1a5:bc23:ce61,TCP,1514,443  >  55903 [ACK] Seq=773464 Ack=3567 Win=83 Len=1440 [TCP segment of a reassembled PDU],0,Wikipedia,0
316,21.761807,2620:0:861:ed1a::1,2600:8805:3d03:3f00:88c9:1a5:bc23:ce61,TCP,1514,443  >  55903 [ACK] Seq=774904 Ack=3567 Win=83 Len=1440 [TCP segment of a reassembled PDU],0,Wikipedia,0
317,21.761807,2620:0:861:ed1a::1,2600:8805:3d03:3f00:88c9:1a5:bc23:ce61,TCP,156,"443  >  55903 [PSH, ACK] Seq=776344 Ack=3567 Win=83 Len=82 [TCP segment of a reassembled PDU]",0,Wikipedia,0
318,21.761968,2600:8805:3d03:3f00:88c9:1a5:bc23:ce61,2620:0:861:ed1a::1,TCP,74,55903  >  443 [ACK] Seq=3567 Ack=776426 Win=2070 Len=0,0.000161,Wikipedia,0.00016
319,21.771427,2620:0:861:ed1a::1,2600:8805:3d03:3f00:88c9:1a5:bc23:ce61,TCP,1514,443  >  55903 [ACK] Seq=776426 Ack=3567 Win=83 Len=1440 [TCP segment of a reassembled PDU],0.009459,Wikipedia,0.009458
320,21.771508,2600:8805:3d03:3f00:88c9:1a5:bc23:ce61,2620:0:861:ed1a::1,TCP,74,55903  >  443 [ACK] Seq=3567 Ack=777866 Win=2070 Len=0,8.1E-05,Wikipedia,0.000081
321,21.772514,2620:0:861:ed1a::1,2600:8805:3d03:3f00:88c9:1a5:bc23:ce61,TCP,1514,"443  >  55903 [PSH, ACK] Seq=777866 Ack=3567 Win=83 Len=1440 [TCP segment of a reassembled PDU]",0.001006,Wikipedia,0.001006
322,21.779073,2620:0:861:ed1a::1,2600:8805:3d03:3f00:88c9:1a5:bc23:ce61,TCP,1514,443  >  55903 [ACK] Seq=779306 Ack=3567 Win=83 Len=1440 [TCP segment of a reassembled PDU],0.006559,Wikipedia,0.006558
323,21.779112,2600:8805:3d03:3f00:88c9:1a5:bc23:ce61,2620:0:861:ed1a::1,TCP,74,55903  >  443 [ACK] Seq=3567 Ack=780746 Win=2070 Len=0,3.9E-05,Wikipedia,0.000039
324,21.77998,2620:0:861:ed1a::1,2600:8805:3d03:3f00:88c9:1a5:bc23:ce61,TLSv1.2,11594,Application Data,0.000868,Wikipedia,0.000867
325,21.77998,2620:0:861:ed1a::1,2600:8805:3d03:3f00:88c9:1a5:bc23:ce61,TCP,1432,"443  >  55903 [PSH, ACK] Seq=792266 Ack=3567 Win=83 Len=1358 [TCP segment of a reassembled PDU]",0,Wikipedia,0
326,21.77998,2620:0:861:ed1a::1,2600:8805:3d03:3f00:88c9:1a5:bc23:ce61,TCP,1514,443  >  55903 [ACK] Seq=793624 Ack=3567 Win=83 Len=1440 [TCP segment of a reassembled PDU],0,Wikipedia,0
327,21.780074,2600:8805:3d03:3f00:88c9:1a5:bc23:ce61,2620:0:861:ed1a::1,TCP,74,55903  >  443 [ACK] Seq=3567 Ack=795064 Win=2070 Len=0,9.4E-05,Wikipedia,0.000094
328,21.780587,2620:0:861:ed1a::1,2600:8805:3d03:3f00:88c9:1a5:bc23:ce61,TCP,5834,443  >  55903 [ACK] Seq=795064 Ack=3567 Win=83 Len=5760 [TCP segment of a reassembled PDU],0.000513,Wikipedia,0.000513
329,21.780587,2620:0:861:ed1a::1,2600:8805:3d03:3f00:88c9:1a5:bc23:ce61,TLSv1.2,1101,Application Data,0,Wikipedia,0
330,21.780676,2600:8805:3d03:3f00:88c9:1a5:bc23:ce61,2620:0:861:ed1a::1,TCP,74,55903  >  443 [ACK] Seq=3567 Ack=801851 Win=2070 Len=0,8.9E-05,Wikipedia,0.000088
331,21.832617,2600:8805:3d03:3f00:88c9:1a5:bc23:ce61,2620:0:861:ed1a::1,TLSv1.2,454,Application Data,0.051941,Wikipedia,0.05194
332,21.852762,2620:0:861:ed1a::1,2600:8805:3d03:3f00:88c9:1a5:bc23:ce61,TCP,10154,443  >  55903 [ACK] Seq=801851 Ack=3947 Win=83 Len=10080 [TCP segment of a reassembled PDU],0.020145,Wikipedia,0.020144
333,21.852953,2600:8805:3d03:3f00:88c9:1a5:bc23:ce61,2620:0:861:ed1a::1,TCP,74,55903  >  443 [ACK] Seq=3947 Ack=811931 Win=2070 Len=0,0.000191,Wikipedia,0.000191
334,21.853825,2620:0:861:ed1a::1,2600:8805:3d03:3f00:88c9:1a5:bc23:ce61,TCP,1514,443  >  55903 [ACK] Seq=811931 Ack=3947 Win=83 Len=1440 [TCP segment of a reassembled PDU],0.000872,Wikipedia,0.000872
335,21.853825,2620:0:861:ed1a::1,2600:8805:3d03:3f00:88c9:1a5:bc23:ce61,TCP,1514,443  >  55903 [ACK] Seq=813371 Ack=3947 Win=83 Len=1440 [TCP segment of a reassembled PDU],0,Wikipedia,0
336,21.853825,2620:0:861:ed1a::1,2600:8805:3d03:3f00:88c9:1a5:bc23:ce61,TCP,1514,443  >  55903 [ACK] Seq=814811 Ack=3947 Win=83 Len=1440 [TCP segment of a reassembled PDU],0,Wikipedia,0
337,21.853825,2620:0:861:ed1a::1,2600:8805:3d03:3f00:88c9:1a5:bc23:ce61,TLSv1.2,343,Application Data,0,Wikipedia,0
338,21.853825,2620:0:861:ed1a::1,2600:8805:3d03:3f00:88c9:1a5:bc23:ce61,TCP,5834,443  >  55903 [ACK] Seq=816520 Ack=3947 Win=83 Len=5760 [TCP segment of a reassembled PDU],0,Wikipedia,0
339,21.853825,2620:0:861:ed1a::1,2600:8805:3d03:3f00:88c9:1a5:bc23:ce61,TLSv1.2,528,Application Data,0,Wikipedia,0
340,21.854039,2600:8805:3d03:3f00:88c9:1a5:bc23:ce61,2620:0:861:ed1a::1,TCP,74,55903  >  443 [ACK] Seq=3947 Ack=822734 Win=2070 Len=0,0.000214,Wikipedia,0.000213
341,21.88573,2600:8805:3d03:3f00:88c9:1a5:bc23:ce61,2620:0:861:ed1a::1,TLSv1.2,191,Application Data,0.031691,Wikipedia,0.03169
342,21.901361,2620:0:861:ed1a::1,2600:8805:3d03:3f00:88c9:1a5:bc23:ce61,TCP,2954,443  >  55903 [ACK] Seq=822734 Ack=4064 Win=83 Len=2880 [TCP segment of a reassembled PDU],0.015631,Wikipedia,0.015631
343,21.901751,2600:8805:3d03:3f00:88c9:1a5:bc23:ce61,2620:0:861:ed1a::1,TCP,74,55903  >  443 [ACK] Seq=4064 Ack=825614 Win=2070 Len=0,0.00039,Wikipedia,0.000389
344,21.902094,2620:0:861:ed1a::1,2600:8805:3d03:3f00:88c9:1a5:bc23:ce61,TCP,2954,443  >  55903 [ACK] Seq=825614 Ack=4064 Win=83 Len=2880 [TCP segment of a reassembled PDU],0.000343,Wikipedia,0.000343
345,21.90222,2600:8805:3d03:3f00:88c9:1a5:bc23:ce61,2620:0:861:ed1a::1,TCP,74,55903  >  443 [ACK] Seq=4064 Ack=828494 Win=2070 Len=0,0.000126,Wikipedia,0.000125
346,21.902464,2620:0:861:ed1a::1,2600:8805:3d03:3f00:88c9:1a5:bc23:ce61,TCP,8714,443  >  55903 [ACK] Seq=828494 Ack=4064 Win=83 Len=8640 [TCP segment of a reassembled PDU],0.000244,Wikipedia,0.000243
347,21.902464,2620:0:861:ed1a::1,2600:8805:3d03:3f00:88c9:1a5:bc23:ce61,TLSv1.2,372,Application Data,0,Wikipedia,0
348,21.902464,2620:0:861:ed1a::1,2600:8805:3d03:3f00:88c9:1a5:bc23:ce61,TCP,2954,443  >  55903 [ACK] Seq=837432 Ack=4064 Win=83 Len=2880 [TCP segment of a reassembled PDU],0,Wikipedia,0
349,21.902567,2600:8805:3d03:3f00:88c9:1a5:bc23:ce61,2620:0:861:ed1a::1,TCP,74,55903  >  443 [ACK] Seq=4064 Ack=840312 Win=2070 Len=0,0.000103,Wikipedia,0.000103
350,21.90355,2620:0:861:ed1a::1,2600:8805:3d03:3f00:88c9:1a5:bc23:ce61,TCP,13034,443  >  55903 [ACK] Seq=840312 Ack=4064 Win=83 Len=12960 [TCP segment of a reassembled PDU],0.000983,Wikipedia,0.000982
351,21.90355,2620:0:861:ed1a::1,2600:8805:3d03:3f00:88c9:1a5:bc23:ce61,TLSv1.2,585,Application Data,0,Wikipedia,0
352,21.90355,2620:0:861:ed1a::1,2600:8805:3d03:3f00:88c9:1a5:bc23:ce61,TCP,7274,443  >  55903 [ACK] Seq=853783 Ack=4064 Win=83 Len=7200 [TCP segment of a reassembled PDU],0,Wikipedia,0
353,21.903745,2600:8805:3d03:3f00:88c9:1a5:bc23:ce61,2620:0:861:ed1a::1,TCP,74,55903  >  443 [ACK] Seq=4064 Ack=860983 Win=4151 Len=0,0.000195,Wikipedia,0.000195
354,21.908738,2620:0:861:ed1a::1,2600:8805:3d03:3f00:88c9:1a5:bc23:ce61,TCP,1514,443  >  55903 [ACK] Seq=860983 Ack=4064 Win=83 Len=1440 [TCP segment of a reassembled PDU],0.004993,Wikipedia,0.004992
355,21.908738,2620:0:861:ed1a::1,2600:8805:3d03:3f00:88c9:1a5:bc23:ce61,TCP,1514,443  >  55903 [ACK] Seq=862423 Ack=4064 Win=83 Len=1440 [TCP segment of a reassembled PDU],0,Wikipedia,0
356,21.908738,2620:0:861:ed1a::1,2600:8805:3d03:3f00:88c9:1a5:bc23:ce61,TLSv1.2,152,Application Data,0,Wikipedia,0
357,21.909754,2600:8805:3d03:3f00:88c9:1a5:bc23:ce61,2620:0:861:ed1a::1,TCP,74,55903  >  443 [ACK] Seq=4064 Ack=863941 Win=4151 Len=0,0.001016,Wikipedia,0.001015
358,22.404986,2600:8805:3d03:3f00:88c9:1a5:bc23:ce61,2620:0:861:ed1a::1,TLSv1.2,449,Application Data,0.495232,Wikipedia,0.495232
359,22.421312,2620:0:861:ed1a::1,2600:8805:3d03:3f00:88c9:1a5:bc23:ce61,TCP,1514,443  >  55903 [ACK] Seq=863941 Ack=4439 Win=83 Len=1440 [TCP segment of a reassembled PDU],0.016326,Wikipedia,0.016325
360,22.421533,2620:0:861:ed1a::1,2600:8805:3d03:3f00:88c9:1a5:bc23:ce61,TLSv1.2,572,Application Data,0.000221,Wikipedia,0.00022
361,22.421614,2600:8805:3d03:3f00:88c9:1a5:bc23:ce61,2620:0:861:ed1a::1,TCP,74,55903  >  443 [ACK] Seq=4439 Ack=865879 Win=4151 Len=0,8.1E-05,Wikipedia,0.000081
362,23.055594,2600:8805:3d03:3f00:88c9:1a5:bc23:ce61,2620:0:861:ed1a::1,TLSv1.2,381,Application Data,0.63398,Wikipedia,0.633979
363,23.1307,2620:0:861:ed1a::1,2600:8805:3d03:3f00:88c9:1a5:bc23:ce61,TCP,1514,443  >  55903 [ACK] Seq=865879 Ack=4746 Win=83 Len=1440 [TCP segment of a reassembled PDU],0.075106,Wikipedia,0.075106
364,23.13118,2620:0:861:ed1a::1,2600:8805:3d03:3f00:88c9:1a5:bc23:ce61,TLSv1.2,988,Application Data,0.00048,Wikipedia,0.000479
365,23.131239,2600:8805:3d03:3f00:88c9:1a5:bc23:ce61,2620:0:861:ed1a::1,TCP,74,55903  >  443 [ACK] Seq=4746 Ack=868233 Win=4151 Len=0,5.9E-05,Wikipedia,0.000059
366,23.423463,2600:8805:3d03:3f00:88c9:1a5:bc23:ce61,2620:0:861:ed1a::1,TLSv1.2,391,Application Data,0.292224,Wikipedia,0.292224
367,23.489658,2620:0:861:ed1a::1,2600:8805:3d03:3f00:88c9:1a5:bc23:ce61,TCP,74,443  >  55903 [ACK] Seq=868233 Ack=5063 Win=83 Len=0,0.066195,Wikipedia,0.066194
368,23.671285,2620:0:861:ed1a::1,2600:8805:3d03:3f00:88c9:1a5:bc23:ce61,TLSv1.2,1316,Application Data,0.181627,Wikipedia,0.181627
369,23.683327,2620:0:861:ed1a::1,2600:8805:3d03:3f00:88c9:1a5:bc23:ce61,TCP,5834,443  >  55903 [ACK] Seq=869475 Ack=5063 Win=83 Len=5760 [TCP segment of a reassembled PDU],0.012042,Wikipedia,0.012041
370,23.683487,2600:8805:3d03:3f00:88c9:1a5:bc23:ce61,2620:0:861:ed1a::1,TCP,74,55903  >  443 [ACK] Seq=5063 Ack=875235 Win=4151 Len=0,0.00016,Wikipedia,0.00016
371,23.683685,2620:0:861:ed1a::1,2600:8805:3d03:3f00:88c9:1a5:bc23:ce61,TCP,10154,443  >  55903 [ACK] Seq=875235 Ack=5063 Win=83 Len=10080 [TCP segment of a reassembled PDU],0.000198,Wikipedia,0.000198
372,23.683685,2620:0:861:ed1a::1,2600:8805:3d03:3f00:88c9:1a5:bc23:ce61,TLSv1.2,567,Application Data,0,Wikipedia,0
373,23.683685,2620:0:861:ed1a::1,2600:8805:3d03:3f00:88c9:1a5:bc23:ce61,TCP,7274,443  >  55903 [ACK] Seq=885808 Ack=5063 Win=83 Len=7200 [TCP segment of a reassembled PDU],0,Wikipedia,0
374,23.683822,2600:8805:3d03:3f00:88c9:1a5:bc23:ce61,2620:0:861:ed1a::1,TCP,74,55903  >  443 [ACK] Seq=5063 Ack=893008 Win=4151 Len=0,0.000137,Wikipedia,0.000136
375,23.686053,2620:0:861:ed1a::1,2600:8805:3d03:3f00:88c9:1a5:bc23:ce61,TCP,8714,443  >  55903 [ACK] Seq=893008 Ack=5063 Win=83 Len=8640 [TCP segment of a reassembled PDU],0.002231,Wikipedia,0.002231
376,23.686053,2620:0:861:ed1a::1,2600:8805:3d03:3f00:88c9:1a5:bc23:ce61,TLSv1.2,585,Application Data,0,Wikipedia,0
377,23.686053,2620:0:861:ed1a::1,2600:8805:3d03:3f00:88c9:1a5:bc23:ce61,TCP,13034,443  >  55903 [ACK] Seq=902159 Ack=5063 Win=83 Len=12960 [TCP segment of a reassembled PDU],0,Wikipedia,0
378,23.686053,2620:0:861:ed1a::1,2600:8805:3d03:3f00:88c9:1a5:bc23:ce61,TLSv1.2,484,Application Data,0,Wikipedia,0
379,23.686261,2600:8805:3d03:3f00:88c9:1a5:bc23:ce61,2620:0:861:ed1a::1,TCP,74,55903  >  443 [ACK] Seq=5063 Ack=915529 Win=4151 Len=0,0.000208,Wikipedia,0.000207
380,23.700556,2620:0:861:ed1a::1,2600:8805:3d03:3f00:88c9:1a5:bc23:ce61,TCP,8714,443  >  55903 [ACK] Seq=915529 Ack=5063 Win=83 Len=8640 [TCP segment of a reassembled PDU],0.014295,Wikipedia,0.014295
381,23.700556,2620:0:861:ed1a::1,2600:8805:3d03:3f00:88c9:1a5:bc23:ce61,TLSv1.2,492,Application Data,0,Wikipedia,0
382,23.700556,2620:0:861:ed1a::1,2600:8805:3d03:3f00:88c9:1a5:bc23:ce61,TCP,15914,443  >  55903 [ACK] Seq=924587 Ack=5063 Win=83 Len=15840 [TCP segment of a reassembled PDU],0,Wikipedia,0
383,23.700556,2620:0:861:ed1a::1,2600:8805:3d03:3f00:88c9:1a5:bc23:ce61,TLSv1.2,568,Application Data,0,Wikipedia,0
384,23.700556,2620:0:861:ed1a::1,2600:8805:3d03:3f00:88c9:1a5:bc23:ce61,TCP,5834,443  >  55903 [ACK] Seq=940921 Ack=5063 Win=83 Len=5760 [TCP segment of a reassembled PDU],0,Wikipedia,0
385,23.700556,2620:0:861:ed1a::1,2600:8805:3d03:3f00:88c9:1a5:bc23:ce61,TLSv1.2,1480,Application Data,0,Wikipedia,0
386,23.700916,2600:8805:3d03:3f00:88c9:1a5:bc23:ce61,2620:0:861:ed1a::1,TCP,74,55903  >  443 [ACK] Seq=5063 Ack=948087 Win=4151 Len=0,0.00036,Wikipedia,0.00036
387,24.510301,2600:8805:3d03:3f00:88c9:1a5:bc23:ce61,2620:0:861:ed1a::1,TLSv1.2,299,Application Data,0.809385,Wikipedia,0.809384
388,24.52868,2620:0:861:ed1a::1,2600:8805:3d03:3f00:88c9:1a5:bc23:ce61,TCP,74,443  >  55903 [ACK] Seq=948087 Ack=5288 Win=83 Len=0,0.018379,Wikipedia,0.018379
389,24.528837,2620:0:861:ed1a::1,2600:8805:3d03:3f00:88c9:1a5:bc23:ce61,TCP,1514,443  >  55903 [ACK] Seq=948087 Ack=5288 Win=83 Len=1440 [TCP segment of a reassembled PDU],0.000157,Wikipedia,0.000156
390,24.528837,2620:0:861:ed1a::1,2600:8805:3d03:3f00:88c9:1a5:bc23:ce61,TLSv1.2,1024,Application Data,0,Wikipedia,0
391,24.529006,2600:8805:3d03:3f00:88c9:1a5:bc23:ce61,2620:0:861:ed1a::1,TCP,74,55903  >  443 [ACK] Seq=5288 Ack=950477 Win=4151 Len=0,0.000169,Wikipedia,0.000168
392,24.797475,2600:8805:3d03:3f00:88c9:1a5:bc23:ce61,2620:0:861:ed1a::1,TLSv1.2,168,Application Data,0.268469,Wikipedia,0.268469
393,24.819838,2620:0:861:ed1a::1,2600:8805:3d03:3f00:88c9:1a5:bc23:ce61,TCP,1514,443  >  55903 [ACK] Seq=950477 Ack=5382 Win=83 Len=1440 [TCP segment of a reassembled PDU],0.022363,Wikipedia,0.022363
394,24.820456,2620:0:861:ed1a::1,2600:8805:3d03:3f00:88c9:1a5:bc23:ce61,TCP,2954,443  >  55903 [ACK] Seq=951917 Ack=5382 Win=83 Len=2880 [TCP segment of a reassembled PDU],0.000618,Wikipedia,0.000617
395,24.820522,2600:8805:3d03:3f00:88c9:1a5:bc23:ce61,2620:0:861:ed1a::1,TCP,74,55903  >  443 [ACK] Seq=5382 Ack=954797 Win=4151 Len=0,6.6E-05,Wikipedia,0.000066
396,24.821633,2620:0:861:ed1a::1,2600:8805:3d03:3f00:88c9:1a5:bc23:ce61,TCP,10154,443  >  55903 [ACK] Seq=954797 Ack=5382 Win=83 Len=10080 [TCP segment of a reassembled PDU],0.001111,Wikipedia,0.00111
397,24.821633,2620:0:861:ed1a::1,2600:8805:3d03:3f00:88c9:1a5:bc23:ce61,TLSv1.2,281,Application Data,0,Wikipedia,0
398,24.821633,2620:0:861:ed1a::1,2600:8805:3d03:3f00:88c9:1a5:bc23:ce61,TCP,15914,443  >  55903 [ACK] Seq=965084 Ack=5382 Win=83 Len=15840 [TCP segment of a reassembled PDU],0,Wikipedia,0
399,24.821633,2620:0:861:ed1a::1,2600:8805:3d03:3f00:88c9:1a5:bc23:ce61,TLSv1.2,585,Application Data,0,Wikipedia,0
400,24.821797,2600:8805:3d03:3f00:88c9:1a5:bc23:ce61,2620:0:861:ed1a::1,TCP,74,55903  >  443 [ACK] Seq=5382 Ack=981435 Win=4151 Len=0,0.000164,Wikipedia,0.000164
401,24.826786,2620:0:861:ed1a::1,2600:8805:3d03:3f00:88c9:1a5:bc23:ce61,TCP,15914,443  >  55903 [ACK] Seq=981435 Ack=5382 Win=83 Len=15840 [TCP segment of a reassembled PDU],0.004989,Wikipedia,0.004988
402,24.826786,2620:0:861:ed1a::1,2600:8805:3d03:3f00:88c9:1a5:bc23:ce61,TLSv1.2,585,Application Data,0,Wikipedia,0
403,24.826786,2620:0:861:ed1a::1,2600:8805:3d03:3f00:88c9:1a5:bc23:ce61,TCP,15914,443  >  55903 [ACK] Seq=997786 Ack=5382 Win=83 Len=15840 [TCP segment of a reassembled PDU],0,Wikipedia,0
404,24.827009,2600:8805:3d03:3f00:88c9:1a5:bc23:ce61,2620:0:861:ed1a::1,TCP,74,55903  >  443 [ACK] Seq=5382 Ack=1013626 Win=4151 Len=0,0.000223,Wikipedia,0.000223
405,24.827158,2620:0:861:ed1a::1,2600:8805:3d03:3f00:88c9:1a5:bc23:ce61,TLSv1.2,1514,Application Data,0.000149,Wikipedia,0.000149
406,24.827158,2620:0:861:ed1a::1,2600:8805:3d03:3f00:88c9:1a5:bc23:ce61,TLSv1.2,781,Application Data,0,Wikipedia,0
407,24.827211,2600:8805:3d03:3f00:88c9:1a5:bc23:ce61,2620:0:861:ed1a::1,TCP,74,55903  >  443 [ACK] Seq=5382 Ack=1015773 Win=4151 Len=0,5.3E-05,Wikipedia,0.000052
408,24.969234,2600:8805:3d03:3f00:88c9:1a5:bc23:ce61,2620:0:861:ed1a::1,TLSv1.2,514,Application Data,0.142023,Wikipedia,0.142023
409,24.988274,2620:0:861:ed1a::1,2600:8805:3d03:3f00:88c9:1a5:bc23:ce61,TCP,1514,443  >  55903 [ACK] Seq=1015773 Ack=5822 Win=83 Len=1440 [TCP segment of a reassembled PDU],0.01904,Wikipedia,0.01904
410,24.990178,2620:0:861:ed1a::1,2600:8805:3d03:3f00:88c9:1a5:bc23:ce61,TCP,13034,443  >  55903 [ACK] Seq=1017213 Ack=5822 Win=83 Len=12960 [TCP segment of a reassembled PDU],0.001904,Wikipedia,0.001903
411,24.990178,2620:0:861:ed1a::1,2600:8805:3d03:3f00:88c9:1a5:bc23:ce61,TLSv1.2,344,Application Data,0,Wikipedia,0
412,24.990178,2620:0:861:ed1a::1,2600:8805:3d03:3f00:88c9:1a5:bc23:ce61,TCP,5834,443  >  55903 [ACK] Seq=1030443 Ack=5822 Win=83 Len=5760 [TCP segment of a reassembled PDU],0,Wikipedia,0
413,24.990178,2620:0:861:ed1a::1,2600:8805:3d03:3f00:88c9:1a5:bc23:ce61,TLSv1.2,620,Application Data,0,Wikipedia,0
414,24.990402,2600:8805:3d03:3f00:88c9:1a5:bc23:ce61,2620:0:861:ed1a::1,TCP,74,55903  >  443 [ACK] Seq=5822 Ack=1036749 Win=4151 Len=0,0.000224,Wikipedia,0.000223
415,25.047551,2600:8805:3d03:3f00:88c9:1a5:bc23:ce61,2620:0:861:ed1a::1,TLSv1.2,572,Application Data,0.057149,Wikipedia,0.057148
416,25.077277,2620:0:861:ed1a::1,2600:8805:3d03:3f00:88c9:1a5:bc23:ce61,TLSv1.2,1273,Application Data,0.029726,Wikipedia,0.029726
417,25.121494,2600:8805:3d03:3f00:88c9:1a5:bc23:ce61,2620:0:861:ed1a::1,TCP,74,55903  >  443 [ACK] Seq=6320 Ack=1037948 Win=4146 Len=0,0.044217,Wikipedia,0.044216
418,26.881336,2600:8805:3d03:3f00:88c9:1a5:bc23:ce61,2620:0:861:ed1a::1,TLSv1.2,160,Application Data,1.759842,Wikipedia,1.759842
419,26.941043,2620:0:861:ed1a::1,2600:8805:3d03:3f00:88c9:1a5:bc23:ce61,TCP,74,443  >  55903 [ACK] Seq=1037948 Ack=6406 Win=83 Len=0,0.059707,Wikipedia,0.059706
420,27.00252,2600:8805:3d03:3f00:88c9:1a5:bc23:ce61,2620:0:861:ed1a::1,TLSv1.2,162,Application Data,0.061477,Wikipedia,0.061477
421,27.025654,2620:0:861:ed1a::1,2600:8805:3d03:3f00:88c9:1a5:bc23:ce61,TCP,74,443  >  55903 [ACK] Seq=1037948 Ack=6494 Win=83 Len=0,0.023134,Wikipedia,0.023133
422,27.026233,2620:0:861:ed1a::1,2600:8805:3d03:3f00:88c9:1a5:bc23:ce61,TCP,5834,443  >  55903 [ACK] Seq=1037948 Ack=6494 Win=83 Len=5760 [TCP segment of a reassembled PDU],0.000579,Wikipedia,0.000579
423,27.026317,2600:8805:3d03:3f00:88c9:1a5:bc23:ce61,2620:0:861:ed1a::1,TCP,74,55903  >  443 [ACK] Seq=6494 Ack=1043708 Win=4151 Len=0,8.4E-05,Wikipedia,0.000083
424,27.027444,2620:0:861:ed1a::1,2600:8805:3d03:3f00:88c9:1a5:bc23:ce61,TCP,8714,443  >  55903 [ACK] Seq=1043708 Ack=6494 Win=83 Len=8640 [TCP segment of a reassembled PDU],0.001127,Wikipedia,0.001127
425,27.027444,2620:0:861:ed1a::1,2600:8805:3d03:3f00:88c9:1a5:bc23:ce61,TLSv1.2,281,Application Data,0,Wikipedia,0
426,27.027444,2620:0:861:ed1a::1,2600:8805:3d03:3f00:88c9:1a5:bc23:ce61,TCP,11594,443  >  55903 [ACK] Seq=1052555 Ack=6494 Win=83 Len=11520 [TCP segment of a reassembled PDU],0,Wikipedia,0
427,27.027571,2600:8805:3d03:3f00:88c9:1a5:bc23:ce61,2620:0:861:ed1a::1,TCP,74,55903  >  443 [ACK] Seq=6494 Ack=1064075 Win=4151 Len=0,0.000127,Wikipedia,0.000126
428,27.028273,2600:8805:3d03:3f00:88c9:1a5:bc23:ce61,2620:0:861:ed1a::1,TLSv1.2,109,Application Data,0.000702,Wikipedia,0.000702
429,27.029228,2620:0:861:ed1a::1,2600:8805:3d03:3f00:88c9:1a5:bc23:ce61,TCP,4394,443  >  55903 [ACK] Seq=1064075 Ack=6494 Win=83 Len=4320 [TCP segment of a reassembled PDU],0.000955,Wikipedia,0.000955
430,27.029228,2620:0:861:ed1a::1,2600:8805:3d03:3f00:88c9:1a5:bc23:ce61,TLSv1.2,585,Application Data,0,Wikipedia,0
431,27.029228,2620:0:861:ed1a::1,2600:8805:3d03:3f00:88c9:1a5:bc23:ce61,TCP,14474,443  >  55903 [ACK] Seq=1068906 Ack=6494 Win=83 Len=14400 [TCP segment of a reassembled PDU],0,Wikipedia,0
432,27.029228,2620:0:861:ed1a::1,2600:8805:3d03:3f00:88c9:1a5:bc23:ce61,TLSv1.2,600,Application Data,0,Wikipedia,0
433,27.029228,2620:0:861:ed1a::1,2600:8805:3d03:3f00:88c9:1a5:bc23:ce61,TCP,1514,443  >  55903 [ACK] Seq=1083832 Ack=6494 Win=83 Len=1440 [TCP segment of a reassembled PDU],0,Wikipedia,0
434,27.029406,2600:8805:3d03:3f00:88c9:1a5:bc23:ce61,2620:0:861:ed1a::1,TCP,74,55903  >  443 [ACK] Seq=6529 Ack=1085272 Win=4151 Len=0,0.000178,Wikipedia,0.000178
435,27.030311,2620:0:861:ed1a::1,2600:8805:3d03:3f00:88c9:1a5:bc23:ce61,TCP,14474,443  >  55903 [ACK] Seq=1085272 Ack=6494 Win=83 Len=14400 [TCP segment of a reassembled PDU],0.000905,Wikipedia,0.000904
436,27.030311,2620:0:861:ed1a::1,2600:8805:3d03:3f00:88c9:1a5:bc23:ce61,TLSv1.2,585,Application Data,0,Wikipedia,0
437,27.030311,2620:0:861:ed1a::1,2600:8805:3d03:3f00:88c9:1a5:bc23:ce61,TCP,4394,443  >  55903 [ACK] Seq=1100183 Ack=6494 Win=83 Len=4320 [TCP segment of a reassembled PDU],0,Wikipedia,0
438,27.030311,2620:0:861:ed1a::1,2600:8805:3d03:3f00:88c9:1a5:bc23:ce61,TLSv1.2,315,Application Data,0,Wikipedia,0
439,27.030448,2600:8805:3d03:3f00:88c9:1a5:bc23:ce61,2620:0:861:ed1a::1,TCP,74,55903  >  443 [ACK] Seq=6529 Ack=1104744 Win=4151 Len=0,0.000137,Wikipedia,0.000136
440,27.063658,2620:0:861:ed1a::1,2600:8805:3d03:3f00:88c9:1a5:bc23:ce61,TLSv1.2,1446,Application Data,0.03321,Wikipedia,0.03321
441,27.063756,2600:8805:3d03:3f00:88c9:1a5:bc23:ce61,2620:0:861:ed1a::1,TCP,74,55903  >  443 [ACK] Seq=6529 Ack=1106116 Win=4145 Len=0,9.8E-05,Wikipedia,0.000098
442,27.065594,2600:8805:3d03:3f00:88c9:1a5:bc23:ce61,2620:0:861:ed1a::1,TLSv1.2,277,Application Data,0.001838,Wikipedia,0.001837
443,27.085083,2620:0:861:ed1a::1,2600:8805:3d03:3f00:88c9:1a5:bc23:ce61,TCP,1514,443  >  55903 [ACK] Seq=1106116 Ack=6732 Win=83 Len=1440 [TCP segment of a reassembled PDU],0.019489,Wikipedia,0.019489
444,27.085473,2620:0:861:ed1a::1,2600:8805:3d03:3f00:88c9:1a5:bc23:ce61,TLSv1.2,1054,Application Data,0.00039,Wikipedia,0.000389
445,27.085535,2600:8805:3d03:3f00:88c9:1a5:bc23:ce61,2620:0:861:ed1a::1,TCP,74,55903  >  443 [ACK] Seq=6732 Ack=1108536 Win=4151 Len=0,6.2E-05,Wikipedia,0.000061
446,27.089638,2620:0:861:ed1a::1,2600:8805:3d03:3f00:88c9:1a5:bc23:ce61,TCP,74,[TCP Dup ACK 443#1] 443  >  55903 [ACK] Seq=1108536 Ack=6732 Win=83 Len=0,0.004103,Wikipedia,0.004103
447,27.094685,2600:8805:3d03:3f00:88c9:1a5:bc23:ce61,2620:0:861:ed1a::1,TLSv1.2,392,Application Data,0.005047,Wikipedia,0.005046
448,27.127589,2620:0:861:ed1a::1,2600:8805:3d03:3f00:88c9:1a5:bc23:ce61,TCP,4394,443  >  55903 [ACK] Seq=1108536 Ack=7050 Win=83 Len=4320 [TCP segment of a reassembled PDU],0.032904,Wikipedia,0.032904
449,27.127672,2600:8805:3d03:3f00:88c9:1a5:bc23:ce61,2620:0:861:ed1a::1,TCP,74,55903  >  443 [ACK] Seq=7050 Ack=1112856 Win=4151 Len=0,8.3E-05,Wikipedia,0.000083
450,27.128852,2620:0:861:ed1a::1,2600:8805:3d03:3f00:88c9:1a5:bc23:ce61,TCP,10154,443  >  55903 [ACK] Seq=1112856 Ack=7050 Win=83 Len=10080 [TCP segment of a reassembled PDU],0.00118,Wikipedia,0.001179
451,27.128852,2620:0:861:ed1a::1,2600:8805:3d03:3f00:88c9:1a5:bc23:ce61,TLSv1.2,344,Application Data,0,Wikipedia,0
452,27.129013,2600:8805:3d03:3f00:88c9:1a5:bc23:ce61,2620:0:861:ed1a::1,TCP,74,55903  >  443 [ACK] Seq=7050 Ack=1123206 Win=4151 Len=0,0.000161,Wikipedia,0.000161
453,27.132059,2620:0:861:ed1a::1,2600:8805:3d03:3f00:88c9:1a5:bc23:ce61,TCP,4394,443  >  55903 [ACK] Seq=1123206 Ack=7050 Win=83 Len=4320 [TCP segment of a reassembled PDU],0.003046,Wikipedia,0.003046
454,27.132059,2620:0:861:ed1a::1,2600:8805:3d03:3f00:88c9:1a5:bc23:ce61,TLSv1.2,151,Application Data,0,Wikipedia,0
455,27.132429,2600:8805:3d03:3f00:88c9:1a5:bc23:ce61,2620:0:861:ed1a::1,TCP,74,55903  >  443 [ACK] Seq=7050 Ack=1127603 Win=4151 Len=0,0.00037,Wikipedia,0.000369
456,28.275068,2600:8805:3d03:3f00:88c9:1a5:bc23:ce61,2620:0:861:ed1a::1,TLSv1.2,195,Application Data,1.142639,Wikipedia,1.142639
457,28.293965,2620:0:861:ed1a::1,2600:8805:3d03:3f00:88c9:1a5:bc23:ce61,TCP,1514,443  >  55903 [ACK] Seq=1127603 Ack=7171 Win=83 Len=1440 [TCP segment of a reassembled PDU],0.018897,Wikipedia,0.018896
458,28.294288,2620:0:861:ed1a::1,2600:8805:3d03:3f00:88c9:1a5:bc23:ce61,TLSv1.2,1069,Application Data,0.000323,Wikipedia,0.000323
459,28.294391,2600:8805:3d03:3f00:88c9:1a5:bc23:ce61,2620:0:861:ed1a::1,TCP,74,55903  >  443 [ACK] Seq=7171 Ack=1130038 Win=4151 Len=0,0.000103,Wikipedia,0.000102
460,28.928077,2600:8805:3d03:3f00:88c9:1a5:bc23:ce61,2620:0:861:ed1a::1,TLSv1.2,152,Application Data,0.633686,Wikipedia,0.633685
461,28.950977,2620:0:861:ed1a::1,2600:8805:3d03:3f00:88c9:1a5:bc23:ce61,TCP,1514,443  >  55903 [ACK] Seq=1130038 Ack=7249 Win=83 Len=1440 [TCP segment of a reassembled PDU],0.0229,Wikipedia,0.0229
462,28.952338,2620:0:861:ed1a::1,2600:8805:3d03:3f00:88c9:1a5:bc23:ce61,TCP,13034,443  >  55903 [ACK] Seq=1131478 Ack=7249 Win=83 Len=12960 [TCP segment of a reassembled PDU],0.001361,Wikipedia,0.00136
463,28.952338,2620:0:861:ed1a::1,2600:8805:3d03:3f00:88c9:1a5:bc23:ce61,TLSv1.2,266,Application Data,0,Wikipedia,0
464,28.952338,2620:0:861:ed1a::1,2600:8805:3d03:3f00:88c9:1a5:bc23:ce61,TCP,8714,443  >  55903 [ACK] Seq=1144630 Ack=7249 Win=83 Len=8640 [TCP segment of a reassembled PDU],0,Wikipedia,0
465,28.952544,2600:8805:3d03:3f00:88c9:1a5:bc23:ce61,2620:0:861:ed1a::1,TCP,74,55903  >  443 [ACK] Seq=7249 Ack=1153270 Win=4151 Len=0,0.000206,Wikipedia,0.000205
466,28.952803,2620:0:861:ed1a::1,2600:8805:3d03:3f00:88c9:1a5:bc23:ce61,TCP,7274,443  >  55903 [ACK] Seq=1153270 Ack=7249 Win=83 Len=7200 [TCP segment of a reassembled PDU],0.000259,Wikipedia,0.000258
467,28.952803,2620:0:861:ed1a::1,2600:8805:3d03:3f00:88c9:1a5:bc23:ce61,TLSv1.2,585,Application Data,0,Wikipedia,0
468,28.952803,2620:0:861:ed1a::1,2600:8805:3d03:3f00:88c9:1a5:bc23:ce61,TCP,1514,443  >  55903 [ACK] Seq=1160981 Ack=7249 Win=83 Len=1440 [TCP segment of a reassembled PDU],0,Wikipedia,0
469,28.95293,2600:8805:3d03:3f00:88c9:1a5:bc23:ce61,2620:0:861:ed1a::1,TCP,74,55903  >  443 [ACK] Seq=7249 Ack=1162421 Win=4151 Len=0,0.000127,Wikipedia,0.000126
470,28.954052,2620:0:861:ed1a::1,2600:8805:3d03:3f00:88c9:1a5:bc23:ce61,TCP,14474,443  >  55903 [ACK] Seq=1162421 Ack=7249 Win=83 Len=14400 [TCP segment of a reassembled PDU],0.001122,Wikipedia,0.001122
471,28.954052,2620:0:861:ed1a::1,2600:8805:3d03:3f00:88c9:1a5:bc23:ce61,TLSv1.2,585,Application Data,0,Wikipedia,0
472,28.954052,2620:0:861:ed1a::1,2600:8805:3d03:3f00:88c9:1a5:bc23:ce61,TCP,7274,443  >  55903 [ACK] Seq=1177332 Ack=7249 Win=83 Len=7200 [TCP segment of a reassembled PDU],0,Wikipedia,0
473,28.954299,2600:8805:3d03:3f00:88c9:1a5:bc23:ce61,2620:0:861:ed1a::1,TCP,74,55903  >  443 [ACK] Seq=7249 Ack=1184532 Win=4151 Len=0,0.000247,Wikipedia,0.000246
474,28.954507,2620:0:861:ed1a::1,2600:8805:3d03:3f00:88c9:1a5:bc23:ce61,TCP,8714,443  >  55903 [ACK] Seq=1184532 Ack=7249 Win=83 Len=8640 [TCP segment of a reassembled PDU],0.000208,Wikipedia,0.000208
475,28.954507,2620:0:861:ed1a::1,2600:8805:3d03:3f00:88c9:1a5:bc23:ce61,TLSv1.2,370,Application Data,0,Wikipedia,0
476,28.954594,2600:8805:3d03:3f00:88c9:1a5:bc23:ce61,2620:0:861:ed1a::1,TCP,74,55903  >  443 [ACK] Seq=7249 Ack=1193468 Win=4151 Len=0,8.7E-05,Wikipedia,0.000087
477,29.322712,2600:8805:3d03:3f00:88c9:1a5:bc23:ce61,2620:0:861:ed1a::1,TLSv1.2,259,Application Data,0.368118,Wikipedia,0.368117
478,29.343146,2620:0:861:ed1a::1,2600:8805:3d03:3f00:88c9:1a5:bc23:ce61,TLSv1.2,1100,Application Data,0.020434,Wikipedia,0.020434
479,29.385957,2600:8805:3d03:3f00:88c9:1a5:bc23:ce61,2620:0:861:ed1a::1,TCP,74,55903  >  443 [ACK] Seq=7434 Ack=1194494 Win=4147 Len=0,0.042811,Wikipedia,0.042811
