No.,Time,Source,Destination,Protocol,Length,Info,Time_Between,Website,Ttruncated
1,0,2600:8805:3d03:3f00:88c9:1a5:bc23:ce61,2620:0:861:ed1a::1,TLSv1.2,152,Application Data,0,Wikipedia,0
2,0.000063,2600:8805:3d03:3f00:88c9:1a5:bc23:ce61,2620:0:861:ed1a::1,TLSv1.2,113,Application Data,0.000063,Wikipedia,0.000063
3,0.027069,2620:0:861:ed1a::1,2600:8805:3d03:3f00:88c9:1a5:bc23:ce61,TCP,74,443  >  54628 [ACK] Seq=1 Ack=118 Win=83 Len=0,0.027006,Wikipedia,0.027006
4,0.027436,2620:0:861:ed1a::1,2600:8805:3d03:3f00:88c9:1a5:bc23:ce61,TLSv1.2,113,Application Data,0.000367,Wikipedia,0.000366
5,0.027828,2620:0:861:ed1a::1,2600:8805:3d03:3f00:88c9:1a5:bc23:ce61,TCP,1514,443  >  54628 [ACK] Seq=40 Ack=118 Win=83 Len=1440 [TCP segment of a reassembled PDU],0.000392,Wikipedia,0.000392
6,0.027926,2600:8805:3d03:3f00:88c9:1a5:bc23:ce61,2620:0:861:ed1a::1,TCP,74,54628  >  443 [ACK] Seq=118 Ack=1480 Win=1029 Len=0,9.8E-05,Wikipedia,0.000098
7,0.028369,2620:0:861:ed1a::1,2600:8805:3d03:3f00:88c9:1a5:bc23:ce61,TCP,10154,"443  >  54628 [PSH, ACK] Seq=1480 Ack=118 Win=83 Len=10080 [TCP segment of a reassembled PDU]",0.000443,Wikipedia,0.000442
8,0.028489,2600:8805:3d03:3f00:88c9:1a5:bc23:ce61,2620:0:861:ed1a::1,TCP,74,54628  >  443 [ACK] Seq=118 Ack=11560 Win=1029 Len=0,0.00012,Wikipedia,0.00012
9,0.028783,2620:0:861:ed1a::1,2600:8805:3d03:3f00:88c9:1a5:bc23:ce61,TCP,2954,443  >  54628 [ACK] Seq=11560 Ack=118 Win=83 Len=2880 [TCP segment of a reassembled PDU],0.000294,Wikipedia,0.000293
10,0.028783,2620:0:861:ed1a::1,2600:8805:3d03:3f00:88c9:1a5:bc23:ce61,TLSv1.2,282,Application Data,0,Wikipedia,0
11,0.028879,2600:8805:3d03:3f00:88c9:1a5:bc23:ce61,2620:0:861:ed1a::1,TCP,74,54628  >  443 [ACK] Seq=118 Ack=14648 Win=1029 Len=0,9.6E-05,Wikipedia,0.000095
12,0.029004,2620:0:861:ed1a::1,2600:8805:3d03:3f00:88c9:1a5:bc23:ce61,TCP,2954,443  >  54628 [ACK] Seq=14648 Ack=118 Win=83 Len=2880 [TCP segment of a reassembled PDU],0.000125,Wikipedia,0.000125
13,0.029065,2600:8805:3d03:3f00:88c9:1a5:bc23:ce61,2620:0:861:ed1a::1,TCP,74,54628  >  443 [ACK] Seq=118 Ack=17528 Win=1029 Len=0,6.1E-05,Wikipedia,0.000061
14,0.030167,2620:0:861:ed1a::1,2600:8805:3d03:3f00:88c9:1a5:bc23:ce61,TCP,5834,"443  >  54628 [PSH, ACK] Seq=17528 Ack=118 Win=83 Len=5760 [TCP segment of a reassembled PDU]",0.001102,Wikipedia,0.001102
15,0.030566,2600:8805:3d03:3f00:88c9:1a5:bc23:ce61,2620:0:861:ed1a::1,TCP,74,54628  >  443 [ACK] Seq=118 Ack=23288 Win=1029 Len=0,0.000399,Wikipedia,0.000399
16,0.030762,2620:0:861:ed1a::1,2600:8805:3d03:3f00:88c9:1a5:bc23:ce61,TCP,7274,443  >  54628 [ACK] Seq=23288 Ack=118 Win=83 Len=7200 [TCP segment of a reassembled PDU],0.000196,Wikipedia,0.000196
17,0.030762,2620:0:861:ed1a::1,2600:8805:3d03:3f00:88c9:1a5:bc23:ce61,TLSv1.2,585,Application Data,0,Wikipedia,0
18,0.03092,2600:8805:3d03:3f00:88c9:1a5:bc23:ce61,2620:0:861:ed1a::1,TCP,74,54628  >  443 [ACK] Seq=118 Ack=30999 Win=1029 Len=0,0.000158,Wikipedia,0.000157
19,0.030986,2620:0:861:ed1a::1,2600:8805:3d03:3f00:88c9:1a5:bc23:ce61,TCP,4394,443  >  54628 [ACK] Seq=30999 Ack=118 Win=83 Len=4320 [TCP segment of a reassembled PDU],6.6E-05,Wikipedia,0.000066
20,0.031076,2600:8805:3d03:3f00:88c9:1a5:bc23:ce61,2620:0:861:ed1a::1,TCP,74,54628  >  443 [ACK] Seq=118 Ack=35319 Win=1029 Len=0,9E-05,Wikipedia,0.000089
21,0.031311,2620:0:861:ed1a::1,2600:8805:3d03:3f00:88c9:1a5:bc23:ce61,TCP,5834,"443  >  54628 [PSH, ACK] Seq=35319 Ack=118 Win=83 Len=5760 [TCP segment of a reassembled PDU]",0.000235,Wikipedia,0.000234
22,0.031389,2600:8805:3d03:3f00:88c9:1a5:bc23:ce61,2620:0:861:ed1a::1,TCP,74,54628  >  443 [ACK] Seq=118 Ack=41079 Win=1029 Len=0,7.8E-05,Wikipedia,0.000078
23,0.03156,2600:8805:3d03:3f00:88c9:1a5:bc23:ce61,2620:0:861:ed1a::1,TLSv1.2,109,Application Data,0.000171,Wikipedia,0.00017
24,0.032029,2620:0:861:ed1a::1,2600:8805:3d03:3f00:88c9:1a5:bc23:ce61,TCP,2954,443  >  54628 [ACK] Seq=41079 Ack=118 Win=83 Len=2880 [TCP segment of a reassembled PDU],0.000469,Wikipedia,0.000469
25,0.032113,2600:8805:3d03:3f00:88c9:1a5:bc23:ce61,2620:0:861:ed1a::1,TCP,74,54628  >  443 [ACK] Seq=153 Ack=43959 Win=1029 Len=0,8.4E-05,Wikipedia,0.000084
26,0.032727,2620:0:861:ed1a::1,2600:8805:3d03:3f00:88c9:1a5:bc23:ce61,TLSv1.2,5834,Application Data,0.000614,Wikipedia,0.000613
27,0.032806,2600:8805:3d03:3f00:88c9:1a5:bc23:ce61,2620:0:861:ed1a::1,TCP,74,54628  >  443 [ACK] Seq=153 Ack=49719 Win=1029 Len=0,7.9E-05,Wikipedia,0.000079
28,0.033639,2620:0:861:ed1a::1,2600:8805:3d03:3f00:88c9:1a5:bc23:ce61,TCP,7274,"443  >  54628 [PSH, ACK] Seq=49719 Ack=118 Win=83 Len=7200 [TCP segment of a reassembled PDU]",0.000833,Wikipedia,0.000833
29,0.033742,2600:8805:3d03:3f00:88c9:1a5:bc23:ce61,2620:0:861:ed1a::1,TCP,74,54628  >  443 [ACK] Seq=153 Ack=56919 Win=1029 Len=0,0.000103,Wikipedia,0.000102
30,0.034066,2620:0:861:ed1a::1,2600:8805:3d03:3f00:88c9:1a5:bc23:ce61,TLSv1.2,11594,Application Data,0.000324,Wikipedia,0.000323
31,0.034177,2600:8805:3d03:3f00:88c9:1a5:bc23:ce61,2620:0:861:ed1a::1,TCP,74,54628  >  443 [ACK] Seq=153 Ack=68439 Win=1029 Len=0,0.000111,Wikipedia,0.000111
32,0.03435,2620:0:861:ed1a::1,2600:8805:3d03:3f00:88c9:1a5:bc23:ce61,TCP,1514,443  >  54628 [ACK] Seq=68439 Ack=118 Win=83 Len=1440 [TCP segment of a reassembled PDU],0.000173,Wikipedia,0.000173
33,0.034397,2600:8805:3d03:3f00:88c9:1a5:bc23:ce61,2620:0:861:ed1a::1,TCP,74,54628  >  443 [ACK] Seq=153 Ack=69879 Win=1029 Len=0,4.7E-05,Wikipedia,0.000046
34,0.035147,2620:0:861:ed1a::1,2600:8805:3d03:3f00:88c9:1a5:bc23:ce61,TCP,4394,"443  >  54628 [PSH, ACK] Seq=69879 Ack=118 Win=83 Len=4320 [TCP segment of a reassembled PDU]",0.00075,Wikipedia,0.00075
35,0.035423,2600:8805:3d03:3f00:88c9:1a5:bc23:ce61,2620:0:861:ed1a::1,TCP,74,54628  >  443 [ACK] Seq=153 Ack=74199 Win=1029 Len=0,0.000276,Wikipedia,0.000276
36,0.035896,2620:0:861:ed1a::1,2600:8805:3d03:3f00:88c9:1a5:bc23:ce61,TLSv1.2,8714,Application Data,0.000473,Wikipedia,0.000472
37,0.036263,2600:8805:3d03:3f00:88c9:1a5:bc23:ce61,2620:0:861:ed1a::1,TCP,74,54628  >  443 [ACK] Seq=153 Ack=82839 Win=1029 Len=0,0.000367,Wikipedia,0.000366
38,0.037607,2620:0:861:ed1a::1,2600:8805:3d03:3f00:88c9:1a5:bc23:ce61,TCP,2954,443  >  54628 [ACK] Seq=82839 Ack=118 Win=83 Len=2880 [TCP segment of a reassembled PDU],0.001344,Wikipedia,0.001344
39,0.037984,2600:8805:3d03:3f00:88c9:1a5:bc23:ce61,2620:0:861:ed1a::1,TCP,74,54628  >  443 [ACK] Seq=153 Ack=85719 Win=1029 Len=0,0.000377,Wikipedia,0.000376
40,0.038251,2620:0:861:ed1a::1,2600:8805:3d03:3f00:88c9:1a5:bc23:ce61,TLSv1.2,15914,Application Data,0.000267,Wikipedia,0.000267
41,0.038915,2600:8805:3d03:3f00:88c9:1a5:bc23:ce61,2620:0:861:ed1a::1,TCP,74,54628  >  443 [ACK] Seq=153 Ack=101559 Win=1029 Len=0,0.000664,Wikipedia,0.000663
42,0.039163,2620:0:861:ed1a::1,2600:8805:3d03:3f00:88c9:1a5:bc23:ce61,TCP,2954,"443  >  54628 [PSH, ACK] Seq=101559 Ack=118 Win=83 Len=2880 [TCP segment of a reassembled PDU]",0.000248,Wikipedia,0.000248
43,0.039458,2600:8805:3d03:3f00:88c9:1a5:bc23:ce61,2620:0:861:ed1a::1,TCP,74,54628  >  443 [ACK] Seq=153 Ack=104439 Win=1029 Len=0,0.000295,Wikipedia,0.000294
44,0.03953,2620:0:861:ed1a::1,2600:8805:3d03:3f00:88c9:1a5:bc23:ce61,TLSv1.2,8714,Application Data,7.2E-05,Wikipedia,0.000072
45,0.039626,2600:8805:3d03:3f00:88c9:1a5:bc23:ce61,2620:0:861:ed1a::1,TCP,74,54628  >  443 [ACK] Seq=153 Ack=113079 Win=1029 Len=0,9.6E-05,Wikipedia,0.000095
46,0.039681,2620:0:861:ed1a::1,2600:8805:3d03:3f00:88c9:1a5:bc23:ce61,TCP,8714,"443  >  54628 [PSH, ACK] Seq=113079 Ack=118 Win=83 Len=8640 [TCP segment of a reassembled PDU]",5.5E-05,Wikipedia,0.000054
47,0.039857,2600:8805:3d03:3f00:88c9:1a5:bc23:ce61,2620:0:861:ed1a::1,TCP,74,54628  >  443 [ACK] Seq=153 Ack=121719 Win=1029 Len=0,0.000176,Wikipedia,0.000175
48,0.040138,2620:0:861:ed1a::1,2600:8805:3d03:3f00:88c9:1a5:bc23:ce61,TCP,1514,443  >  54628 [ACK] Seq=121719 Ack=118 Win=83 Len=1440 [TCP segment of a reassembled PDU],0.000281,Wikipedia,0.000281
49,0.040227,2600:8805:3d03:3f00:88c9:1a5:bc23:ce61,2620:0:861:ed1a::1,TCP,74,54628  >  443 [ACK] Seq=153 Ack=123159 Win=1029 Len=0,8.9E-05,Wikipedia,0.000088
50,0.040551,2620:0:861:ed1a::1,2600:8805:3d03:3f00:88c9:1a5:bc23:ce61,TLSv1.2,7274,Application Data,0.000324,Wikipedia,0.000323
51,0.040642,2600:8805:3d03:3f00:88c9:1a5:bc23:ce61,2620:0:861:ed1a::1,TCP,74,54628  >  443 [ACK] Seq=153 Ack=130359 Win=1029 Len=0,9.1E-05,Wikipedia,0.000091
52,0.040843,2620:0:861:ed1a::1,2600:8805:3d03:3f00:88c9:1a5:bc23:ce61,TCP,1514,443  >  54628 [ACK] Seq=130359 Ack=118 Win=83 Len=1440 [TCP segment of a reassembled PDU],0.000201,Wikipedia,0.000201
53,0.040904,2600:8805:3d03:3f00:88c9:1a5:bc23:ce61,2620:0:861:ed1a::1,TCP,74,54628  >  443 [ACK] Seq=153 Ack=131799 Win=1029 Len=0,6.1E-05,Wikipedia,0.000061
54,0.041845,2620:0:861:ed1a::1,2600:8805:3d03:3f00:88c9:1a5:bc23:ce61,TCP,1514,443  >  54628 [ACK] Seq=131799 Ack=118 Win=83 Len=1440 [TCP segment of a reassembled PDU],0.000941,Wikipedia,0.00094
55,0.041845,2620:0:861:ed1a::1,2600:8805:3d03:3f00:88c9:1a5:bc23:ce61,TLSv1.2,581,Application Data,0,Wikipedia,0
56,0.041935,2600:8805:3d03:3f00:88c9:1a5:bc23:ce61,2620:0:861:ed1a::1,TCP,74,54628  >  443 [ACK] Seq=153 Ack=133746 Win=1029 Len=0,9E-05,Wikipedia,0.000089
57,0.092595,2620:0:861:ed1a::1,2600:8805:3d03:3f00:88c9:1a5:bc23:ce61,TCP,74,443  >  54628 [ACK] Seq=133746 Ack=153 Win=83 Len=0,0.05066,Wikipedia,0.05066
58,0.212405,2600:8805:3d03:3f00:88c9:1a5:bc23:ce61,2620:0:861:ed1a::1,TLSv1.2,476,Application Data,0.11981,Wikipedia,0.11981
59,0.229293,2620:0:861:ed1a::1,2600:8805:3d03:3f00:88c9:1a5:bc23:ce61,TCP,74,443  >  54628 [ACK] Seq=133746 Ack=555 Win=83 Len=0,0.016888,Wikipedia,0.016888
60,0.229527,2620:0:861:ed1a::1,2600:8805:3d03:3f00:88c9:1a5:bc23:ce61,TLSv1.2,923,Application Data,0.000234,Wikipedia,0.000234
61,0.284143,2600:8805:3d03:3f00:88c9:1a5:bc23:ce61,2620:0:861:ed1a::1,TCP,74,54628  >  443 [ACK] Seq=555 Ack=134595 Win=1026 Len=0,0.054616,Wikipedia,0.054616
62,0.91119,2600:8805:3d03:3f00:88c9:1a5:bc23:ce61,2620:0:861:ed1a::1,TLSv1.2,207,Application Data,0.627047,Wikipedia,0.627047
63,0.929952,2620:0:861:ed1a::1,2600:8805:3d03:3f00:88c9:1a5:bc23:ce61,TLSv1.2,1100,Application Data,0.018762,Wikipedia,0.018761
64,0.990028,2600:8805:3d03:3f00:88c9:1a5:bc23:ce61,2620:0:861:ed1a::1,TCP,74,54628  >  443 [ACK] Seq=688 Ack=135621 Win=1029 Len=0,0.060076,Wikipedia,0.060076
65,2.72177,2600:8805:3d03:3f00:88c9:1a5:bc23:ce61,2620:0:861:ed1a::1,TLSv1.2,263,Application Data,1.731742,Wikipedia,1.731742
66,2.74126,2620:0:861:ed1a::1,2600:8805:3d03:3f00:88c9:1a5:bc23:ce61,TCP,1514,443  >  54628 [ACK] Seq=135621 Ack=877 Win=83 Len=1440 [TCP segment of a reassembled PDU],0.01949,Wikipedia,0.01949
67,2.741607,2620:0:861:ed1a::1,2600:8805:3d03:3f00:88c9:1a5:bc23:ce61,TLSv1.2,1000,Application Data,0.000347,Wikipedia,0.000347
68,2.741751,2600:8805:3d03:3f00:88c9:1a5:bc23:ce61,2620:0:861:ed1a::1,TCP,74,54628  >  443 [ACK] Seq=877 Ack=137987 Win=1029 Len=0,0.000144,Wikipedia,0.000143
69,3.026509,2600:8805:3d03:3f00:88c9:1a5:bc23:ce61,2620:0:861:ed1a::1,TLSv1.2,158,Application Data,0.284758,Wikipedia,0.284758
70,3.044292,2620:0:861:ed1a::1,2600:8805:3d03:3f00:88c9:1a5:bc23:ce61,TCP,1514,443  >  54628 [ACK] Seq=137987 Ack=961 Win=83 Len=1440 [TCP segment of a reassembled PDU],0.017783,Wikipedia,0.017783
71,3.044655,2620:0:861:ed1a::1,2600:8805:3d03:3f00:88c9:1a5:bc23:ce61,TLSv1.2,1183,Application Data,0.000363,Wikipedia,0.000363
72,3.044716,2600:8805:3d03:3f00:88c9:1a5:bc23:ce61,2620:0:861:ed1a::1,TCP,74,54628  >  443 [ACK] Seq=961 Ack=140536 Win=1029 Len=0,6.1E-05,Wikipedia,0.000061
73,4.121111,2600:8805:3d03:3f00:88c9:1a5:bc23:ce61,2620:0:861:ed1a::1,TLSv1.2,146,Application Data,1.076395,Wikipedia,1.076395
74,4.143673,2620:0:861:ed1a::1,2600:8805:3d03:3f00:88c9:1a5:bc23:ce61,TCP,1514,443  >  54628 [ACK] Seq=140536 Ack=1033 Win=83 Len=1440 [TCP segment of a reassembled PDU],0.022562,Wikipedia,0.022561
75,4.144096,2620:0:861:ed1a::1,2600:8805:3d03:3f00:88c9:1a5:bc23:ce61,TCP,1514,443  >  54628 [ACK] Seq=141976 Ack=1033 Win=83 Len=1440 [TCP segment of a reassembled PDU],0.000423,Wikipedia,0.000423
76,4.144181,2600:8805:3d03:3f00:88c9:1a5:bc23:ce61,2620:0:861:ed1a::1,TCP,74,54628  >  443 [ACK] Seq=1033 Ack=143416 Win=1029 Len=0,8.5E-05,Wikipedia,0.000084
77,4.144552,2620:0:861:ed1a::1,2600:8805:3d03:3f00:88c9:1a5:bc23:ce61,TCP,11594,"443  >  54628 [PSH, ACK] Seq=143416 Ack=1033 Win=83 Len=11520 [TCP segment of a reassembled PDU]",0.000371,Wikipedia,0.000371
78,4.144552,2620:0:861:ed1a::1,2600:8805:3d03:3f00:88c9:1a5:bc23:ce61,TLSv1.2,282,Application Data,0,Wikipedia,0
79,4.14463,2600:8805:3d03:3f00:88c9:1a5:bc23:ce61,2620:0:861:ed1a::1,TCP,74,54628  >  443 [ACK] Seq=1033 Ack=155144 Win=1029 Len=0,7.8E-05,Wikipedia,0.000078
80,4.145734,2620:0:861:ed1a::1,2600:8805:3d03:3f00:88c9:1a5:bc23:ce61,TCP,14474,"443  >  54628 [PSH, ACK] Seq=155144 Ack=1033 Win=83 Len=14400 [TCP segment of a reassembled PDU]",0.001104,Wikipedia,0.001103
81,4.145862,2600:8805:3d03:3f00:88c9:1a5:bc23:ce61,2620:0:861:ed1a::1,TCP,74,54628  >  443 [ACK] Seq=1033 Ack=169544 Win=1029 Len=0,0.000128,Wikipedia,0.000128
82,4.146424,2620:0:861:ed1a::1,2600:8805:3d03:3f00:88c9:1a5:bc23:ce61,TLSv1.2,14474,Application Data,0.000562,Wikipedia,0.000561
83,4.146502,2600:8805:3d03:3f00:88c9:1a5:bc23:ce61,2620:0:861:ed1a::1,TCP,74,54628  >  443 [ACK] Seq=1033 Ack=183944 Win=1029 Len=0,7.8E-05,Wikipedia,0.000078
84,4.147234,2620:0:861:ed1a::1,2600:8805:3d03:3f00:88c9:1a5:bc23:ce61,TLSv1.2,14474,Application Data,0.000732,Wikipedia,0.000732
85,4.147312,2600:8805:3d03:3f00:88c9:1a5:bc23:ce61,2620:0:861:ed1a::1,TCP,74,54628  >  443 [ACK] Seq=1033 Ack=198344 Win=1029 Len=0,7.8E-05,Wikipedia,0.000078
86,4.147685,2620:0:861:ed1a::1,2600:8805:3d03:3f00:88c9:1a5:bc23:ce61,TLSv1.2,7274,Application Data,0.000373,Wikipedia,0.000372
87,4.14773,2600:8805:3d03:3f00:88c9:1a5:bc23:ce61,2620:0:861:ed1a::1,TCP,74,54628  >  443 [ACK] Seq=1033 Ack=205544 Win=1029 Len=0,4.5E-05,Wikipedia,0.000045
88,4.148454,2620:0:861:ed1a::1,2600:8805:3d03:3f00:88c9:1a5:bc23:ce61,TCP,10154,"443  >  54628 [PSH, ACK] Seq=205544 Ack=1033 Win=83 Len=10080 [TCP segment of a reassembled PDU]",0.000724,Wikipedia,0.000723
89,4.148518,2600:8805:3d03:3f00:88c9:1a5:bc23:ce61,2620:0:861:ed1a::1,TCP,74,54628  >  443 [ACK] Seq=1033 Ack=215624 Win=1029 Len=0,6.4E-05,Wikipedia,0.000064
90,4.148829,2620:0:861:ed1a::1,2600:8805:3d03:3f00:88c9:1a5:bc23:ce61,TLSv1.2,11594,Application Data,0.000311,Wikipedia,0.00031
91,4.148886,2600:8805:3d03:3f00:88c9:1a5:bc23:ce61,2620:0:861:ed1a::1,TCP,74,54628  >  443 [ACK] Seq=1033 Ack=227144 Win=1029 Len=0,5.7E-05,Wikipedia,0.000056
92,4.149214,2620:0:861:ed1a::1,2600:8805:3d03:3f00:88c9:1a5:bc23:ce61,TCP,5834,443  >  54628 [ACK] Seq=227144 Ack=1033 Win=83 Len=5760 [TCP segment of a reassembled PDU],0.000328,Wikipedia,0.000327
93,4.149254,2600:8805:3d03:3f00:88c9:1a5:bc23:ce61,2620:0:861:ed1a::1,TCP,74,54628  >  443 [ACK] Seq=1033 Ack=232904 Win=1029 Len=0,4E-05,Wikipedia,0.00004
94,4.149945,2620:0:861:ed1a::1,2600:8805:3d03:3f00:88c9:1a5:bc23:ce61,TLSv1.2,8714,Application Data,0.000691,Wikipedia,0.00069
95,4.150015,2600:8805:3d03:3f00:88c9:1a5:bc23:ce61,2620:0:861:ed1a::1,TCP,74,54628  >  443 [ACK] Seq=1033 Ack=241544 Win=1029 Len=0,7E-05,Wikipedia,0.00007
96,4.150281,2620:0:861:ed1a::1,2600:8805:3d03:3f00:88c9:1a5:bc23:ce61,TCP,2954,443  >  54628 [ACK] Seq=241544 Ack=1033 Win=83 Len=2880 [TCP segment of a reassembled PDU],0.000266,Wikipedia,0.000265
97,4.150335,2600:8805:3d03:3f00:88c9:1a5:bc23:ce61,2620:0:861:ed1a::1,TCP,74,54628  >  443 [ACK] Seq=1033 Ack=244424 Win=1029 Len=0,5.4E-05,Wikipedia,0.000054
98,4.151341,2620:0:861:ed1a::1,2600:8805:3d03:3f00:88c9:1a5:bc23:ce61,TLSv1.2,11594,Application Data,0.001006,Wikipedia,0.001006
99,4.151437,2600:8805:3d03:3f00:88c9:1a5:bc23:ce61,2620:0:861:ed1a::1,TCP,74,54628  >  443 [ACK] Seq=1033 Ack=255944 Win=1029 Len=0,9.6E-05,Wikipedia,0.000095
100,4.151761,2620:0:861:ed1a::1,2600:8805:3d03:3f00:88c9:1a5:bc23:ce61,TCP,10154,"443  >  54628 [PSH, ACK] Seq=255944 Ack=1033 Win=83 Len=10080 [TCP segment of a reassembled PDU]",0.000324,Wikipedia,0.000323
101,4.151834,2600:8805:3d03:3f00:88c9:1a5:bc23:ce61,2620:0:861:ed1a::1,TCP,74,54628  >  443 [ACK] Seq=1033 Ack=266024 Win=1029 Len=0,7.3E-05,Wikipedia,0.000073
102,4.15244,2620:0:861:ed1a::1,2600:8805:3d03:3f00:88c9:1a5:bc23:ce61,TLSv1.2,11594,Application Data,0.000606,Wikipedia,0.000606
103,4.15262,2600:8805:3d03:3f00:88c9:1a5:bc23:ce61,2620:0:861:ed1a::1,TCP,74,54628  >  443 [ACK] Seq=1033 Ack=277544 Win=1029 Len=0,0.00018,Wikipedia,0.000179
104,4.15309,2620:0:861:ed1a::1,2600:8805:3d03:3f00:88c9:1a5:bc23:ce61,TCP,2954,443  >  54628 [ACK] Seq=277544 Ack=1033 Win=83 Len=2880 [TCP segment of a reassembled PDU],0.00047,Wikipedia,0.000469
105,4.153127,2600:8805:3d03:3f00:88c9:1a5:bc23:ce61,2620:0:861:ed1a::1,TCP,74,54628  >  443 [ACK] Seq=1033 Ack=280424 Win=1029 Len=0,3.7E-05,Wikipedia,0.000036
106,4.15482,2620:0:861:ed1a::1,2600:8805:3d03:3f00:88c9:1a5:bc23:ce61,TLSv1.2,14474,Application Data,0.001693,Wikipedia,0.001693
107,4.154888,2600:8805:3d03:3f00:88c9:1a5:bc23:ce61,2620:0:861:ed1a::1,TCP,74,54628  >  443 [ACK] Seq=1033 Ack=294824 Win=1029 Len=0,6.8E-05,Wikipedia,0.000067
108,4.155548,2620:0:861:ed1a::1,2600:8805:3d03:3f00:88c9:1a5:bc23:ce61,TLSv1.2,27434,"Application Data, Application Data",0.00066,Wikipedia,0.000659
109,4.15571,2600:8805:3d03:3f00:88c9:1a5:bc23:ce61,2620:0:861:ed1a::1,TCP,74,54628  >  443 [ACK] Seq=1033 Ack=322184 Win=1029 Len=0,0.000162,Wikipedia,0.000162
110,4.156192,2620:0:861:ed1a::1,2600:8805:3d03:3f00:88c9:1a5:bc23:ce61,TLSv1.2,13034,Application Data,0.000482,Wikipedia,0.000481
111,4.156265,2600:8805:3d03:3f00:88c9:1a5:bc23:ce61,2620:0:861:ed1a::1,TCP,74,54628  >  443 [ACK] Seq=1033 Ack=335144 Win=1029 Len=0,7.3E-05,Wikipedia,0.000073
112,4.157615,2620:0:861:ed1a::1,2600:8805:3d03:3f00:88c9:1a5:bc23:ce61,TCP,1514,443  >  54628 [ACK] Seq=335144 Ack=1033 Win=83 Len=1440 [TCP segment of a reassembled PDU],0.00135,Wikipedia,0.001349
113,4.159527,2620:0:861:ed1a::1,2600:8805:3d03:3f00:88c9:1a5:bc23:ce61,TLSv1.2,24554,Application Data,0.001912,Wikipedia,0.001911
114,4.159785,2600:8805:3d03:3f00:88c9:1a5:bc23:ce61,2620:0:861:ed1a::1,TCP,74,54628  >  443 [ACK] Seq=1033 Ack=361064 Win=1029 Len=0,0.000258,Wikipedia,0.000258
115,4.159871,2620:0:861:ed1a::1,2600:8805:3d03:3f00:88c9:1a5:bc23:ce61,TCP,1514,443  >  54628 [ACK] Seq=361064 Ack=1033 Win=83 Len=1440 [TCP segment of a reassembled PDU],8.6E-05,Wikipedia,0.000085
116,4.159871,2620:0:861:ed1a::1,2600:8805:3d03:3f00:88c9:1a5:bc23:ce61,TLSv1.2,1004,Application Data,0,Wikipedia,0
117,4.159941,2600:8805:3d03:3f00:88c9:1a5:bc23:ce61,2620:0:861:ed1a::1,TCP,74,54628  >  443 [ACK] Seq=1033 Ack=363434 Win=1029 Len=0,7E-05,Wikipedia,0.00007
118,4.213182,2600:8805:3d03:3f00:88c9:1a5:bc23:ce61,2620:0:861:ed1a::1,TLSv1.2,417,Application Data,0.053241,Wikipedia,0.05324
119,4.231616,2620:0:861:ed1a::1,2600:8805:3d03:3f00:88c9:1a5:bc23:ce61,TCP,1514,443  >  54628 [ACK] Seq=363434 Ack=1376 Win=83 Len=1440 [TCP segment of a reassembled PDU],0.018434,Wikipedia,0.018434
120,4.23246,2620:0:861:ed1a::1,2600:8805:3d03:3f00:88c9:1a5:bc23:ce61,TCP,7274,443  >  54628 [ACK] Seq=364874 Ack=1376 Win=83 Len=7200 [TCP segment of a reassembled PDU],0.000844,Wikipedia,0.000843
121,4.232808,2600:8805:3d03:3f00:88c9:1a5:bc23:ce61,2620:0:861:ed1a::1,TCP,74,54628  >  443 [ACK] Seq=1376 Ack=372074 Win=1029 Len=0,0.000348,Wikipedia,0.000348
122,4.233028,2620:0:861:ed1a::1,2600:8805:3d03:3f00:88c9:1a5:bc23:ce61,TCP,5834,443  >  54628 [ACK] Seq=372074 Ack=1376 Win=83 Len=5760 [TCP segment of a reassembled PDU],0.00022,Wikipedia,0.000219
123,4.233028,2620:0:861:ed1a::1,2600:8805:3d03:3f00:88c9:1a5:bc23:ce61,TLSv1.2,344,Application Data,0,Wikipedia,0
124,4.233028,2620:0:861:ed1a::1,2600:8805:3d03:3f00:88c9:1a5:bc23:ce61,TCP,4394,443  >  54628 [ACK] Seq=378104 Ack=1376 Win=83 Len=4320 [TCP segment of a reassembled PDU],0,Wikipedia,0
125,4.233028,2620:0:861:ed1a::1,2600:8805:3d03:3f00:88c9:1a5:bc23:ce61,TLSv1.2,987,Application Data,0,Wikipedia,0
126,4.233642,2600:8805:3d03:3f00:88c9:1a5:bc23:ce61,2620:0:861:ed1a::1,TCP,74,54628  >  443 [ACK] Seq=1376 Ack=383337 Win=1029 Len=0,0.000614,Wikipedia,0.000613
127,4.985964,2600:8805:3d03:3f00:88c9:1a5:bc23:ce61,2620:0:861:ed1a::1,TLSv1.2,184,Application Data,0.752322,Wikipedia,0.752322
128,5.008767,2620:0:861:ed1a::1,2600:8805:3d03:3f00:88c9:1a5:bc23:ce61,TLSv1.2,1100,Application Data,0.022803,Wikipedia,0.022802
129,5.055705,2600:8805:3d03:3f00:88c9:1a5:bc23:ce61,2620:0:861:ed1a::1,TCP,74,54628  >  443 [ACK] Seq=1486 Ack=384363 Win=1025 Len=0,0.046938,Wikipedia,0.046937
130,6.004702,2600:8805:3d03:3f00:88c9:1a5:bc23:ce61,2620:0:861:ed1a::1,TLSv1.2,249,Application Data,0.948997,Wikipedia,0.948997
131,6.004887,2600:8805:3d03:3f00:88c9:1a5:bc23:ce61,2620:0:861:ed1a::1,TLSv1.2,218,Application Data,0.000185,Wikipedia,0.000185
132,6.024443,2620:0:861:ed1a::1,2600:8805:3d03:3f00:88c9:1a5:bc23:ce61,TCP,1514,443  >  54628 [ACK] Seq=384363 Ack=1661 Win=83 Len=1440 [TCP segment of a reassembled PDU],0.019556,Wikipedia,0.019555
133,6.024538,2600:8805:3d03:3f00:88c9:1a5:bc23:ce61,2620:0:861:ed1a::1,TCP,74,54628  >  443 [ACK] Seq=1805 Ack=385803 Win=1029 Len=0,9.5E-05,Wikipedia,0.000094
134,6.025033,2620:0:861:ed1a::1,2600:8805:3d03:3f00:88c9:1a5:bc23:ce61,TCP,13034,443  >  54628 [ACK] Seq=385803 Ack=1661 Win=83 Len=12960 [TCP segment of a reassembled PDU],0.000495,Wikipedia,0.000494
135,6.025033,2620:0:861:ed1a::1,2600:8805:3d03:3f00:88c9:1a5:bc23:ce61,TLSv1.2,373,Application Data,0,Wikipedia,0
136,6.025033,2620:0:861:ed1a::1,2600:8805:3d03:3f00:88c9:1a5:bc23:ce61,TCP,14474,443  >  54628 [ACK] Seq=399062 Ack=1661 Win=83 Len=14400 [TCP segment of a reassembled PDU],0,Wikipedia,0
137,6.025208,2600:8805:3d03:3f00:88c9:1a5:bc23:ce61,2620:0:861:ed1a::1,TCP,74,54628  >  443 [ACK] Seq=1805 Ack=413462 Win=1029 Len=0,0.000175,Wikipedia,0.000175
138,6.02551,2620:0:861:ed1a::1,2600:8805:3d03:3f00:88c9:1a5:bc23:ce61,TCP,1514,443  >  54628 [ACK] Seq=413462 Ack=1661 Win=83 Len=1440 [TCP segment of a reassembled PDU],0.000302,Wikipedia,0.000301
139,6.02551,2620:0:861:ed1a::1,2600:8805:3d03:3f00:88c9:1a5:bc23:ce61,TLSv1.2,585,Application Data,0,Wikipedia,0
140,6.02551,2620:0:861:ed1a::1,2600:8805:3d03:3f00:88c9:1a5:bc23:ce61,TCP,11594,443  >  54628 [ACK] Seq=415413 Ack=1661 Win=83 Len=11520 [TCP segment of a reassembled PDU],0,Wikipedia,0
141,6.02551,2620:0:861:ed1a::1,2600:8805:3d03:3f00:88c9:1a5:bc23:ce61,TLSv1.2,1061,Application Data,0,Wikipedia,0
142,6.02551,2620:0:861:ed1a::1,2600:8805:3d03:3f00:88c9:1a5:bc23:ce61,TCP,14474,443  >  54628 [ACK] Seq=427920 Ack=1805 Win=83 Len=14400 [TCP segment of a reassembled PDU],0,Wikipedia,0
143,6.02551,2620:0:861:ed1a::1,2600:8805:3d03:3f00:88c9:1a5:bc23:ce61,TLSv1.2,373,Application Data,0,Wikipedia,0
144,6.02551,2620:0:861:ed1a::1,2600:8805:3d03:3f00:88c9:1a5:bc23:ce61,TCP,15914,443  >  54628 [ACK] Seq=442619 Ack=1805 Win=83 Len=15840 [TCP segment of a reassembled PDU],0,Wikipedia,0
145,6.02551,2620:0:861:ed1a::1,2600:8805:3d03:3f00:88c9:1a5:bc23:ce61,TLSv1.2,585,Application Data,0,Wikipedia,0
146,6.02551,2620:0:861:ed1a::1,2600:8805:3d03:3f00:88c9:1a5:bc23:ce61,TCP,1514,443  >  54628 [ACK] Seq=458970 Ack=1805 Win=83 Len=1440 [TCP segment of a reassembled PDU],0,Wikipedia,0
147,6.025871,2600:8805:3d03:3f00:88c9:1a5:bc23:ce61,2620:0:861:ed1a::1,TCP,74,54628  >  443 [ACK] Seq=1805 Ack=460410 Win=1029 Len=0,0.000361,Wikipedia,0.000361
148,6.026164,2600:8805:3d03:3f00:88c9:1a5:bc23:ce61,2620:0:861:ed1a::1,TLSv1.2,109,Application Data,0.000293,Wikipedia,0.000292
149,6.026359,2620:0:861:ed1a::1,2600:8805:3d03:3f00:88c9:1a5:bc23:ce61,TCP,14474,443  >  54628 [ACK] Seq=460410 Ack=1805 Win=83 Len=14400 [TCP segment of a reassembled PDU],0.000195,Wikipedia,0.000195
150,6.026359,2620:0:861:ed1a::1,2600:8805:3d03:3f00:88c9:1a5:bc23:ce61,TLSv1.2,585,Application Data,0,Wikipedia,0
151,6.026359,2620:0:861:ed1a::1,2600:8805:3d03:3f00:88c9:1a5:bc23:ce61,TCP,15914,443  >  54628 [ACK] Seq=475321 Ack=1805 Win=83 Len=15840 [TCP segment of a reassembled PDU],0,Wikipedia,0
152,6.026574,2600:8805:3d03:3f00:88c9:1a5:bc23:ce61,2620:0:861:ed1a::1,TCP,74,54628  >  443 [ACK] Seq=1840 Ack=491161 Win=1029 Len=0,0.000215,Wikipedia,0.000214
153,6.026684,2620:0:861:ed1a::1,2600:8805:3d03:3f00:88c9:1a5:bc23:ce61,TLSv1.2,4394,Application Data,0.00011,Wikipedia,0.00011
154,6.026684,2620:0:861:ed1a::1,2600:8805:3d03:3f00:88c9:1a5:bc23:ce61,TLSv1.2,1110,Application Data,0,Wikipedia,0
155,6.026771,2600:8805:3d03:3f00:88c9:1a5:bc23:ce61,2620:0:861:ed1a::1,TCP,74,54628  >  443 [ACK] Seq=1840 Ack=496517 Win=1029 Len=0,8.7E-05,Wikipedia,0.000086
156,6.084643,2620:0:861:ed1a::1,2600:8805:3d03:3f00:88c9:1a5:bc23:ce61,TCP,74,443  >  54628 [ACK] Seq=496517 Ack=1840 Win=83 Len=0,0.057872,Wikipedia,0.057871
157,9.509904,2600:8805:3d03:3f00:88c9:1a5:bc23:ce61,2620:0:861:ed1a::1,TLSv1.2,252,Application Data,3.425261,Wikipedia,3.425261
158,9.531953,2620:0:861:ed1a::1,2600:8805:3d03:3f00:88c9:1a5:bc23:ce61,TCP,74,443  >  54628 [ACK] Seq=496517 Ack=2018 Win=83 Len=0,0.022049,Wikipedia,0.022048
159,9.611004,2620:0:861:ed1a::1,2600:8805:3d03:3f00:88c9:1a5:bc23:ce61,TLSv1.2,983,Application Data,0.079051,Wikipedia,0.07905
160,9.64087,2600:8805:3d03:3f00:88c9:1a5:bc23:ce61,2620:0:861:ed1a::1,TLSv1.2,173,Application Data,0.029866,Wikipedia,0.029866
161,9.660646,2620:0:861:ed1a::1,2600:8805:3d03:3f00:88c9:1a5:bc23:ce61,TCP,74,443  >  54628 [ACK] Seq=497426 Ack=2117 Win=83 Len=0,0.019776,Wikipedia,0.019776
162,9.660646,2620:0:861:ed1a::1,2600:8805:3d03:3f00:88c9:1a5:bc23:ce61,TCP,1514,443  >  54628 [ACK] Seq=497426 Ack=2117 Win=83 Len=1440 [TCP segment of a reassembled PDU],0,Wikipedia,0
163,9.660646,2620:0:861:ed1a::1,2600:8805:3d03:3f00:88c9:1a5:bc23:ce61,TLSv1.2,302,Application Data,0,Wikipedia,0
164,9.66086,2600:8805:3d03:3f00:88c9:1a5:bc23:ce61,2620:0:861:ed1a::1,TCP,74,54628  >  443 [ACK] Seq=2117 Ack=499094 Win=1029 Len=0,0.000214,Wikipedia,0.000213
165,9.999368,2600:8805:3d03:3f00:88c9:1a5:bc23:ce61,2620:0:861:ed1a::1,TLSv1.2,162,Application Data,0.338508,Wikipedia,0.338508
166,10.018133,2620:0:861:ed1a::1,2600:8805:3d03:3f00:88c9:1a5:bc23:ce61,TCP,1514,443  >  54628 [ACK] Seq=499094 Ack=2205 Win=83 Len=1440 [TCP segment of a reassembled PDU],0.018765,Wikipedia,0.018765
167,10.018601,2620:0:861:ed1a::1,2600:8805:3d03:3f00:88c9:1a5:bc23:ce61,TLSv1.2,515,Application Data,0.000468,Wikipedia,0.000467
168,10.018915,2600:8805:3d03:3f00:88c9:1a5:bc23:ce61,2620:0:861:ed1a::1,TCP,74,54628  >  443 [ACK] Seq=2205 Ack=500975 Win=1029 Len=0,0.000314,Wikipedia,0.000313
169,10.166348,2600:8805:3d03:3f00:88c9:1a5:bc23:ce61,2620:0:861:ed1a::1,TLSv1.2,163,Application Data,0.147433,Wikipedia,0.147432
170,10.184411,2620:0:861:ed1a::1,2600:8805:3d03:3f00:88c9:1a5:bc23:ce61,TCP,1514,443  >  54628 [ACK] Seq=500975 Ack=2294 Win=83 Len=1440 [TCP segment of a reassembled PDU],0.018063,Wikipedia,0.018063
171,10.184715,2620:0:861:ed1a::1,2600:8805:3d03:3f00:88c9:1a5:bc23:ce61,TLSv1.2,484,Application Data,0.000304,Wikipedia,0.000303
172,10.184802,2600:8805:3d03:3f00:88c9:1a5:bc23:ce61,2620:0:861:ed1a::1,TCP,74,54628  >  443 [ACK] Seq=2294 Ack=502825 Win=1029 Len=0,8.7E-05,Wikipedia,0.000086
173,10.370937,2600:8805:3d03:3f00:88c9:1a5:bc23:ce61,2620:0:861:ed1a::1,TLSv1.2,163,Application Data,0.186135,Wikipedia,0.186135
174,10.388199,2620:0:861:ed1a::1,2600:8805:3d03:3f00:88c9:1a5:bc23:ce61,TCP,1514,443  >  54628 [ACK] Seq=502825 Ack=2383 Win=83 Len=1440 [TCP segment of a reassembled PDU],0.017262,Wikipedia,0.017262
175,10.388199,2620:0:861:ed1a::1,2600:8805:3d03:3f00:88c9:1a5:bc23:ce61,TLSv1.2,413,Application Data,0,Wikipedia,0
176,10.388521,2600:8805:3d03:3f00:88c9:1a5:bc23:ce61,2620:0:861:ed1a::1,TCP,74,54628  >  443 [ACK] Seq=2383 Ack=504604 Win=1029 Len=0,0.000322,Wikipedia,0.000322
177,11.334274,2600:8805:3d03:3f00:88c9:1a5:bc23:ce61,2620:0:861:ed1a::1,TLSv1.2,164,Application Data,0.945753,Wikipedia,0.945753
178,11.358098,2620:0:861:ed1a::1,2600:8805:3d03:3f00:88c9:1a5:bc23:ce61,TCP,1514,443  >  54628 [ACK] Seq=504604 Ack=2473 Win=83 Len=1440 [TCP segment of a reassembled PDU],0.023824,Wikipedia,0.023823
179,11.358846,2620:0:861:ed1a::1,2600:8805:3d03:3f00:88c9:1a5:bc23:ce61,TLSv1.2,452,Application Data,0.000748,Wikipedia,0.000747
180,11.35892,2600:8805:3d03:3f00:88c9:1a5:bc23:ce61,2620:0:861:ed1a::1,TCP,74,54628  >  443 [ACK] Seq=2473 Ack=506422 Win=1029 Len=0,7.4E-05,Wikipedia,0.000073
181,11.359626,2600:8805:3d03:3f00:88c9:1a5:bc23:ce61,2620:0:861:ed1a::1,TLSv1.2,109,Application Data,0.000706,Wikipedia,0.000706
182,11.420479,2620:0:861:ed1a::1,2600:8805:3d03:3f00:88c9:1a5:bc23:ce61,TCP,74,443  >  54628 [ACK] Seq=506422 Ack=2508 Win=83 Len=0,0.060853,Wikipedia,0.060852
183,11.579601,2600:8805:3d03:3f00:88c9:1a5:bc23:ce61,2620:0:861:ed1a::1,TLSv1.2,165,Application Data,0.159122,Wikipedia,0.159122
184,11.597299,2620:0:861:ed1a::1,2600:8805:3d03:3f00:88c9:1a5:bc23:ce61,TCP,74,443  >  54628 [ACK] Seq=506422 Ack=2599 Win=83 Len=0,0.017698,Wikipedia,0.017697
185,11.59774,2620:0:861:ed1a::1,2600:8805:3d03:3f00:88c9:1a5:bc23:ce61,TCP,1514,443  >  54628 [ACK] Seq=506422 Ack=2599 Win=83 Len=1440 [TCP segment of a reassembled PDU],0.000441,Wikipedia,0.000441
186,11.59774,2620:0:861:ed1a::1,2600:8805:3d03:3f00:88c9:1a5:bc23:ce61,TLSv1.2,380,Application Data,0,Wikipedia,0
187,11.598005,2600:8805:3d03:3f00:88c9:1a5:bc23:ce61,2620:0:861:ed1a::1,TCP,74,54628  >  443 [ACK] Seq=2599 Ack=508168 Win=1029 Len=0,0.000265,Wikipedia,0.000265
188,11.798829,2600:8805:3d03:3f00:88c9:1a5:bc23:ce61,2620:0:861:ed1a::1,TLSv1.2,166,Application Data,0.200824,Wikipedia,0.200823
189,11.857494,2620:0:861:ed1a::1,2600:8805:3d03:3f00:88c9:1a5:bc23:ce61,TCP,74,443  >  54628 [ACK] Seq=508168 Ack=2691 Win=83 Len=0,0.058665,Wikipedia,0.058665
190,11.953329,2620:0:861:ed1a::1,2600:8805:3d03:3f00:88c9:1a5:bc23:ce61,TCP,1514,443  >  54628 [ACK] Seq=508168 Ack=2691 Win=83 Len=1440 [TCP segment of a reassembled PDU],0.095835,Wikipedia,0.095834
191,11.953329,2620:0:861:ed1a::1,2600:8805:3d03:3f00:88c9:1a5:bc23:ce61,TLSv1.2,367,Application Data,0,Wikipedia,0
192,11.953457,2600:8805:3d03:3f00:88c9:1a5:bc23:ce61,2620:0:861:ed1a::1,TCP,74,54628  >  443 [ACK] Seq=2691 Ack=509901 Win=1029 Len=0,0.000128,Wikipedia,0.000128
193,11.954779,2600:8805:3d03:3f00:88c9:1a5:bc23:ce61,2620:0:861:ed1a::1,TLSv1.2,167,Application Data,0.001322,Wikipedia,0.001322
194,11.974141,2620:0:861:ed1a::1,2600:8805:3d03:3f00:88c9:1a5:bc23:ce61,TCP,74,443  >  54628 [ACK] Seq=509901 Ack=2784 Win=83 Len=0,0.019362,Wikipedia,0.019361
195,12.081043,2620:0:861:ed1a::1,2600:8805:3d03:3f00:88c9:1a5:bc23:ce61,TCP,1514,443  >  54628 [ACK] Seq=509901 Ack=2784 Win=83 Len=1440 [TCP segment of a reassembled PDU],0.106902,Wikipedia,0.106902
196,12.081043,2620:0:861:ed1a::1,2600:8805:3d03:3f00:88c9:1a5:bc23:ce61,TLSv1.2,404,Application Data,0,Wikipedia,0
197,12.081149,2600:8805:3d03:3f00:88c9:1a5:bc23:ce61,2620:0:861:ed1a::1,TCP,74,54628  >  443 [ACK] Seq=2784 Ack=511671 Win=1029 Len=0,0.000106,Wikipedia,0.000106
198,12.7017,2600:8805:3d03:3f00:88c9:1a5:bc23:ce61,2620:0:861:ed1a::1,TLSv1.2,165,Application Data,0.620551,Wikipedia,0.620551
199,12.720548,2620:0:861:ed1a::1,2600:8805:3d03:3f00:88c9:1a5:bc23:ce61,TCP,74,443  >  54628 [ACK] Seq=511671 Ack=2875 Win=83 Len=0,0.018848,Wikipedia,0.018848
200,12.720841,2620:0:861:ed1a::1,2600:8805:3d03:3f00:88c9:1a5:bc23:ce61,TCP,1514,443  >  54628 [ACK] Seq=511671 Ack=2875 Win=83 Len=1440 [TCP segment of a reassembled PDU],0.000293,Wikipedia,0.000292
201,12.720841,2620:0:861:ed1a::1,2600:8805:3d03:3f00:88c9:1a5:bc23:ce61,TLSv1.2,396,Application Data,0,Wikipedia,0
202,12.721009,2600:8805:3d03:3f00:88c9:1a5:bc23:ce61,2620:0:861:ed1a::1,TCP,74,54628  >  443 [ACK] Seq=2875 Ack=513433 Win=1029 Len=0,0.000168,Wikipedia,0.000168
203,13.385273,2600:8805:3d03:3f00:88c9:1a5:bc23:ce61,2620:0:861:ed1a::1,TLSv1.2,166,Application Data,0.664264,Wikipedia,0.664263
204,13.404894,2620:0:861:ed1a::1,2600:8805:3d03:3f00:88c9:1a5:bc23:ce61,TCP,1514,443  >  54628 [ACK] Seq=513433 Ack=2967 Win=83 Len=1440 [TCP segment of a reassembled PDU],0.019621,Wikipedia,0.019621
205,13.404894,2620:0:861:ed1a::1,2600:8805:3d03:3f00:88c9:1a5:bc23:ce61,TLSv1.2,320,Application Data,0,Wikipedia,0
206,13.405325,2600:8805:3d03:3f00:88c9:1a5:bc23:ce61,2620:0:861:ed1a::1,TCP,74,54628  >  443 [ACK] Seq=2967 Ack=515119 Win=1029 Len=0,0.000431,Wikipedia,0.00043
207,14.125841,2600:8805:3d03:3f00:88c9:1a5:bc23:ce61,2620:0:861:ed1a::1,TLSv1.2,185,Application Data,0.720516,Wikipedia,0.720516
208,14.179664,2620:0:861:ed1a::1,2600:8805:3d03:3f00:88c9:1a5:bc23:ce61,TLSv1.2,1039,Application Data,0.053823,Wikipedia,0.053823
209,14.182626,2600:8805:3d03:3f00:88c9:1a5:bc23:ce61,2620:0:861:ed1a::1,TLSv1.2,178,Application Data,0.002962,Wikipedia,0.002962
210,14.24851,2620:0:861:ed1a::1,2600:8805:3d03:3f00:88c9:1a5:bc23:ce61,TCP,74,443  >  54628 [ACK] Seq=516084 Ack=3182 Win=83 Len=0,0.065884,Wikipedia,0.065883
211,14.266878,2620:0:861:ed1a::1,2600:8805:3d03:3f00:88c9:1a5:bc23:ce61,TLSv1.2,1010,Application Data,0.018368,Wikipedia,0.018368
212,14.270215,2600:8805:3d03:3f00:88c9:1a5:bc23:ce61,2620:0:861:ed1a::1,TLSv1.2,149,Application Data,0.003337,Wikipedia,0.003337
213,14.287007,2620:0:861:ed1a::1,2600:8805:3d03:3f00:88c9:1a5:bc23:ce61,TCP,74,443  >  54628 [ACK] Seq=517020 Ack=3257 Win=83 Len=0,0.016792,Wikipedia,0.016791
214,14.287502,2620:0:861:ed1a::1,2600:8805:3d03:3f00:88c9:1a5:bc23:ce61,TCP,1514,443  >  54628 [ACK] Seq=517020 Ack=3257 Win=83 Len=1440 [TCP segment of a reassembled PDU],0.000495,Wikipedia,0.000495
215,14.287992,2620:0:861:ed1a::1,2600:8805:3d03:3f00:88c9:1a5:bc23:ce61,TCP,1514,443  >  54628 [ACK] Seq=518460 Ack=3257 Win=83 Len=1440 [TCP segment of a reassembled PDU],0.00049,Wikipedia,0.000489
216,14.288038,2600:8805:3d03:3f00:88c9:1a5:bc23:ce61,2620:0:861:ed1a::1,TCP,74,54628  >  443 [ACK] Seq=3257 Ack=519900 Win=1029 Len=0,4.6E-05,Wikipedia,0.000046
217,14.288516,2620:0:861:ed1a::1,2600:8805:3d03:3f00:88c9:1a5:bc23:ce61,TCP,11594,443  >  54628 [ACK] Seq=519900 Ack=3257 Win=83 Len=11520 [TCP segment of a reassembled PDU],0.000478,Wikipedia,0.000477
218,14.288516,2620:0:861:ed1a::1,2600:8805:3d03:3f00:88c9:1a5:bc23:ce61,TLSv1.2,283,Application Data,0,Wikipedia,0
219,14.288516,2620:0:861:ed1a::1,2600:8805:3d03:3f00:88c9:1a5:bc23:ce61,TCP,2954,443  >  54628 [ACK] Seq=531629 Ack=3257 Win=83 Len=2880 [TCP segment of a reassembled PDU],0,Wikipedia,0
220,14.288656,2600:8805:3d03:3f00:88c9:1a5:bc23:ce61,2620:0:861:ed1a::1,TCP,74,54628  >  443 [ACK] Seq=3257 Ack=534509 Win=1029 Len=0,0.00014,Wikipedia,0.00014
221,14.288972,2620:0:861:ed1a::1,2600:8805:3d03:3f00:88c9:1a5:bc23:ce61,TCP,13034,443  >  54628 [ACK] Seq=534509 Ack=3257 Win=83 Len=12960 [TCP segment of a reassembled PDU],0.000316,Wikipedia,0.000315
222,14.288972,2620:0:861:ed1a::1,2600:8805:3d03:3f00:88c9:1a5:bc23:ce61,TLSv1.2,585,Application Data,0,Wikipedia,0
223,14.288972,2620:0:861:ed1a::1,2600:8805:3d03:3f00:88c9:1a5:bc23:ce61,TCP,1514,443  >  54628 [ACK] Seq=547980 Ack=3257 Win=83 Len=1440 [TCP segment of a reassembled PDU],0,Wikipedia,0
224,14.289098,2600:8805:3d03:3f00:88c9:1a5:bc23:ce61,2620:0:861:ed1a::1,TCP,74,54628  >  443 [ACK] Seq=3257 Ack=549420 Win=1029 Len=0,0.000126,Wikipedia,0.000125
225,14.28999,2620:0:861:ed1a::1,2600:8805:3d03:3f00:88c9:1a5:bc23:ce61,TCP,14474,443  >  54628 [ACK] Seq=549420 Ack=3257 Win=83 Len=14400 [TCP segment of a reassembled PDU],0.000892,Wikipedia,0.000892
226,14.28999,2620:0:861:ed1a::1,2600:8805:3d03:3f00:88c9:1a5:bc23:ce61,TLSv1.2,585,Application Data,0,Wikipedia,0
227,14.290131,2600:8805:3d03:3f00:88c9:1a5:bc23:ce61,2620:0:861:ed1a::1,TCP,74,54628  >  443 [ACK] Seq=3257 Ack=564331 Win=1029 Len=0,0.000141,Wikipedia,0.000141
228,14.290625,2620:0:861:ed1a::1,2600:8805:3d03:3f00:88c9:1a5:bc23:ce61,TLSv1.2,25994,Application Data,0.000494,Wikipedia,0.000493
229,14.29077,2600:8805:3d03:3f00:88c9:1a5:bc23:ce61,2620:0:861:ed1a::1,TCP,74,54628  >  443 [ACK] Seq=3257 Ack=590251 Win=1029 Len=0,0.000145,Wikipedia,0.000144
230,14.291759,2620:0:861:ed1a::1,2600:8805:3d03:3f00:88c9:1a5:bc23:ce61,TLSv1.2,15914,Application Data,0.000989,Wikipedia,0.000989
231,14.291861,2600:8805:3d03:3f00:88c9:1a5:bc23:ce61,2620:0:861:ed1a::1,TCP,74,54628  >  443 [ACK] Seq=3257 Ack=606091 Win=1029 Len=0,0.000102,Wikipedia,0.000102
232,14.292179,2620:0:861:ed1a::1,2600:8805:3d03:3f00:88c9:1a5:bc23:ce61,TLSv1.2,13034,Application Data,0.000318,Wikipedia,0.000318
233,14.292179,2620:0:861:ed1a::1,2600:8805:3d03:3f00:88c9:1a5:bc23:ce61,TLSv1.2,913,Application Data,0,Wikipedia,0
234,14.292253,2600:8805:3d03:3f00:88c9:1a5:bc23:ce61,2620:0:861:ed1a::1,TCP,74,54628  >  443 [ACK] Seq=3257 Ack=619890 Win=1029 Len=0,7.4E-05,Wikipedia,0.000073
235,14.304503,2600:8805:3d03:3f00:88c9:1a5:bc23:ce61,2620:0:861:ed1a::1,TLSv1.2,405,Application Data,0.01225,Wikipedia,0.012249
236,14.322169,2620:0:861:ed1a::1,2600:8805:3d03:3f00:88c9:1a5:bc23:ce61,TCP,1514,443  >  54628 [ACK] Seq=619890 Ack=3588 Win=83 Len=1440 [TCP segment of a reassembled PDU],0.017666,Wikipedia,0.017666
237,14.322657,2620:0:861:ed1a::1,2600:8805:3d03:3f00:88c9:1a5:bc23:ce61,TCP,13034,443  >  54628 [ACK] Seq=621330 Ack=3588 Win=83 Len=12960 [TCP segment of a reassembled PDU],0.000488,Wikipedia,0.000487
238,14.322657,2620:0:861:ed1a::1,2600:8805:3d03:3f00:88c9:1a5:bc23:ce61,TLSv1.2,344,Application Data,0,Wikipedia,0
239,14.322657,2620:0:861:ed1a::1,2600:8805:3d03:3f00:88c9:1a5:bc23:ce61,TCP,4394,443  >  54628 [ACK] Seq=634560 Ack=3588 Win=83 Len=4320 [TCP segment of a reassembled PDU],0,Wikipedia,0
240,14.322657,2620:0:861:ed1a::1,2600:8805:3d03:3f00:88c9:1a5:bc23:ce61,TLSv1.2,149,Application Data,0,Wikipedia,0
241,14.322881,2600:8805:3d03:3f00:88c9:1a5:bc23:ce61,2620:0:861:ed1a::1,TCP,74,54628  >  443 [ACK] Seq=3588 Ack=638955 Win=1029 Len=0,0.000224,Wikipedia,0.000224
242,14.39114,2600:8805:3d03:3f00:88c9:1a5:bc23:ce61,2620:0:861:ed1a::1,TLSv1.2,215,Application Data,0.068259,Wikipedia,0.068258
243,14.391195,2600:8805:3d03:3f00:88c9:1a5:bc23:ce61,2620:0:861:ed1a::1,TLSv1.2,149,Application Data,5.5E-05,Wikipedia,0.000054
244,14.391223,2600:8805:3d03:3f00:88c9:1a5:bc23:ce61,2620:0:861:ed1a::1,TLSv1.2,149,Application Data,2.8E-05,Wikipedia,0.000028
245,14.391251,2600:8805:3d03:3f00:88c9:1a5:bc23:ce61,2620:0:861:ed1a::1,TLSv1.2,149,Application Data,2.8E-05,Wikipedia,0.000028
246,14.391276,2600:8805:3d03:3f00:88c9:1a5:bc23:ce61,2620:0:861:ed1a::1,TLSv1.2,149,Application Data,2.5E-05,Wikipedia,0.000024
247,14.391303,2600:8805:3d03:3f00:88c9:1a5:bc23:ce61,2620:0:861:ed1a::1,TLSv1.2,229,Application Data,2.7E-05,Wikipedia,0.000027
248,14.391323,2600:8805:3d03:3f00:88c9:1a5:bc23:ce61,2620:0:861:ed1a::1,TLSv1.2,792,Application Data,2E-05,Wikipedia,0.000019
249,14.391344,2600:8805:3d03:3f00:88c9:1a5:bc23:ce61,2620:0:861:ed1a::1,TLSv1.2,793,Application Data,2.1E-05,Wikipedia,0.000021
250,14.39136,2600:8805:3d03:3f00:88c9:1a5:bc23:ce61,2620:0:861:ed1a::1,TLSv1.2,789,Application Data,1.6E-05,Wikipedia,0.000016
251,14.391377,2600:8805:3d03:3f00:88c9:1a5:bc23:ce61,2620:0:861:ed1a::1,TLSv1.2,790,Application Data,1.7E-05,Wikipedia,0.000016
252,14.391395,2600:8805:3d03:3f00:88c9:1a5:bc23:ce61,2620:0:861:ed1a::1,TLSv1.2,795,Application Data,1.8E-05,Wikipedia,0.000017
253,14.391413,2600:8805:3d03:3f00:88c9:1a5:bc23:ce61,2620:0:861:ed1a::1,TLSv1.2,791,Application Data,1.8E-05,Wikipedia,0.000018
254,14.407413,2620:0:861:ed1a::1,2600:8805:3d03:3f00:88c9:1a5:bc23:ce61,TCP,74,443  >  54628 [ACK] Seq=638955 Ack=5621 Win=80 Len=0,0.016,Wikipedia,0.016
255,14.407413,2620:0:861:ed1a::1,2600:8805:3d03:3f00:88c9:1a5:bc23:ce61,TLSv1.2,135,Application Data,0,Wikipedia,0
256,14.410814,2620:0:861:ed1a::1,2600:8805:3d03:3f00:88c9:1a5:bc23:ce61,TLSv1.2,1796,"Application Data, Application Data",0.003401,Wikipedia,0.003401
